sen	verb	verb_idx	cop	cop_idx	child	child_idx	child_features	child_upos	head	head_idx	head_features	head_upos	distance	attractors	metadata	swap_head	feature_vals	prefix	wrong_sen	congruent_attractors	incongruent_attractors	num_attractors	num_congruent_attractors	num_incongruent_attractors	has_attractors	only_has_congruent_attractors	only_has_incongruent_attractors	sample_weight	phenomenon	lang	grammatical_feature	ungrammatical_feature	wo	inflect_item	agreement_certainty
Zu den Instrumenten einer Friedensmission zählen die Einsetzung von Untersuchungskommissionen, Vermittlungen zwischen Konfliktparteien, Anrufung des internationalen Gerichtshofes in Den Haag soweit sich diesem die Streitpartei unterworfen hat, die Bildung von UN - kontrollierten Pufferzonen, die Entsendung von Wahlbeobachtern wie z.	unterworfen				Streitpartei		{'lemma': 'Streitpartei', 'Number': 'Sing'}	NOUN	hat,				2	[]	{'sent_id': 'train-s13352', 'text': 'Zu den Instrumenten einer Friedensmission zählen die Einsetzung von Untersuchungskommissionen, Vermittlungen zwischen Konfliktparteien, Anrufung des internationalen Gerichtshofes in Den Haag soweit sich diesem beide Streitparteien unterworfen haben, die Bildung von UN - kontrollierten Pufferzonen, die Entsendung von Wahlbeobachtern wie z.', 'treebank': 'UD_German-GSD/de_gsd-ud-train.conllu', 'multiblimp_extended': True, 'pair_id': 'deu_0261', 'extended_role': 'sg'}	haben,	SG -> PL	Zu den Instrumenten einer Friedensmission zählen die Einsetzung von Untersuchungskommissionen, Vermittlungen zwischen Konfliktparteien, Anrufung des internationalen Gerichtshofes in Den Haag soweit sich diesem die Streitpartei unterworfen	Zu den Instrumenten einer Friedensmission zählen die Einsetzung von Untersuchungskommissionen, Vermittlungen zwischen Konfliktparteien, Anrufung des internationalen Gerichtshofes in Den Haag soweit sich diesem die Streitpartei unterworfen haben, die Bildung von UN - kontrollierten Pufferzonen, die Entsendung von Wahlbeobachtern wie z.	[]	[]	0	0	0	False	False	False	0.0001107989545824	SV-#	deu	SG	PL	SV	aux	+
Zu den Instrumenten einer Friedensmission zählen die Einsetzung von Untersuchungskommissionen, Vermittlungen zwischen Konfliktparteien, Anrufung des internationalen Gerichtshofes in Den Haag soweit sich diesem beide Streitparteien unterworfen haben, die Bildung von UN - kontrollierten Pufferzonen, die Entsendung von Wahlbeobachtern wie z.	unterworfen				Streitparteien		{'Case': 'Acc', 'Gender': 'Fem', 'Number': 'Plur', 'lemma': 'Streitpartei'}	NOUN	haben,				2	[]	{'sent_id': 'train-s13352', 'text': 'Zu den Instrumenten einer Friedensmission zählen die Einsetzung von Untersuchungskommissionen, Vermittlungen zwischen Konfliktparteien, Anrufung des internationalen Gerichtshofes in Den Haag soweit sich diesem beide Streitparteien unterworfen haben, die Bildung von UN - kontrollierten Pufferzonen, die Entsendung von Wahlbeobachtern wie z.', 'treebank': 'UD_German-GSD/de_gsd-ud-train.conllu', 'multiblimp_extended': True, 'pair_id': 'deu_0261', 'extended_role': 'pl'}	hat,	PL -> SG	Zu den Instrumenten einer Friedensmission zählen die Einsetzung von Untersuchungskommissionen, Vermittlungen zwischen Konfliktparteien, Anrufung des internationalen Gerichtshofes in Den Haag soweit sich diesem beide Streitparteien unterworfen	Zu den Instrumenten einer Friedensmission zählen die Einsetzung von Untersuchungskommissionen, Vermittlungen zwischen Konfliktparteien, Anrufung des internationalen Gerichtshofes in Den Haag soweit sich diesem beide Streitparteien unterworfen hat, die Bildung von UN - kontrollierten Pufferzonen, die Entsendung von Wahlbeobachtern wie z.	[]	[]	0	0	0	False	False	False	0.0001107989545824	SV-#	deu	PL	SG	SV	aux	+
Und hormonhaltiges Präparat kann unerwünschte Wirkungen haben.	haben				Präparat		{'lemma': 'Präparat', 'Number': 'Sing'}	NOUN	kann				1	[]	{'sent_id': 'test-s959', 'text': 'Und hormonhaltige Präparate können unerwünschte Wirkungen haben.', 'treebank': 'UD_German-GSD/de_gsd-ud-test.conllu', 'multiblimp_extended': True, 'pair_id': 'deu_0262', 'extended_role': 'sg'}	können	SG -> PL	Und hormonhaltiges Präparat	Und hormonhaltiges Präparat können unerwünschte Wirkungen haben.	[]	[]	0	0	0	False	False	False	1.5121445414472829e-05	SV-#	deu	SG	PL	SV	aux	+
Und hormonhaltige Präparate können unerwünschte Wirkungen haben.	haben				Präparate		{'Case': 'Nom', 'Gender': 'Neut', 'Number': 'Plur', 'lemma': 'Präparat'}	NOUN	können				1	[]	{'sent_id': 'test-s959', 'text': 'Und hormonhaltige Präparate können unerwünschte Wirkungen haben.', 'treebank': 'UD_German-GSD/de_gsd-ud-test.conllu', 'multiblimp_extended': True, 'pair_id': 'deu_0262', 'extended_role': 'pl'}	kann	PL -> SG	Und hormonhaltige Präparate	Und hormonhaltige Präparate kann unerwünschte Wirkungen haben.	[]	[]	0	0	0	False	False	False	1.5121445414472829e-05	SV-#	deu	PL	SG	SV	aux	+
Denn ein Medikament kann süchtig machen und DIE EIGENTLICHEN PROBLEME WERDEN DADURCH NICHT GELÖST.	machen				Medikament		{'lemma': 'Medikament', 'Number': 'Sing'}	NOUN	kann				1	[]	{'sent_id': 'train-s1478', 'text': 'Denn Medikamente können süchtig machen und DIE EIGENTLICHEN PROBLEME WERDEN DADURCH NICHT GELÖST.', 'treebank': 'UD_German-GSD/de_gsd-ud-train.conllu', 'multiblimp_extended': True, 'pair_id': 'deu_0263', 'extended_role': 'sg'}	können	SG -> PL	Denn ein Medikament	Denn ein Medikament können süchtig machen und DIE EIGENTLICHEN PROBLEME WERDEN DADURCH NICHT GELÖST.	[]	[]	0	0	0	False	False	False	1.5121445414472829e-05	SV-#	deu	SG	PL	SV	aux	+
Denn Medikamente können süchtig machen und DIE EIGENTLICHEN PROBLEME WERDEN DADURCH NICHT GELÖST.	machen				Medikamente		{'Case': 'Acc', 'Gender': 'Neut', 'Number': 'Plur', 'lemma': 'Medikament'}	NOUN	können				1	[]	{'sent_id': 'train-s1478', 'text': 'Denn Medikamente können süchtig machen und DIE EIGENTLICHEN PROBLEME WERDEN DADURCH NICHT GELÖST.', 'treebank': 'UD_German-GSD/de_gsd-ud-train.conllu', 'multiblimp_extended': True, 'pair_id': 'deu_0263', 'extended_role': 'pl'}	kann	PL -> SG	Denn Medikamente	Denn Medikamente kann süchtig machen und DIE EIGENTLICHEN PROBLEME WERDEN DADURCH NICHT GELÖST.	[]	[]	0	0	0	False	False	False	1.5121445414472829e-05	SV-#	deu	PL	SG	SV	aux	+
Die meiste Person würde WLAN an dem Flughafen nützlicher finden als die Möglichkeit, E-Mails von dem Flugzeug aus zu verschicken.	finden				Person		{'lemma': 'Leute', 'Number': 'Sing'}	NOUN	würde				1	[]	"{'sent_id': 'n01017013', 'text': 'Die meisten Leute würden WLAN am Flughafen nützlicher finden als die Möglichkeit, E-Mails vom Flugzeug aus zu verschicken.', 'text_en': '""Most people would find airport wi-fi more useful than being able to send emails on a plane.""', 'treebank': 'UD_German-PUD/de_pud-ud-test.conllu', 'multiblimp_extended': True, 'pair_id': 'deu_0264', 'extended_role': 'sg'}"	würden	SG -> PL	Die meiste Person	Die meiste Person würden WLAN an dem Flughafen nützlicher finden als die Möglichkeit, E-Mails von dem Flugzeug aus zu verschicken.	[]	[]	0	0	0	False	False	False	3.906373398738815e-05	SV-#	deu	SG	PL	SV	aux	+
Die meisten Leute würden WLAN an dem Flughafen nützlicher finden als die Möglichkeit, E-Mails von dem Flugzeug aus zu verschicken.	finden				Leute		{'Case': 'Nom', 'Number': 'Plur', 'lemma': 'Leute'}	NOUN	würden				1	[]	"{'sent_id': 'n01017013', 'text': 'Die meisten Leute würden WLAN am Flughafen nützlicher finden als die Möglichkeit, E-Mails vom Flugzeug aus zu verschicken.', 'text_en': '""Most people would find airport wi-fi more useful than being able to send emails on a plane.""', 'treebank': 'UD_German-PUD/de_pud-ud-test.conllu', 'multiblimp_extended': True, 'pair_id': 'deu_0264', 'extended_role': 'pl'}"	würde	PL -> SG	Die meisten Leute	Die meisten Leute würde WLAN an dem Flughafen nützlicher finden als die Möglichkeit, E-Mails von dem Flugzeug aus zu verschicken.	[]	[]	0	0	0	False	False	False	3.906373398738815e-05	SV-#	deu	PL	SG	SV	aux	+
Diese Halle, die selbst bereits als architektonisches Denkmal angesehen werden kann, beherbergt heute Museen: In der südlichen Halle befindet sich das Autoworld Museum mit einer großen Oldtimer - Sammlung.	beherbergen				Halle		{'lemma': 'Halle', 'Number': 'Sing'}	NOUN	beherbergt				12	[]	{'sent_id': 'train-s10069', 'text': 'Diese beiden Hallen, die selbst bereits als architektonische Denkmäler angesehen werden können, beherbergen heute Museen: In der südlichen Halle befindet sich das Autoworld Museum mit einer großen Oldtimer - Sammlung.', 'treebank': 'UD_German-GSD/de_gsd-ud-train.conllu', 'multiblimp_extended': True, 'pair_id': 'deu_0265', 'extended_role': 'sg'}	beherbergen	SG -> PL	Diese Halle, die selbst bereits als architektonisches Denkmal angesehen werden kann,	Diese Halle, die selbst bereits als architektonisches Denkmal angesehen werden kann, beherbergen heute Museen: In der südlichen Halle befindet sich das Autoworld Museum mit einer großen Oldtimer - Sammlung.	[]	[]	0	0	0	False	False	False	0.0423678706278709	SV-#	deu	SG	PL	SV	verb	+
Diese beiden Hallen, die selbst bereits als architektonische Denkmäler angesehen werden können, beherbergen heute Museen: In der südlichen Halle befindet sich das Autoworld Museum mit einer großen Oldtimer - Sammlung.	beherbergen				Hallen		{'Case': 'Nom', 'Gender': 'Fem', 'Number': 'Plur', 'lemma': 'Halle'}	NOUN	beherbergen				12	[]	{'sent_id': 'train-s10069', 'text': 'Diese beiden Hallen, die selbst bereits als architektonische Denkmäler angesehen werden können, beherbergen heute Museen: In der südlichen Halle befindet sich das Autoworld Museum mit einer großen Oldtimer - Sammlung.', 'treebank': 'UD_German-GSD/de_gsd-ud-train.conllu', 'multiblimp_extended': True, 'pair_id': 'deu_0265', 'extended_role': 'pl'}	beherbergt	PL -> SG	Diese beiden Hallen, die selbst bereits als architektonische Denkmäler angesehen werden können,	Diese beiden Hallen, die selbst bereits als architektonische Denkmäler angesehen werden können, beherbergt heute Museen: In der südlichen Halle befindet sich das Autoworld Museum mit einer großen Oldtimer - Sammlung.	[]	[]	0	0	0	False	False	False	0.0423678706278709	SV-#	deu	PL	SG	SV	verb	+
Positive Aussage des japanischen Verwaltungsministers Takami Eto zu der Kolonialherrschaft in Südkorea belastet die Beziehungen zwischen beiden Staaten.	belasten				Aussage		{'lemma': 'Aussage', 'Number': 'Sing'}	NOUN	belastet				11	[]	{'sent_id': 'test-s346', 'text': 'Positive Aussagen des japanischen Verwaltungsministers Takami Eto zur Kolonialherrschaft in Südkorea belasten die Beziehungen zwischen beiden Staaten.', 'treebank': 'UD_German-GSD/de_gsd-ud-test.conllu', 'multiblimp_extended': True, 'pair_id': 'deu_0266', 'extended_role': 'sg'}	belasten	SG -> PL	Positive Aussage des japanischen Verwaltungsministers Takami Eto zu der Kolonialherrschaft in Südkorea	Positive Aussage des japanischen Verwaltungsministers Takami Eto zu der Kolonialherrschaft in Südkorea belasten die Beziehungen zwischen beiden Staaten.	[]	[]	0	0	0	False	False	False	0.019417673068976	SV-#	deu	SG	PL	SV	verb	+
Positive Aussagen des japanischen Verwaltungsministers Takami Eto zu der Kolonialherrschaft in Südkorea belasten die Beziehungen zwischen beiden Staaten.	belasten				Aussagen		{'Case': 'Nom', 'Gender': 'Fem', 'Number': 'Plur', 'lemma': 'Aussage'}	NOUN	belasten				11	[]	{'sent_id': 'test-s346', 'text': 'Positive Aussagen des japanischen Verwaltungsministers Takami Eto zur Kolonialherrschaft in Südkorea belasten die Beziehungen zwischen beiden Staaten.', 'treebank': 'UD_German-GSD/de_gsd-ud-test.conllu', 'multiblimp_extended': True, 'pair_id': 'deu_0266', 'extended_role': 'pl'}	belastet	PL -> SG	Positive Aussagen des japanischen Verwaltungsministers Takami Eto zu der Kolonialherrschaft in Südkorea	Positive Aussagen des japanischen Verwaltungsministers Takami Eto zu der Kolonialherrschaft in Südkorea belastet die Beziehungen zwischen beiden Staaten.	[]	[]	0	0	0	False	False	False	0.019417673068976	SV-#	deu	PL	SG	SV	verb	+
"Bei der letzten Volkszählung von 2002 bekannten sich von den damals 129.946 Einwohnern, 89,9 % zu der polnischen Nationalität, 3.279 Person (2,5 %) bezeichnete sich als Deutsche, 921 (0,7 %) als ""Schlesier""."	bezeichneten				Person		{'lemma': 'Person', 'Number': 'Sing'}	NOUN	bezeichnete				5	[]	"{'sent_id': 'train-s8076', 'text': 'Bei der letzten Volkszählung von 2002 bekannten sich von den damals 129.946 Einwohnern, 89,9 % zur polnischen Nationalität, 3.279 Personen (2,5 %) bezeichneten sich als Deutsche, 921 (0,7 %) als ""Schlesier"".', 'treebank': 'UD_German-GSD/de_gsd-ud-train.conllu', 'multiblimp_extended': True, 'pair_id': 'deu_0267', 'extended_role': 'sg'}"	bezeichneten	SG -> PL	Bei der letzten Volkszählung von 2002 bekannten sich von den damals 129.946 Einwohnern, 89,9 % zu der polnischen Nationalität, 3.279 Person (2,5 %)	"Bei der letzten Volkszählung von 2002 bekannten sich von den damals 129.946 Einwohnern, 89,9 % zu der polnischen Nationalität, 3.279 Person (2,5 %) bezeichneten sich als Deutsche, 921 (0,7 %) als ""Schlesier""."	[]	[]	0	0	0	False	False	False	0.0146096105613348	SV-#	deu	SG	PL	SV	verb	+
"Bei der letzten Volkszählung von 2002 bekannten sich von den damals 129.946 Einwohnern, 89,9 % zu der polnischen Nationalität, 3.279 Personen (2,5 %) bezeichneten sich als Deutsche, 921 (0,7 %) als ""Schlesier""."	bezeichneten				Personen		{'Case': 'Nom', 'Gender': 'Fem', 'Number': 'Plur', 'lemma': 'Person'}	NOUN	bezeichneten				5	[]	"{'sent_id': 'train-s8076', 'text': 'Bei der letzten Volkszählung von 2002 bekannten sich von den damals 129.946 Einwohnern, 89,9 % zur polnischen Nationalität, 3.279 Personen (2,5 %) bezeichneten sich als Deutsche, 921 (0,7 %) als ""Schlesier"".', 'treebank': 'UD_German-GSD/de_gsd-ud-train.conllu', 'multiblimp_extended': True, 'pair_id': 'deu_0267', 'extended_role': 'pl'}"	bezeichnete	PL -> SG	Bei der letzten Volkszählung von 2002 bekannten sich von den damals 129.946 Einwohnern, 89,9 % zu der polnischen Nationalität, 3.279 Personen (2,5 %)	"Bei der letzten Volkszählung von 2002 bekannten sich von den damals 129.946 Einwohnern, 89,9 % zu der polnischen Nationalität, 3.279 Personen (2,5 %) bezeichnete sich als Deutsche, 921 (0,7 %) als ""Schlesier""."	[]	[]	0	0	0	False	False	False	0.0146096105613348	SV-#	deu	PL	SG	SV	verb	+
Weiterer Anteil von 7,6 % der Grünfläche entfällt auf Wälder, 7,5 % auf Kleingärten und 7,7 % auf Wiesen.	entfallen				Anteil		{'lemma': '%', 'Number': 'Sing'}	NOUN	entfällt				3	[]	{'sent_id': 'train-s10494', 'text': 'Weitere 7,6 % der Grünfläche entfallen auf Wälder, 7,5 % auf Kleingärten und 7,7 % auf Wiesen.', 'treebank': 'UD_German-GSD/de_gsd-ud-train.conllu', 'multiblimp_extended': True, 'pair_id': 'deu_0268', 'extended_role': 'sg'}	entfallen	SG -> PL	Weiterer Anteil von 7,6 % der Grünfläche	Weiterer Anteil von 7,6 % der Grünfläche entfallen auf Wälder, 7,5 % auf Kleingärten und 7,7 % auf Wiesen.	[]	[]	0	0	0	False	False	False	0.0002353657341694	SV-#	deu	SG	PL	SV	verb	+
Weitere 7,6 % der Grünfläche entfallen auf Wälder, 7,5 % auf Kleingärten und 7,7 % auf Wiesen.	entfallen				%		{'Case': 'Nom', 'Gender': 'Neut', 'Number': 'Plur', 'lemma': '%'}	NOUN	entfallen				3	[]	{'sent_id': 'train-s10494', 'text': 'Weitere 7,6 % der Grünfläche entfallen auf Wälder, 7,5 % auf Kleingärten und 7,7 % auf Wiesen.', 'treebank': 'UD_German-GSD/de_gsd-ud-train.conllu', 'multiblimp_extended': True, 'pair_id': 'deu_0268', 'extended_role': 'pl'}	entfällt	PL -> SG	Weitere 7,6 % der Grünfläche	Weitere 7,6 % der Grünfläche entfällt auf Wälder, 7,5 % auf Kleingärten und 7,7 % auf Wiesen.	[]	[]	0	0	0	False	False	False	0.0002353657341694	SV-#	deu	PL	SG	SV	verb	+
"Der Nachkomme des Jan Hrb auf Studnice nannte sich nach dem Dorf, und ist heute als ""von Studnitz"" eine der ältesten noch existierenden mährischen Adelsfamilien."	nannten				Nachkomme		{'lemma': 'Nachkomme', 'Number': 'Sing'}	NOUN	nannte				6	[]	"{'sent_id': 'train-s7689', 'text': 'Die Nachkommen des Jan Hrb auf Studnice nannten sich nach dem Dorf, und sind heute als ""von Studnitz"" eines der ältesten noch existierenden mährischen Adelsfamilien.', 'treebank': 'UD_German-GSD/de_gsd-ud-train.conllu', 'multiblimp_extended': True, 'pair_id': 'deu_0269', 'extended_role': 'sg'}"	nannten	SG -> PL	Der Nachkomme des Jan Hrb auf Studnice	"Der Nachkomme des Jan Hrb auf Studnice nannten sich nach dem Dorf, und sind heute als ""von Studnitz"" eines der ältesten noch existierenden mährischen Adelsfamilien."	[]	[]	0	0	0	False	False	False	0.0022844321257618	SV-#	deu	SG	PL	SV	verb	+
"Die Nachkommen des Jan Hrb auf Studnice nannten sich nach dem Dorf, und sind heute als ""von Studnitz"" eines der ältesten noch existierenden mährischen Adelsfamilien."	nannten				Nachkommen		{'Case': 'Nom', 'Gender': 'Masc', 'Number': 'Plur', 'lemma': 'Nachkomme'}	NOUN	nannten				6	[]	"{'sent_id': 'train-s7689', 'text': 'Die Nachkommen des Jan Hrb auf Studnice nannten sich nach dem Dorf, und sind heute als ""von Studnitz"" eines der ältesten noch existierenden mährischen Adelsfamilien.', 'treebank': 'UD_German-GSD/de_gsd-ud-train.conllu', 'multiblimp_extended': True, 'pair_id': 'deu_0269', 'extended_role': 'pl'}"	nannte	PL -> SG	Die Nachkommen des Jan Hrb auf Studnice	"Die Nachkommen des Jan Hrb auf Studnice nannte sich nach dem Dorf, und ist heute als ""von Studnitz"" eine der ältesten noch existierenden mährischen Adelsfamilien."	[]	[]	0	0	0	False	False	False	0.0022844321257618	SV-#	deu	PL	SG	SV	verb	+
Es zeigte sich, dass die Kultur von Bonu Ighinu und Ozieri, eventuell verbunden über San Ciriaco, Phase ein und derselben Kultur darstellt.	darstellen				Kultur		{'lemma': 'Kultur', 'Number': 'Sing'}	NOUN	darstellt.				18	[]	{'sent_id': 'train-s13301', 'text': 'Es zeigte sich, dass die Kulturen von Bonu Ighinu und Ozieri, eventuell verbunden über San Ciriaco, Phasen ein und derselben Kultur darstellen.', 'treebank': 'UD_German-GSD/de_gsd-ud-train.conllu', 'multiblimp_extended': True, 'pair_id': 'deu_0270', 'extended_role': 'sg'}	darstellen.	SG -> PL	Es zeigte sich, dass die Kultur von Bonu Ighinu und Ozieri, eventuell verbunden über San Ciriaco, Phase ein und derselben Kultur	Es zeigte sich, dass die Kultur von Bonu Ighinu und Ozieri, eventuell verbunden über San Ciriaco, Phase ein und derselben Kultur darstellen.	[]	[]	0	0	0	False	False	False	0.0190080175189976	SV-#	deu	SG	PL	SV	verb	+
Es zeigte sich, dass die Kulturen von Bonu Ighinu und Ozieri, eventuell verbunden über San Ciriaco, Phasen ein und derselben Kultur darstellen.	darstellen				Kulturen		{'Case': 'Nom', 'Gender': 'Fem', 'Number': 'Plur', 'lemma': 'Kultur'}	NOUN	darstellen.				18	[]	{'sent_id': 'train-s13301', 'text': 'Es zeigte sich, dass die Kulturen von Bonu Ighinu und Ozieri, eventuell verbunden über San Ciriaco, Phasen ein und derselben Kultur darstellen.', 'treebank': 'UD_German-GSD/de_gsd-ud-train.conllu', 'multiblimp_extended': True, 'pair_id': 'deu_0270', 'extended_role': 'pl'}	darstellt.	PL -> SG	Es zeigte sich, dass die Kulturen von Bonu Ighinu und Ozieri, eventuell verbunden über San Ciriaco, Phasen ein und derselben Kultur	Es zeigte sich, dass die Kulturen von Bonu Ighinu und Ozieri, eventuell verbunden über San Ciriaco, Phasen ein und derselben Kultur darstellt.	[]	[]	0	0	0	False	False	False	0.0190080175189976	SV-#	deu	PL	SG	SV	verb	+
Sein guter Kontakt zu den ehemaligen Kollegen in dem Aufsichtsrat, Brandi, Haniel und Reusch, verschaffte ihm lukrative Anzeigenaufträge, die für einen reinen Anzeigenverkäufer unerreichbar gewesen wären.	verschafften				Kontakt		{'lemma': 'Kontakt', 'Number': 'Sing'}	NOUN	verschaffte				15	[]	{'sent_id': 'train-s2264', 'text': 'Seine guten Kontakte zu den ehemaligen Kollegen im Aufsichtsrat, Brandi, Haniel und Reusch, verschafften ihm lukrative Anzeigenaufträge, die für einen reinen Anzeigenverkäufer unerreichbar gewesen wären.', 'treebank': 'UD_German-GSD/de_gsd-ud-train.conllu', 'multiblimp_extended': True, 'pair_id': 'deu_0271', 'extended_role': 'sg'}	verschafften	SG -> PL	Sein guter Kontakt zu den ehemaligen Kollegen in dem Aufsichtsrat, Brandi, Haniel und Reusch,	Sein guter Kontakt zu den ehemaligen Kollegen in dem Aufsichtsrat, Brandi, Haniel und Reusch, verschafften ihm lukrative Anzeigenaufträge, die für einen reinen Anzeigenverkäufer unerreichbar gewesen wären.	[]	[]	0	0	0	False	False	False	0.005430862148285	SV-#	deu	SG	PL	SV	verb	+
Seine guten Kontakte zu den ehemaligen Kollegen in dem Aufsichtsrat, Brandi, Haniel und Reusch, verschafften ihm lukrative Anzeigenaufträge, die für einen reinen Anzeigenverkäufer unerreichbar gewesen wären.	verschafften				Kontakte		{'Case': 'Nom', 'Gender': 'Masc', 'Number': 'Plur', 'lemma': 'Kontakt'}	NOUN	verschafften				15	[]	{'sent_id': 'train-s2264', 'text': 'Seine guten Kontakte zu den ehemaligen Kollegen im Aufsichtsrat, Brandi, Haniel und Reusch, verschafften ihm lukrative Anzeigenaufträge, die für einen reinen Anzeigenverkäufer unerreichbar gewesen wären.', 'treebank': 'UD_German-GSD/de_gsd-ud-train.conllu', 'multiblimp_extended': True, 'pair_id': 'deu_0271', 'extended_role': 'pl'}	verschaffte	PL -> SG	Seine guten Kontakte zu den ehemaligen Kollegen in dem Aufsichtsrat, Brandi, Haniel und Reusch,	Seine guten Kontakte zu den ehemaligen Kollegen in dem Aufsichtsrat, Brandi, Haniel und Reusch, verschaffte ihm lukrative Anzeigenaufträge, die für einen reinen Anzeigenverkäufer unerreichbar gewesen wären.	[]	[]	0	0	0	False	False	False	0.005430862148285	SV-#	deu	PL	SG	SV	verb	+
Das amtierende Arbeiterratsmitglied (Sozialdemokraten) erleidet eine schwere Niederlage, das sich ebenfalls zu der Wahl gestellt hatte.	erleiden				Arbeiterratsmitglied		{'lemma': 'Arbeiterratsmitglieder', 'Number': 'Sing'}	NOUN	erleidet				4	[]	{'sent_id': 'train-s13894', 'text': 'Die amtierenden Arbeiterratsmitglieder (Sozialdemokraten) erleiden eine schwere Niederlage, die sich ebenfalls zur Wahl gestellt hatten.', 'treebank': 'UD_German-GSD/de_gsd-ud-train.conllu', 'multiblimp_extended': True, 'pair_id': 'deu_0272', 'extended_role': 'sg'}	erleiden	SG -> PL	Das amtierende Arbeiterratsmitglied (Sozialdemokraten)	Das amtierende Arbeiterratsmitglied (Sozialdemokraten) erleiden eine schwere Niederlage, die sich ebenfalls zu der Wahl gestellt hatten.	[]	[]	0	0	0	False	False	False	0.0134501176596415	SV-#	deu	SG	PL	SV	verb	+
Die amtierenden Arbeiterratsmitglieder (Sozialdemokraten) erleiden eine schwere Niederlage, die sich ebenfalls zu der Wahl gestellt hatten.	erleiden				Arbeiterratsmitglieder		{'Case': 'Nom', 'Gender': 'Neut', 'Number': 'Plur', 'lemma': 'Arbeiterratsmitglieder'}	NOUN	erleiden				4	[]	{'sent_id': 'train-s13894', 'text': 'Die amtierenden Arbeiterratsmitglieder (Sozialdemokraten) erleiden eine schwere Niederlage, die sich ebenfalls zur Wahl gestellt hatten.', 'treebank': 'UD_German-GSD/de_gsd-ud-train.conllu', 'multiblimp_extended': True, 'pair_id': 'deu_0272', 'extended_role': 'pl'}	erleidet	PL -> SG	Die amtierenden Arbeiterratsmitglieder (Sozialdemokraten)	Die amtierenden Arbeiterratsmitglieder (Sozialdemokraten) erleidet eine schwere Niederlage, das sich ebenfalls zu der Wahl gestellt hatte.	[]	[]	0	0	0	False	False	False	0.0134501176596415	SV-#	deu	PL	SG	SV	verb	+
Inhibitor, darunter wichtige Medikamente und Gifte, ändert die Eigenschaften von Enzymen und hemmt die enzymatische Reaktion.	ändern				Inhibitor		{'lemma': 'Inhibitoren', 'Number': 'Sing'}	NOUN	ändert				8	[]	{'sent_id': 'train-s9462', 'text': 'Inhibitoren, darunter wichtige Medikamente und Gifte, ändern die Eigenschaften von Enzymen und hemmen die enzymatische Reaktion.', 'treebank': 'UD_German-GSD/de_gsd-ud-train.conllu', 'multiblimp_extended': True, 'pair_id': 'deu_0273', 'extended_role': 'sg'}	ändern	SG -> PL	Inhibitor, darunter wichtige Medikamente und Gifte,	Inhibitor, darunter wichtige Medikamente und Gifte, ändern die Eigenschaften von Enzymen und hemmen die enzymatische Reaktion.	[]	[]	0	0	0	False	False	False	0.0211839353139354	SV-#	deu	SG	PL	SV	verb	+
Inhibitoren, darunter wichtige Medikamente und Gifte, ändern die Eigenschaften von Enzymen und hemmen die enzymatische Reaktion.	ändern				Inhibitoren		{'Case': 'Nom', 'Gender': 'Masc', 'Number': 'Plur', 'lemma': 'Inhibitoren'}	NOUN	ändern				8	[]	{'sent_id': 'train-s9462', 'text': 'Inhibitoren, darunter wichtige Medikamente und Gifte, ändern die Eigenschaften von Enzymen und hemmen die enzymatische Reaktion.', 'treebank': 'UD_German-GSD/de_gsd-ud-train.conllu', 'multiblimp_extended': True, 'pair_id': 'deu_0273', 'extended_role': 'pl'}	ändert	PL -> SG	Inhibitoren, darunter wichtige Medikamente und Gifte,	Inhibitoren, darunter wichtige Medikamente und Gifte, ändert die Eigenschaften von Enzymen und hemmt die enzymatische Reaktion.	[]	[]	0	0	0	False	False	False	0.0211839353139354	SV-#	deu	PL	SG	SV	verb	+
Während jede Apotheke heutzutage mit unmotivierten Mitarbeitern den Kunden eher vergrault, findet man hier in Warendorf motivierte Mitarbeiter die stets freundlich sind.	vergraulen				Apotheke		{'lemma': 'Apotheke', 'Number': 'Sing'}	NOUN	vergrault,				8	[]	{'sent_id': 'test-s277', 'text': 'Während viele Apotheken heutzutage mit unmotivierten Mitarbeitern den Kunden eher vergraulen, findet man hier in Warendorf motivierte Mitarbeiter die stets freundlich sind.', 'treebank': 'UD_German-GSD/de_gsd-ud-test.conllu', 'multiblimp_extended': True, 'pair_id': 'deu_0274', 'extended_role': 'sg'}	vergraulen,	SG -> PL	Während jede Apotheke heutzutage mit unmotivierten Mitarbeitern den Kunden eher	Während jede Apotheke heutzutage mit unmotivierten Mitarbeitern den Kunden eher vergraulen, findet man hier in Warendorf motivierte Mitarbeiter die stets freundlich sind.	[]	[]	0	0	0	False	False	False	0.0423678706278709	SV-#	deu	SG	PL	SV	verb	+
