sen	verb	verb_idx	cop	cop_idx	child	child_idx	child_features	child_upos	head	head_idx	head_features	head_upos	distance	attractors	metadata	swap_head	feature_vals	prefix	wrong_sen	congruent_attractors	incongruent_attractors	num_attractors	num_congruent_attractors	num_incongruent_attractors	has_attractors	only_has_congruent_attractors	only_has_incongruent_attractors	sample_weight	phenomenon	lang	grammatical_feature	ungrammatical_feature	wo	inflect_item	agreement_certainty
Die Modellbezeichnung Electra hatte bei Buick eine große Tradition seit 1959 als Electra, Invicta und LeSabre zusammen mit einem neuen Design die Basis der Topmodelle der Buick - Palette bildeten (deshalb symbolisiert auch das bis heute verwendete Buick - Emblem mit seinen drei Wappenschildern genau diese drei Baureihen).	hatte				Modellbezeichnung		{'Case': 'Nom', 'Gender': 'Fem', 'Number': 'Sing', 'lemma': 'Modellbezeichnung'}	NOUN	hatte				2	[]	{'sent_id': 'train-s2224', 'text': 'Die Modellbezeichnung Electra hatte bei Buick eine große Tradition seit 1959 als Electra, Invicta und LeSabre zusammen mit einem neuen Design die Basis der Topmodelle der Buick - Palette bildeten (deshalb symbolisiert auch das bis heute verwendete Buick - Emblem mit seinen drei Wappenschildern genau diese drei Baureihen).', 'treebank': 'UD_German-GSD/de_gsd-ud-train.conllu', 'multiblimp_extended': True, 'pair_id': 'deu_0168', 'extended_role': 'sg'}	hatten	SG -> PL	Die Modellbezeichnung Electra	Die Modellbezeichnung Electra hatten bei Buick eine große Tradition seit 1959 als Electra, Invicta und LeSabre zusammen mit einem neuen Design die Basis der Topmodelle der Buick - Palette bildeten (deshalb symbolisiert auch das bis heute verwendete Buick - Emblem mit seinen drei Wappenschildern genau diese drei Baureihen).	[]	[]	0	0	0	False	False	False	3.2659599577893065e-05	SV-#	deu	SG	PL	SV	verb	+
Die Modellbezeichnungen Electra hatten bei Buick eine große Tradition seit 1959 als Electra, Invicta und LeSabre zusammen mit einem neuen Design die Basis der Topmodelle der Buick - Palette bildeten (deshalb symbolisiert auch das bis heute verwendete Buick - Emblem mit seinen drei Wappenschildern genau diese drei Baureihen).	hatte				Modellbezeichnungen		{'lemma': 'Modellbezeichnung', 'Number': 'Plur'}	NOUN	hatten				2	[]	{'sent_id': 'train-s2224', 'text': 'Die Modellbezeichnung Electra hatte bei Buick eine große Tradition seit 1959 als Electra, Invicta und LeSabre zusammen mit einem neuen Design die Basis der Topmodelle der Buick - Palette bildeten (deshalb symbolisiert auch das bis heute verwendete Buick - Emblem mit seinen drei Wappenschildern genau diese drei Baureihen).', 'treebank': 'UD_German-GSD/de_gsd-ud-train.conllu', 'multiblimp_extended': True, 'pair_id': 'deu_0168', 'extended_role': 'pl'}	hatte	PL -> SG	Die Modellbezeichnungen Electra	Die Modellbezeichnungen Electra hatte bei Buick eine große Tradition seit 1959 als Electra, Invicta und LeSabre zusammen mit einem neuen Design die Basis der Topmodelle der Buick - Palette bildeten (deshalb symbolisiert auch das bis heute verwendete Buick - Emblem mit seinen drei Wappenschildern genau diese drei Baureihen).	[]	[]	0	0	0	False	False	False	3.2659599577893065e-05	SV-#	deu	PL	SG	SV	verb	+
Der Zugang zu fiktionalen Stoffen fiel ihr leicht, wie sie erklärt: „Jedes Buch hat eine Lernkurve, und man muss aufgeschlossen bleiben.“	fiel				Zugang		{'Case': 'Nom', 'Gender': 'Masc', 'Number': 'Sing', 'lemma': 'Zugang'}	NOUN	fiel				4	[]	"{'sent_id': 'w01117034', 'text': 'Der Zugang zu fiktionalen Stoffen fiel ihr leicht, wie sie erklärt: „Jedes Buch hat eine Lernkurve, und man muss aufgeschlossen bleiben.“', 'text_en': 'She found the transition to fiction easy, explaining, ""Every book is a learning curve, and you have to keep an open mind.""', 'treebank': 'UD_German-PUD/de_pud-ud-test.conllu', 'multiblimp_extended': True, 'pair_id': 'deu_0169', 'extended_role': 'sg'}"	fielen	SG -> PL	Der Zugang zu fiktionalen Stoffen	Der Zugang zu fiktionalen Stoffen fielen ihr leicht, wie sie erklärt: „Jedes Buch hat eine Lernkurve, und man muss aufgeschlossen bleiben.“	[]	[]	0	0	0	False	False	False	0.0074582129784006	SV-#	deu	SG	PL	SV	verb	+
Die Zugänge zu fiktionalen Stoffen fielen ihr leicht, wie sie erklärt: „Jedes Buch hat eine Lernkurve, und man muss aufgeschlossen bleiben.“	fiel				Zugänge		{'lemma': 'Zugang', 'Number': 'Plur'}	NOUN	fielen				4	[]	"{'sent_id': 'w01117034', 'text': 'Der Zugang zu fiktionalen Stoffen fiel ihr leicht, wie sie erklärt: „Jedes Buch hat eine Lernkurve, und man muss aufgeschlossen bleiben.“', 'text_en': 'She found the transition to fiction easy, explaining, ""Every book is a learning curve, and you have to keep an open mind.""', 'treebank': 'UD_German-PUD/de_pud-ud-test.conllu', 'multiblimp_extended': True, 'pair_id': 'deu_0169', 'extended_role': 'pl'}"	fiel	PL -> SG	Die Zugänge zu fiktionalen Stoffen	Die Zugänge zu fiktionalen Stoffen fiel ihr leicht, wie sie erklärt: „Jedes Buch hat eine Lernkurve, und man muss aufgeschlossen bleiben.“	[]	[]	0	0	0	False	False	False	0.0074582129784006	SV-#	deu	PL	SG	SV	verb	+
Der einzige Start des Modells Start schlug 1995 fehl, Start - 1 wurde 1993 erstmals gestartet.	schlug				Start		{'Case': 'Nom', 'Gender': 'Masc', 'Number': 'Sing', 'lemma': 'Start'}	NOUN	schlug				4	[]	{'sent_id': 'train-s3505', 'text': 'Der einzige Start des Modells Start schlug 1995 fehl, Start - 1 wurde 1993 erstmals gestartet.', 'treebank': 'UD_German-GSD/de_gsd-ud-train.conllu', 'multiblimp_extended': True, 'pair_id': 'deu_0170', 'extended_role': 'sg'}	schlugen	SG -> PL	Der einzige Start des Modells Start	Der einzige Start des Modells Start schlugen 1995 fehl, Start - 1 wurde 1993 erstmals gestartet.	[]	[]	0	0	0	False	False	False	0.0024662837809358	SV-#	deu	SG	PL	SV	verb	+
Die einzigen Starts des Modells Start schlugen 1995 fehl, Start - 1 wurde 1993 erstmals gestartet.	schlug				Starts		{'lemma': 'Start', 'Number': 'Plur'}	NOUN	schlugen				4	[]	{'sent_id': 'train-s3505', 'text': 'Der einzige Start des Modells Start schlug 1995 fehl, Start - 1 wurde 1993 erstmals gestartet.', 'treebank': 'UD_German-GSD/de_gsd-ud-train.conllu', 'multiblimp_extended': True, 'pair_id': 'deu_0170', 'extended_role': 'pl'}	schlug	PL -> SG	Die einzigen Starts des Modells Start	Die einzigen Starts des Modells Start schlug 1995 fehl, Start - 1 wurde 1993 erstmals gestartet.	[]	[]	0	0	0	False	False	False	0.0024662837809358	SV-#	deu	PL	SG	SV	verb	+
Die Zahl arbeitsloser Jugendlicher nehme dramatisch zu.	nehme				Zahl		{'Case': 'Nom', 'Gender': 'Fem', 'Number': 'Sing', 'lemma': 'Zahl'}	NOUN	nehme				3	[]	{'sent_id': 'train-s1576', 'text': 'Die Zahl arbeitsloser Jugendlicher nehme dramatisch zu.', 'treebank': 'UD_German-GSD/de_gsd-ud-train.conllu', 'multiblimp_extended': True, 'pair_id': 'deu_0171', 'extended_role': 'sg'}	nehmen	SG -> PL	Die Zahl arbeitsloser Jugendlicher	Die Zahl arbeitsloser Jugendlicher nehmen dramatisch zu.	[]	[]	0	0	0	False	False	False	0.0042155116834438	SV-#	deu	SG	PL	SV	verb	+
Die Zahlen arbeitsloser Jugendlicher nehmen dramatisch zu.	nehme				Zahlen		{'lemma': 'Zahl', 'Number': 'Plur'}	NOUN	nehmen				3	[]	{'sent_id': 'train-s1576', 'text': 'Die Zahl arbeitsloser Jugendlicher nehme dramatisch zu.', 'treebank': 'UD_German-GSD/de_gsd-ud-train.conllu', 'multiblimp_extended': True, 'pair_id': 'deu_0171', 'extended_role': 'pl'}	nehme	PL -> SG	Die Zahlen arbeitsloser Jugendlicher	Die Zahlen arbeitsloser Jugendlicher nehme dramatisch zu.	[]	[]	0	0	0	False	False	False	0.0042155116834438	SV-#	deu	PL	SG	SV	verb	+
Man nimmt an, dass die Anlage zu dem Schutz von Erzlagerstätten diente.	diente				Anlage		{'Case': 'Nom', 'Gender': 'Fem', 'Number': 'Sing', 'lemma': 'Anlage'}	NOUN	diente.				6	[]	{'sent_id': 'train-s3853', 'text': 'Man nimmt an, dass die Anlage zum Schutz von Erzlagerstätten diente.', 'treebank': 'UD_German-GSD/de_gsd-ud-train.conllu', 'multiblimp_extended': True, 'pair_id': 'deu_0172', 'extended_role': 'sg'}	dienten.	SG -> PL	Man nimmt an, dass die Anlage zu dem Schutz von Erzlagerstätten	Man nimmt an, dass die Anlage zu dem Schutz von Erzlagerstätten dienten.	[]	[]	0	0	0	False	False	False	0.0002877331077758	SV-#	deu	SG	PL	SV	verb	+
Man nimmt an, dass die Anlagen zu dem Schutz von Erzlagerstätten dienten.	diente				Anlagen		{'lemma': 'Anlage', 'Number': 'Plur'}	NOUN	dienten.				6	[]	{'sent_id': 'train-s3853', 'text': 'Man nimmt an, dass die Anlage zum Schutz von Erzlagerstätten diente.', 'treebank': 'UD_German-GSD/de_gsd-ud-train.conllu', 'multiblimp_extended': True, 'pair_id': 'deu_0172', 'extended_role': 'pl'}	diente.	PL -> SG	Man nimmt an, dass die Anlagen zu dem Schutz von Erzlagerstätten	Man nimmt an, dass die Anlagen zu dem Schutz von Erzlagerstätten diente.	[]	[]	0	0	0	False	False	False	0.0002877331077758	SV-#	deu	PL	SG	SV	verb	+
Starr vor Entsetzen habe er mit ansehen müssen, wie sein Freund in den vermeintlich sicheren Tod stürzte, berichtete der unverletzt gebliebene Jones.	stürzte				Freund		{'Case': 'Nom', 'Gender': 'Masc', 'Number': 'Sing', 'lemma': 'Freund'}	NOUN	stürzte,				6	[]	{'sent_id': 'test-s551', 'text': 'Starr vor Entsetzen habe er mit ansehen müssen, wie sein Freund in den vermeintlich sicheren Tod stürzte, berichtete der unverletzt gebliebene Jones.', 'treebank': 'UD_German-GSD/de_gsd-ud-test.conllu', 'multiblimp_extended': True, 'pair_id': 'deu_0173', 'extended_role': 'sg'}	stürzten,	SG -> PL	Starr vor Entsetzen habe er mit ansehen müssen, wie sein Freund in den vermeintlich sicheren Tod	Starr vor Entsetzen habe er mit ansehen müssen, wie sein Freund in den vermeintlich sicheren Tod stürzten, berichtete der unverletzt gebliebene Jones.	[]	[]	0	0	0	False	False	False	0.0069055945866204	SV-#	deu	SG	PL	SV	verb	+
Starr vor Entsetzen habe er mit ansehen müssen, wie seine Freunde in den vermeintlich sicheren Tod stürzten, berichtete der unverletzt gebliebene Jones.	stürzte				Freunde		{'lemma': 'Freund', 'Number': 'Plur'}	NOUN	stürzten,				6	[]	{'sent_id': 'test-s551', 'text': 'Starr vor Entsetzen habe er mit ansehen müssen, wie sein Freund in den vermeintlich sicheren Tod stürzte, berichtete der unverletzt gebliebene Jones.', 'treebank': 'UD_German-GSD/de_gsd-ud-test.conllu', 'multiblimp_extended': True, 'pair_id': 'deu_0173', 'extended_role': 'pl'}	stürzte,	PL -> SG	Starr vor Entsetzen habe er mit ansehen müssen, wie seine Freunde in den vermeintlich sicheren Tod	Starr vor Entsetzen habe er mit ansehen müssen, wie seine Freunde in den vermeintlich sicheren Tod stürzte, berichtete der unverletzt gebliebene Jones.	[]	[]	0	0	0	False	False	False	0.0069055945866204	SV-#	deu	PL	SG	SV	verb	+
In jene Zeit (1766) fallen seine scharfsinnigen Erläuterungen einiger Stellen des Pentateuch und die Beantwortung der Frage, ob die hebräische Sprache reich oder arm genannt zu werden verdiene.	verdiene				Sprache		{'Case': 'Nom', 'Gender': 'Fem', 'Number': 'Sing', 'lemma': 'Sprache'}	NOUN	verdiene.				7	[]	{'sent_id': 'train-s7791', 'text': 'In jene Zeit (1766) fallen seine scharfsinnigen Erläuterungen einiger Stellen des Pentateuch und die Beantwortung der Frage, ob die hebräische Sprache reich oder arm genannt zu werden verdiene.', 'treebank': 'UD_German-GSD/de_gsd-ud-train.conllu', 'multiblimp_extended': True, 'pair_id': 'deu_0174', 'extended_role': 'sg'}	verdienen.	SG -> PL	In jene Zeit (1766) fallen seine scharfsinnigen Erläuterungen einiger Stellen des Pentateuch und die Beantwortung der Frage, ob die hebräische Sprache reich oder arm genannt zu werden	In jene Zeit (1766) fallen seine scharfsinnigen Erläuterungen einiger Stellen des Pentateuch und die Beantwortung der Frage, ob die hebräische Sprache reich oder arm genannt zu werden verdienen.	[]	[]	0	0	0	False	False	False	0.0015080790778062	SV-#	deu	SG	PL	SV	verb	+
In jene Zeit (1766) fallen seine scharfsinnigen Erläuterungen einiger Stellen des Pentateuch und die Beantwortung der Frage, ob die hebräischen Sprachen reich oder arm genannt zu werden verdienen.	verdiene				Sprachen		{'lemma': 'Sprache', 'Number': 'Plur'}	NOUN	verdienen.				7	[]	{'sent_id': 'train-s7791', 'text': 'In jene Zeit (1766) fallen seine scharfsinnigen Erläuterungen einiger Stellen des Pentateuch und die Beantwortung der Frage, ob die hebräische Sprache reich oder arm genannt zu werden verdiene.', 'treebank': 'UD_German-GSD/de_gsd-ud-train.conllu', 'multiblimp_extended': True, 'pair_id': 'deu_0174', 'extended_role': 'pl'}	verdiene.	PL -> SG	In jene Zeit (1766) fallen seine scharfsinnigen Erläuterungen einiger Stellen des Pentateuch und die Beantwortung der Frage, ob die hebräischen Sprachen reich oder arm genannt zu werden	In jene Zeit (1766) fallen seine scharfsinnigen Erläuterungen einiger Stellen des Pentateuch und die Beantwortung der Frage, ob die hebräischen Sprachen reich oder arm genannt zu werden verdiene.	[]	[]	0	0	0	False	False	False	0.0015080790778062	SV-#	deu	PL	SG	SV	verb	+
"""Staatssekretär in dem Bonner Ministerium für wirtschaftliche Zusammenarbeit und Entwicklung, Wighard Härdtl, versuchte Ende Oktober in Rangun das Terrain für die Wiederaufnahme der 1988 unterbrochenen Hilfe zu erkunden."	versuchte				Staatssekretär		{'Case': 'Nom', 'Gender': 'Masc', 'Number': 'Sing', 'lemma': 'Staatssekretär'}	NOUN	versuchte				14	[]	"{'sent_id': 'test-s318', 'text': '""Staatssekretär im Bonner Ministerium für wirtschaftliche Zusammenarbeit und Entwicklung, Wighard Härdtl, versuchte Ende Oktober in Rangun das Terrain für die Wiederaufnahme der 1988 unterbrochenen Hilfe zu erkunden.""', 'treebank': 'UD_German-GSD/de_gsd-ud-test.conllu', 'multiblimp_extended': True, 'pair_id': 'deu_0175', 'extended_role': 'sg'}"	versuchten	SG -> PL	"""Staatssekretär in dem Bonner Ministerium für wirtschaftliche Zusammenarbeit und Entwicklung, Wighard Härdtl,"	"""Staatssekretär in dem Bonner Ministerium für wirtschaftliche Zusammenarbeit und Entwicklung, Wighard Härdtl, versuchten Ende Oktober in Rangun das Terrain für die Wiederaufnahme der 1988 unterbrochenen Hilfe zu erkunden."	[]	[]	0	0	0	False	False	False	0.0106872297173887	SV-#	deu	SG	PL	SV	verb	+
"""Staatssekretäre in dem Bonner Ministerium für wirtschaftliche Zusammenarbeit und Entwicklung, Wighard Härdtl, versuchten Ende Oktober in Rangun das Terrain für die Wiederaufnahme der 1988 unterbrochenen Hilfe zu erkunden."	versuchte				Staatssekretäre		{'lemma': 'Staatssekretär', 'Number': 'Plur'}	NOUN	versuchten				14	[]	"{'sent_id': 'test-s318', 'text': '""Staatssekretär im Bonner Ministerium für wirtschaftliche Zusammenarbeit und Entwicklung, Wighard Härdtl, versuchte Ende Oktober in Rangun das Terrain für die Wiederaufnahme der 1988 unterbrochenen Hilfe zu erkunden.""', 'treebank': 'UD_German-GSD/de_gsd-ud-test.conllu', 'multiblimp_extended': True, 'pair_id': 'deu_0175', 'extended_role': 'pl'}"	versuchte	PL -> SG	"""Staatssekretäre in dem Bonner Ministerium für wirtschaftliche Zusammenarbeit und Entwicklung, Wighard Härdtl,"	"""Staatssekretäre in dem Bonner Ministerium für wirtschaftliche Zusammenarbeit und Entwicklung, Wighard Härdtl, versuchte Ende Oktober in Rangun das Terrain für die Wiederaufnahme der 1988 unterbrochenen Hilfe zu erkunden."	[]	[]	0	0	0	False	False	False	0.0106872297173887	SV-#	deu	PL	SG	SV	verb	+
1639 verkaufte es ein Freiherr von Stadl an den Grafen Hans Sigmund von Wagensberg, der es seiner Tochter Regina, die mit Maximilian von Breuner verheiratet, aber zu diesem Zeitpunkt bereits verwitwet war, weiter verschenkte.	verschenkte				der		{'Case': 'Nom', 'Gender': 'Masc', 'Number': 'Sing', 'PronType': 'Dem,Rel', 'lemma': 'der'}	PRON	verschenkte.				22	[]	{'sent_id': 'train-s4693', 'text': '1639 verkaufte es ein Freiherr von Stadl an den Grafen Hans Sigmund von Wagensberg, der es seiner Tochter Regina, die mit Maximilian von Breuner verheiratet, aber zu diesem Zeitpunkt bereits verwitwet war, weiter verschenkte.', 'treebank': 'UD_German-GSD/de_gsd-ud-train.conllu', 'multiblimp_extended': True, 'pair_id': 'deu_0176', 'extended_role': 'sg'}	verschenkten.	SG -> PL	1639 verkaufte es ein Freiherr von Stadl an den Grafen Hans Sigmund von Wagensberg, der es seiner Tochter Regina, die mit Maximilian von Breuner verheiratet, aber zu diesem Zeitpunkt bereits verwitwet war, weiter	1639 verkaufte es ein Freiherr von Stadl an den Grafen Hans Sigmund von Wagensberg, der es seiner Tochter Regina, die mit Maximilian von Breuner verheiratet, aber zu diesem Zeitpunkt bereits verwitwet war, weiter verschenkten.	[]	[]	0	0	0	False	False	False	0.0022443182406516	SV-#	deu	SG	PL	SV	verb	+
1639 verkaufte es ein Freiherr von Stadl an die Grafen Hans Sigmund von Wagensberg, die es ihrer Tochter Regina, die mit Maximilian von Breuner verheiratet, aber zu diesem Zeitpunkt bereits verwitwet war, weiter verschenkten.	verschenkte				Grafen		{'lemma': 'der', 'Number': 'Plur'}	NOUN	verschenkten.				22	[]	{'sent_id': 'train-s4693', 'text': '1639 verkaufte es ein Freiherr von Stadl an den Grafen Hans Sigmund von Wagensberg, der es seiner Tochter Regina, die mit Maximilian von Breuner verheiratet, aber zu diesem Zeitpunkt bereits verwitwet war, weiter verschenkte.', 'treebank': 'UD_German-GSD/de_gsd-ud-train.conllu', 'multiblimp_extended': True, 'pair_id': 'deu_0176', 'extended_role': 'pl'}	verschenkte.	PL -> SG	1639 verkaufte es ein Freiherr von Stadl an die Grafen Hans Sigmund von Wagensberg, die es ihrer Tochter Regina, die mit Maximilian von Breuner verheiratet, aber zu diesem Zeitpunkt bereits verwitwet war, weiter	1639 verkaufte es ein Freiherr von Stadl an die Grafen Hans Sigmund von Wagensberg, die es ihrer Tochter Regina, die mit Maximilian von Breuner verheiratet, aber zu diesem Zeitpunkt bereits verwitwet war, weiter verschenkte.	[]	[]	0	0	0	False	False	False	0.0022443182406516	SV-#	deu	PL	SG	SV	verb	+
Der Vorsitzende der palästinensischen Verwaltung, Yassir Arafat, wolle, daß einer der drei in dem Gaza-Streifen geplanten Industrieparks von Deutschen übernommen werde.	wolle				Vorsitzende		{'Case': 'Nom', 'Gender': 'Masc', 'Number': 'Sing', 'lemma': 'Vorsitzend'}	NOUN	wolle,				8	[]	{'sent_id': 'test-s604', 'text': 'Der Vorsitzende der palästinensischen Verwaltung, Yassir Arafat, wolle, daß einer der drei im Gaza-Streifen geplanten Industrieparks von Deutschen übernommen werde.', 'treebank': 'UD_German-GSD/de_gsd-ud-test.conllu', 'multiblimp_extended': True, 'pair_id': 'deu_0177', 'extended_role': 'sg'}	wollen,	SG -> PL	Der Vorsitzende der palästinensischen Verwaltung, Yassir Arafat,	Der Vorsitzende der palästinensischen Verwaltung, Yassir Arafat, wollen, daß einer der drei in dem Gaza-Streifen geplanten Industrieparks von Deutschen übernommen werde.	[]	[]	0	0	0	False	False	False	0.0003369847208185	SV-#	deu	SG	PL	SV	verb	+
Die Vorsitzenden der palästinensischen Verwaltung, Yassir Arafat, wollen, daß einer der drei in dem Gaza-Streifen geplanten Industrieparks von Deutschen übernommen werde.	wolle				Vorsitzenden		{'lemma': 'Vorsitzend', 'Number': 'Plur'}	NOUN	wollen,				8	[]	{'sent_id': 'test-s604', 'text': 'Der Vorsitzende der palästinensischen Verwaltung, Yassir Arafat, wolle, daß einer der drei im Gaza-Streifen geplanten Industrieparks von Deutschen übernommen werde.', 'treebank': 'UD_German-GSD/de_gsd-ud-test.conllu', 'multiblimp_extended': True, 'pair_id': 'deu_0177', 'extended_role': 'pl'}	wolle,	PL -> SG	Die Vorsitzenden der palästinensischen Verwaltung, Yassir Arafat,	Die Vorsitzenden der palästinensischen Verwaltung, Yassir Arafat, wolle, daß einer der drei in dem Gaza-Streifen geplanten Industrieparks von Deutschen übernommen werde.	[]	[]	0	0	0	False	False	False	0.0003369847208185	SV-#	deu	PL	SG	SV	verb	+
Ein achter Platz in dem Hauptrennen von Brands Hatch durch Halliday sicherte dem Team schließlich mit 93 Punkten knapp vor Team Großbritannien die Vizemeisterschaft.	sicherte				Platz		{'Case': 'Nom', 'Gender': 'Masc', 'Number': 'Sing', 'lemma': 'Platz'}	NOUN	sicherte				9	[]	{'sent_id': 'train-s3614', 'text': 'Ein achter Platz im Hauptrennen von Brands Hatch durch Halliday sicherte dem Team schließlich mit 93 Punkten knapp vor Team Großbritannien die Vizemeisterschaft.', 'treebank': 'UD_German-GSD/de_gsd-ud-train.conllu', 'multiblimp_extended': True, 'pair_id': 'deu_0178', 'extended_role': 'sg'}	sicherten	SG -> PL	Ein achter Platz in dem Hauptrennen von Brands Hatch durch Halliday	Ein achter Platz in dem Hauptrennen von Brands Hatch durch Halliday sicherten dem Team schließlich mit 93 Punkten knapp vor Team Großbritannien die Vizemeisterschaft.	[]	[]	0	0	0	False	False	False	0.0014386655388792	SV-#	deu	SG	PL	SV	verb	+
Achte Plätze in dem Hauptrennen von Brands Hatch durch Halliday sicherten dem Team schließlich mit 93 Punkten knapp vor Team Großbritannien die Vizemeisterschaft.	sicherte				Plätze		{'lemma': 'Platz', 'Number': 'Plur'}	NOUN	sicherten				9	[]	{'sent_id': 'train-s3614', 'text': 'Ein achter Platz im Hauptrennen von Brands Hatch durch Halliday sicherte dem Team schließlich mit 93 Punkten knapp vor Team Großbritannien die Vizemeisterschaft.', 'treebank': 'UD_German-GSD/de_gsd-ud-train.conllu', 'multiblimp_extended': True, 'pair_id': 'deu_0178', 'extended_role': 'pl'}	sicherte	PL -> SG	Achte Plätze in dem Hauptrennen von Brands Hatch durch Halliday	Achte Plätze in dem Hauptrennen von Brands Hatch durch Halliday sicherte dem Team schließlich mit 93 Punkten knapp vor Team Großbritannien die Vizemeisterschaft.	[]	[]	0	0	0	False	False	False	0.0014386655388792	SV-#	deu	PL	SG	SV	verb	+
Bischof Kohlwage räumte ein, daß in dem vergangenen Jahr politisch Verantwortlicher kaum auf den EKD-Bericht reagiert hätte.	reagiert				Verantwortlicher		{'lemma': 'Verantwortliche', 'Number': 'Sing'}	NOUN	hätte.				8	[]	{'sent_id': 'train-s1934', 'text': 'Bischof Kohlwage räumte ein, daß im vergangenen Jahr politisch Verantwortliche kaum auf den EKD-Bericht reagiert hätten.', 'treebank': 'UD_German-GSD/de_gsd-ud-train.conllu', 'multiblimp_extended': True, 'pair_id': 'deu_0179', 'extended_role': 'sg'}	hätten.	SG -> PL	Bischof Kohlwage räumte ein, daß in dem vergangenen Jahr politisch Verantwortlicher kaum auf den EKD-Bericht reagiert	Bischof Kohlwage räumte ein, daß in dem vergangenen Jahr politisch Verantwortlicher kaum auf den EKD-Bericht reagiert hätten.	[]	[]	0	0	0	False	False	False	0.1452664131565597	SV-#	deu	SG	PL	SV	aux	+
Bischof Kohlwage räumte ein, daß in dem vergangenen Jahr politisch Verantwortliche kaum auf den EKD-Bericht reagiert hätten.	reagiert				Verantwortliche		{'Case': 'Nom', 'Number': 'Plur', 'lemma': 'Verantwortliche'}	NOUN	hätten.				8	[]	{'sent_id': 'train-s1934', 'text': 'Bischof Kohlwage räumte ein, daß im vergangenen Jahr politisch Verantwortliche kaum auf den EKD-Bericht reagiert hätten.', 'treebank': 'UD_German-GSD/de_gsd-ud-train.conllu', 'multiblimp_extended': True, 'pair_id': 'deu_0179', 'extended_role': 'pl'}	hätte.	PL -> SG	Bischof Kohlwage räumte ein, daß in dem vergangenen Jahr politisch Verantwortliche kaum auf den EKD-Bericht reagiert	Bischof Kohlwage räumte ein, daß in dem vergangenen Jahr politisch Verantwortliche kaum auf den EKD-Bericht reagiert hätte.	[]	[]	0	0	0	False	False	False	0.1452664131565597	SV-#	deu	PL	SG	SV	aux	+
Dazu wird es in Marokko an dem mittleren Samstag einen Termin geben, an dem Industrieland sich gegenseitig öffentlich zu seinen Plänen und Ambitionen befragen kann.	befragen				Industrieland		{'lemma': 'Industrieland', 'Number': 'Sing'}	NOUN	kann.				10	[]	{'sent_id': 'n01092025', 'text': 'Dazu wird es in Marokko am mittleren Samstag einen Termin geben, an dem Industrieländer sich gegenseitig öffentlich zu ihren Plänen und Ambitionen befragen können.', 'text_en': 'On this, one diary point in Morocco will be the middle Saturday, when developed countries get to publicly question each other about their plans and ambitions.', 'treebank': 'UD_German-PUD/de_pud-ud-test.conllu', 'multiblimp_extended': True, 'pair_id': 'deu_0180', 'extended_role': 'sg'}	können.	SG -> PL	Dazu wird es in Marokko an dem mittleren Samstag einen Termin geben, an dem Industrieland sich gegenseitig öffentlich zu seinen Plänen und Ambitionen befragen	Dazu wird es in Marokko an dem mittleren Samstag einen Termin geben, an dem Industrieland sich gegenseitig öffentlich zu seinen Plänen und Ambitionen befragen können.	[]	[]	0	0	0	False	False	False	0.0339360265476247	SV-#	deu	SG	PL	SV	aux	+
Dazu wird es in Marokko an dem mittleren Samstag einen Termin geben, an dem Industrieländer sich gegenseitig öffentlich zu ihren Plänen und Ambitionen befragen können.	befragen				Industrieländer		{'Case': 'Nom', 'Gender': 'Neut', 'Number': 'Plur', 'lemma': 'Industrieland'}	NOUN	können.				10	[]	{'sent_id': 'n01092025', 'text': 'Dazu wird es in Marokko am mittleren Samstag einen Termin geben, an dem Industrieländer sich gegenseitig öffentlich zu ihren Plänen und Ambitionen befragen können.', 'text_en': 'On this, one diary point in Morocco will be the middle Saturday, when developed countries get to publicly question each other about their plans and ambitions.', 'treebank': 'UD_German-PUD/de_pud-ud-test.conllu', 'multiblimp_extended': True, 'pair_id': 'deu_0180', 'extended_role': 'pl'}	kann.	PL -> SG	Dazu wird es in Marokko an dem mittleren Samstag einen Termin geben, an dem Industrieländer sich gegenseitig öffentlich zu ihren Plänen und Ambitionen befragen	Dazu wird es in Marokko an dem mittleren Samstag einen Termin geben, an dem Industrieländer sich gegenseitig öffentlich zu ihren Plänen und Ambitionen befragen kann.	[]	[]	0	0	0	False	False	False	0.0339360265476247	SV-#	deu	PL	SG	SV	aux	+
