sen	verb	verb_idx	cop	cop_idx	child	child_idx	child_features	child_upos	head	head_idx	head_features	head_upos	distance	attractors	metadata	swap_head	feature_vals	prefix	wrong_sen	congruent_attractors	incongruent_attractors	num_attractors	num_congruent_attractors	num_incongruent_attractors	has_attractors	only_has_congruent_attractors	only_has_incongruent_attractors	sample_weight	phenomenon	lang	grammatical_feature	ungrammatical_feature	wo	inflect_item	agreement_certainty
Schumacher war dabei an Kovalainen gescheitert, nachdem ihm die Motoren des Fiat Grande Punto bei dem Start abgestorben waren.	abgestorben				Motoren		{'lemma': 'Motor', 'Number': 'Plur'}	NOUN	waren.				9	[]	{'sent_id': 'train-s6511', 'text': 'Schumacher war dabei an Kovalainen gescheitert, nachdem ihm der Motor des Fiat Grande Punto beim Start abgestorben war.', 'treebank': 'UD_German-GSD/de_gsd-ud-train.conllu', 'multiblimp_extended': True, 'pair_id': 'deu_0073', 'extended_role': 'pl'}	war.	PL -> SG	Schumacher war dabei an Kovalainen gescheitert, nachdem ihm die Motoren des Fiat Grande Punto bei dem Start abgestorben	Schumacher war dabei an Kovalainen gescheitert, nachdem ihm die Motoren des Fiat Grande Punto bei dem Start abgestorben war.	[]	[]	0	0	0	False	False	False	0.0052387407762619	SV-#	deu	PL	SG	SV	aux	+
In ihrem ersten Bericht über den Staat schreibt die in Paris ansässige Organisation, das 1990 beschlossene ``bahnbrechende Programm zu der Umwandlung der Wirtschaft'' habe ``drastische Verbesserungen'' gebracht.	gebracht				Programm		{'Case': 'Nom', 'Gender': 'Neut', 'Number': 'Sing', 'lemma': 'Programm'}	NOUN	habe				7	[]	"{'sent_id': 'test-s656', 'text': ""In ihrem ersten Bericht über den Staat schreibt die in Paris ansässige Organisation, das 1990 beschlossene ``bahnbrechende Programm zur Umwandlung der Wirtschaft'' habe ``drastische Verbesserungen'' gebracht."", 'treebank': 'UD_German-GSD/de_gsd-ud-test.conllu', 'multiblimp_extended': True, 'pair_id': 'deu_0074', 'extended_role': 'sg'}"	haben	SG -> PL	In ihrem ersten Bericht über den Staat schreibt die in Paris ansässige Organisation, das 1990 beschlossene ``bahnbrechende Programm zu der Umwandlung der Wirtschaft''	In ihrem ersten Bericht über den Staat schreibt die in Paris ansässige Organisation, das 1990 beschlossene ``bahnbrechende Programm zu der Umwandlung der Wirtschaft'' haben ``drastische Verbesserungen'' gebracht.	[]	[]	0	0	0	False	False	False	0.0032742129851637	SV-#	deu	SG	PL	SV	aux	+
In ihrem ersten Bericht über den Staat schreibt die in Paris ansässige Organisation, die 1990 beschlossenen ``bahnbrechenden Programme zu der Umwandlung der Wirtschaft'' haben ``drastische Verbesserungen'' gebracht.	gebracht				Programme		{'lemma': 'Programm', 'Number': 'Plur'}	NOUN	haben				7	[]	"{'sent_id': 'test-s656', 'text': ""In ihrem ersten Bericht über den Staat schreibt die in Paris ansässige Organisation, das 1990 beschlossene ``bahnbrechende Programm zur Umwandlung der Wirtschaft'' habe ``drastische Verbesserungen'' gebracht."", 'treebank': 'UD_German-GSD/de_gsd-ud-test.conllu', 'multiblimp_extended': True, 'pair_id': 'deu_0074', 'extended_role': 'pl'}"	habe	PL -> SG	In ihrem ersten Bericht über den Staat schreibt die in Paris ansässige Organisation, die 1990 beschlossenen ``bahnbrechenden Programme zu der Umwandlung der Wirtschaft''	In ihrem ersten Bericht über den Staat schreibt die in Paris ansässige Organisation, die 1990 beschlossenen ``bahnbrechenden Programme zu der Umwandlung der Wirtschaft'' habe ``drastische Verbesserungen'' gebracht.	[]	[]	0	0	0	False	False	False	0.0032742129851637	SV-#	deu	PL	SG	SV	aux	+
Da deren Entfaltung allerdings Zeit beanspruchen würde, sollte eine Kavallerie - Attacke der englischen Reiterei unter Lord George Sackville (1716-1785) die beiden französischen Brigaden zurückwerfen.	beanspruchen				Entfaltung		{'Case': 'Nom', 'Gender': 'Fem', 'Number': 'Sing', 'lemma': 'Entfaltung'}	NOUN	würde,				4	[]	{'sent_id': 'train-s5956', 'text': 'Da deren Entfaltung allerdings Zeit beanspruchen würde, sollte eine Kavallerie - Attacke der englischen Reiterei unter Lord George Sackville (1716-1785) die beiden französischen Brigaden zurückwerfen.', 'treebank': 'UD_German-GSD/de_gsd-ud-train.conllu', 'multiblimp_extended': True, 'pair_id': 'deu_0075', 'extended_role': 'sg'}	würden,	SG -> PL	Da deren Entfaltung allerdings Zeit beanspruchen	Da deren Entfaltung allerdings Zeit beanspruchen würden, sollte eine Kavallerie - Attacke der englischen Reiterei unter Lord George Sackville (1716-1785) die beiden französischen Brigaden zurückwerfen.	[]	[]	0	0	0	False	False	False	0.0023068318759108	SV-#	deu	SG	PL	SV	aux	+
Da deren Entfaltungen allerdings Zeit beanspruchen würden, sollte eine Kavallerie - Attacke der englischen Reiterei unter Lord George Sackville (1716-1785) die beiden französischen Brigaden zurückwerfen.	beanspruchen				Entfaltungen		{'lemma': 'Entfaltung', 'Number': 'Plur'}	NOUN	würden,				4	[]	{'sent_id': 'train-s5956', 'text': 'Da deren Entfaltung allerdings Zeit beanspruchen würde, sollte eine Kavallerie - Attacke der englischen Reiterei unter Lord George Sackville (1716-1785) die beiden französischen Brigaden zurückwerfen.', 'treebank': 'UD_German-GSD/de_gsd-ud-train.conllu', 'multiblimp_extended': True, 'pair_id': 'deu_0075', 'extended_role': 'pl'}	würde,	PL -> SG	Da deren Entfaltungen allerdings Zeit beanspruchen	Da deren Entfaltungen allerdings Zeit beanspruchen würde, sollte eine Kavallerie - Attacke der englischen Reiterei unter Lord George Sackville (1716-1785) die beiden französischen Brigaden zurückwerfen.	[]	[]	0	0	0	False	False	False	0.0023068318759108	SV-#	deu	PL	SG	SV	aux	+
In dem Jahr 2008 erwog Tennis Borussia Berlin kurzzeitig eine Rückkehr in das Poststadion zu der Saison 2009 / 2010 sowie eine umfassende Sanierung des Stadions, das danach 16.000 Zuschauer fassen sollte.	fassen				das		{'Case': 'Nom', 'Gender': 'Neut', 'Number': 'Sing', 'PronType': 'Dem,Rel', 'lemma': 'der'}	PRON	sollte.				5	[]	{'sent_id': 'train-s3398', 'text': 'Im Jahr 2008 erwog Tennis Borussia Berlin kurzzeitig eine Rückkehr in das Poststadion zur Saison 2009 / 2010 sowie eine umfassende Sanierung des Stadions, das danach 16.000 Zuschauer fassen sollte.', 'treebank': 'UD_German-GSD/de_gsd-ud-train.conllu', 'multiblimp_extended': True, 'pair_id': 'deu_0076', 'extended_role': 'sg'}	sollten.	SG -> PL	In dem Jahr 2008 erwog Tennis Borussia Berlin kurzzeitig eine Rückkehr in das Poststadion zu der Saison 2009 / 2010 sowie eine umfassende Sanierung des Stadions, das danach 16.000 Zuschauer fassen	In dem Jahr 2008 erwog Tennis Borussia Berlin kurzzeitig eine Rückkehr in das Poststadion zu der Saison 2009 / 2010 sowie eine umfassende Sanierung des Stadions, das danach 16.000 Zuschauer fassen sollten.	[]	[]	0	0	0	False	False	False	0.0028336867509062	SV-#	deu	SG	PL	SV	aux	+
In dem Jahr 2008 erwog Tennis Borussia Berlin kurzzeitig eine Rückkehr in das Poststadion zu der Saison 2009 / 2010 sowie eine umfassende Sanierung der Stadien, die danach 16.000 Zuschauer fassen sollten.	fassen				Stadien		{'lemma': 'der', 'Number': 'Plur'}	NOUN	sollten.				5	[]	{'sent_id': 'train-s3398', 'text': 'Im Jahr 2008 erwog Tennis Borussia Berlin kurzzeitig eine Rückkehr in das Poststadion zur Saison 2009 / 2010 sowie eine umfassende Sanierung des Stadions, das danach 16.000 Zuschauer fassen sollte.', 'treebank': 'UD_German-GSD/de_gsd-ud-train.conllu', 'multiblimp_extended': True, 'pair_id': 'deu_0076', 'extended_role': 'pl'}	sollte.	PL -> SG	In dem Jahr 2008 erwog Tennis Borussia Berlin kurzzeitig eine Rückkehr in das Poststadion zu der Saison 2009 / 2010 sowie eine umfassende Sanierung der Stadien, die danach 16.000 Zuschauer fassen	In dem Jahr 2008 erwog Tennis Borussia Berlin kurzzeitig eine Rückkehr in das Poststadion zu der Saison 2009 / 2010 sowie eine umfassende Sanierung der Stadien, die danach 16.000 Zuschauer fassen sollte.	[]	[]	0	0	0	False	False	False	0.0028336867509062	SV-#	deu	PL	SG	SV	aux	+
Als das Gespräch gescheitert war, forderte Landgraf Philipp, dass doch wenigstens eine Bestandsaufnahme über die Konsenspunkte aufgestellt werden solle.	gescheitert				Gespräch		{'Case': 'Nom', 'Gender': 'Neut', 'Number': 'Sing', 'lemma': 'Gespräch'}	NOUN	war,				2	[]	{'sent_id': 'train-s10839', 'text': 'Als das Gespräch gescheitert war, forderte Landgraf Philipp, dass doch wenigstens eine Bestandsaufnahme über die Konsenspunkte aufgestellt werden solle.', 'treebank': 'UD_German-GSD/de_gsd-ud-train.conllu', 'multiblimp_extended': True, 'pair_id': 'deu_0077', 'extended_role': 'sg'}	waren,	SG -> PL	Als das Gespräch gescheitert	Als das Gespräch gescheitert waren, forderte Landgraf Philipp, dass doch wenigstens eine Bestandsaufnahme über die Konsenspunkte aufgestellt werden solle.	[]	[]	0	0	0	False	False	False	0.0015911090620571	SV-#	deu	SG	PL	SV	aux	+
Als die Gespräche gescheitert waren, forderte Landgraf Philipp, dass doch wenigstens eine Bestandsaufnahme über die Konsenspunkte aufgestellt werden solle.	gescheitert				Gespräche		{'lemma': 'Gespräch', 'Number': 'Plur'}	NOUN	waren,				2	[]	{'sent_id': 'train-s10839', 'text': 'Als das Gespräch gescheitert war, forderte Landgraf Philipp, dass doch wenigstens eine Bestandsaufnahme über die Konsenspunkte aufgestellt werden solle.', 'treebank': 'UD_German-GSD/de_gsd-ud-train.conllu', 'multiblimp_extended': True, 'pair_id': 'deu_0077', 'extended_role': 'pl'}	war,	PL -> SG	Als die Gespräche gescheitert	Als die Gespräche gescheitert war, forderte Landgraf Philipp, dass doch wenigstens eine Bestandsaufnahme über die Konsenspunkte aufgestellt werden solle.	[]	[]	0	0	0	False	False	False	0.0015911090620571	SV-#	deu	PL	SG	SV	aux	+
Mason lehnte Nashs Angebot anfangs ab, aber als Nash in fragte, was ihn zu einem Wechsel zu Nash Motors bewegen könnte, forderte er, dass Kelvinator in diesem Geschäft eingeschlossen sein müsste.	bewegen				was		{'Case': 'Nom', 'Gender': 'Neut', 'Number': 'Sing', 'PronType': 'Int,Rel', 'lemma': 'was'}	PRON	könnte,				9	[]	{'sent_id': 'train-s2598', 'text': 'Mason lehnte Nashs Angebot anfangs ab, aber als Nash in fragte, was ihn zu einem Wechsel zu Nash Motors bewegen könnte, forderte er, dass Kelvinator in diesem Geschäft eingeschlossen sein müsste.', 'treebank': 'UD_German-GSD/de_gsd-ud-train.conllu', 'multiblimp_extended': True, 'pair_id': 'deu_0078', 'extended_role': 'sg'}	könnten,	SG -> PL	Mason lehnte Nashs Angebot anfangs ab, aber als Nash in fragte, was ihn zu einem Wechsel zu Nash Motors bewegen	Mason lehnte Nashs Angebot anfangs ab, aber als Nash in fragte, was ihn zu einem Wechsel zu Nash Motors bewegen könnten, forderte er, dass Kelvinator in diesem Geschäft eingeschlossen sein müsste.	[]	[]	0	0	0	False	False	False	0.0015615477313857	SV-#	deu	SG	PL	SV	aux	+
Mason lehnte Nashs Angebote anfangs ab, aber als Nash in fragte, was ihn zu einem Wechsel zu Nash Motors bewegen könnten, forderte er, dass Kelvinator in diesem Geschäft eingeschlossen sein müsste.	bewegen				Angebote		{'lemma': 'was', 'Number': 'Plur'}	NOUN	könnten,				9	[]	{'sent_id': 'train-s2598', 'text': 'Mason lehnte Nashs Angebot anfangs ab, aber als Nash in fragte, was ihn zu einem Wechsel zu Nash Motors bewegen könnte, forderte er, dass Kelvinator in diesem Geschäft eingeschlossen sein müsste.', 'treebank': 'UD_German-GSD/de_gsd-ud-train.conllu', 'multiblimp_extended': True, 'pair_id': 'deu_0078', 'extended_role': 'pl'}	könnte,	PL -> SG	Mason lehnte Nashs Angebote anfangs ab, aber als Nash in fragte, was ihn zu einem Wechsel zu Nash Motors bewegen	Mason lehnte Nashs Angebote anfangs ab, aber als Nash in fragte, was ihn zu einem Wechsel zu Nash Motors bewegen könnte, forderte er, dass Kelvinator in diesem Geschäft eingeschlossen sein müsste.	[]	[]	0	0	0	False	False	False	0.0015615477313857	SV-#	deu	PL	SG	SV	aux	+
Der heute sichtbare Gebäudetrakt, der zu der Mühlenstraße weist, ist ab etwa 1710 entstanden.	entstanden				Gebäudetrakt		{'Case': 'Nom', 'Gender': 'Masc', 'Number': 'Sing', 'lemma': 'Gebäudetrakt'}	NOUN	ist				8	[]	{'sent_id': 'train-s8889', 'text': 'Der heute sichtbare Gebäudetrakt, der zur Mühlenstraße weist, ist ab etwa 1710 entstanden.', 'treebank': 'UD_German-GSD/de_gsd-ud-train.conllu', 'multiblimp_extended': True, 'pair_id': 'deu_0079', 'extended_role': 'sg'}	sind	SG -> PL	Der heute sichtbare Gebäudetrakt, der zu der Mühlenstraße weist,	Der heute sichtbare Gebäudetrakt, der zu der Mühlenstraße weist, sind ab etwa 1710 entstanden.	[]	[]	0	0	0	False	False	False	0.0019902078929426	SV-#	deu	SG	PL	SV	aux	+
Die heute sichtbaren Gebäudetrakte, die zu der Mühlenstraße weisen, sind ab etwa 1710 entstanden.	entstanden				Gebäudetrakte		{'lemma': 'Gebäudetrakt', 'Number': 'Plur'}	NOUN	sind				8	[]	{'sent_id': 'train-s8889', 'text': 'Der heute sichtbare Gebäudetrakt, der zur Mühlenstraße weist, ist ab etwa 1710 entstanden.', 'treebank': 'UD_German-GSD/de_gsd-ud-train.conllu', 'multiblimp_extended': True, 'pair_id': 'deu_0079', 'extended_role': 'pl'}	ist	PL -> SG	Die heute sichtbaren Gebäudetrakte, die zu der Mühlenstraße weisen,	Die heute sichtbaren Gebäudetrakte, die zu der Mühlenstraße weisen, ist ab etwa 1710 entstanden.	[]	[]	0	0	0	False	False	False	0.0019902078929426	SV-#	deu	PL	SG	SV	aux	+
Die Einwohnerzahl des Kanton ist zwischen den beiden letzten Volkszählungen um etwa ein Viertel angestiegen.	angestiegen				Einwohnerzahl		{'Case': 'Nom', 'Gender': 'Fem', 'Number': 'Sing', 'lemma': 'Einwohnerzahl'}	NOUN	ist				3	[]	{'sent_id': 'train-s9338', 'text': 'Die Einwohnerzahl des Kanton ist zwischen den beiden letzten Volkszählungen um etwa ein Viertel angestiegen.', 'treebank': 'UD_German-GSD/de_gsd-ud-train.conllu', 'multiblimp_extended': True, 'pair_id': 'deu_0080', 'extended_role': 'sg'}	sind	SG -> PL	Die Einwohnerzahl des Kanton	Die Einwohnerzahl des Kanton sind zwischen den beiden letzten Volkszählungen um etwa ein Viertel angestiegen.	[]	[]	0	0	0	False	False	False	0.0019902078929426	SV-#	deu	SG	PL	SV	aux	+
Die Einwohnerzahlen des Kanton sind zwischen den beiden letzten Volkszählungen um etwa ein Viertel angestiegen.	angestiegen				Einwohnerzahlen		{'lemma': 'Einwohnerzahl', 'Number': 'Plur'}	NOUN	sind				3	[]	{'sent_id': 'train-s9338', 'text': 'Die Einwohnerzahl des Kanton ist zwischen den beiden letzten Volkszählungen um etwa ein Viertel angestiegen.', 'treebank': 'UD_German-GSD/de_gsd-ud-train.conllu', 'multiblimp_extended': True, 'pair_id': 'deu_0080', 'extended_role': 'pl'}	ist	PL -> SG	Die Einwohnerzahlen des Kanton	Die Einwohnerzahlen des Kanton ist zwischen den beiden letzten Volkszählungen um etwa ein Viertel angestiegen.	[]	[]	0	0	0	False	False	False	0.0019902078929426	SV-#	deu	PL	SG	SV	aux	+
Mancherlei Abfälliges ist über den Fünfakter geschrieben worden, dessen Zeit vielleicht erst jetzt gekommen ist.	gekommen				Zeit		{'Case': 'Nom', 'Gender': 'Fem', 'Number': 'Sing', 'lemma': 'Zeit'}	NOUN	ist.				5	[]	{'sent_id': 'test-s326', 'text': 'Mancherlei Abfälliges ist über den Fünfakter geschrieben worden, dessen Zeit vielleicht erst jetzt gekommen ist.', 'treebank': 'UD_German-GSD/de_gsd-ud-test.conllu', 'multiblimp_extended': True, 'pair_id': 'deu_0081', 'extended_role': 'sg'}	sind.	SG -> PL	Mancherlei Abfälliges ist über den Fünfakter geschrieben worden, dessen Zeit vielleicht erst jetzt gekommen	Mancherlei Abfälliges ist über den Fünfakter geschrieben worden, dessen Zeit vielleicht erst jetzt gekommen sind.	[]	[]	0	0	0	False	False	False	0.0008111536394801	SV-#	deu	SG	PL	SV	aux	+
Mancherlei Abfälliges ist über den Fünfakter geschrieben worden, deren Zeiten vielleicht erst jetzt gekommen sind.	gekommen				Zeiten		{'lemma': 'Zeit', 'Number': 'Plur'}	NOUN	sind.				5	[]	{'sent_id': 'test-s326', 'text': 'Mancherlei Abfälliges ist über den Fünfakter geschrieben worden, dessen Zeit vielleicht erst jetzt gekommen ist.', 'treebank': 'UD_German-GSD/de_gsd-ud-test.conllu', 'multiblimp_extended': True, 'pair_id': 'deu_0081', 'extended_role': 'pl'}	ist.	PL -> SG	Mancherlei Abfälliges ist über den Fünfakter geschrieben worden, deren Zeiten vielleicht erst jetzt gekommen	Mancherlei Abfälliges ist über den Fünfakter geschrieben worden, deren Zeiten vielleicht erst jetzt gekommen ist.	[]	[]	0	0	0	False	False	False	0.0008111536394801	SV-#	deu	PL	SG	SV	aux	+
Außerdem machen sie geltend, dass die Familie Habsburg - Lothringen an dem Krieg nicht schuld sei, weil es sich um keine Entscheidung der Familie gehandelt habe.	gehandelt				es		{'Case': 'Nom', 'Gender': 'Neut', 'Number': 'Sing', 'Person': '3', 'PronType': 'Prs', 'lemma': 'es'}	PRON	habe.				8	[]	{'sent_id': 'train-s8587', 'text': 'Außerdem machen sie geltend, dass die Familie Habsburg - Lothringen am Krieg nicht schuld sei, weil es sich um keine Entscheidung der Familie gehandelt habe.', 'treebank': 'UD_German-GSD/de_gsd-ud-train.conllu', 'multiblimp_extended': True, 'pair_id': 'deu_0082', 'extended_role': 'sg'}	haben.	SG -> PL	Außerdem machen sie geltend, dass die Familie Habsburg - Lothringen an dem Krieg nicht schuld sei, weil es sich um keine Entscheidung der Familie gehandelt	Außerdem machen sie geltend, dass die Familie Habsburg - Lothringen an dem Krieg nicht schuld sei, weil es sich um keine Entscheidung der Familie gehandelt haben.	[]	[]	0	0	0	False	False	False	0.0002976557259239	SV-#	deu	SG	PL	SV	aux	+
Außerdem machen sie geltend, dass die Familie Habsburg - Lothringen an dem Krieg nicht schuld sei, weil sie sich um keine Entscheidungen der Familie gehandelt haben.	gehandelt				Entscheidungen		{'lemma': 'es', 'Number': 'Plur'}	NOUN	haben.				8	[]	{'sent_id': 'train-s8587', 'text': 'Außerdem machen sie geltend, dass die Familie Habsburg - Lothringen am Krieg nicht schuld sei, weil es sich um keine Entscheidung der Familie gehandelt habe.', 'treebank': 'UD_German-GSD/de_gsd-ud-train.conllu', 'multiblimp_extended': True, 'pair_id': 'deu_0082', 'extended_role': 'pl'}	habe.	PL -> SG	Außerdem machen sie geltend, dass die Familie Habsburg - Lothringen an dem Krieg nicht schuld sei, weil sie sich um keine Entscheidungen der Familie gehandelt	Außerdem machen sie geltend, dass die Familie Habsburg - Lothringen an dem Krieg nicht schuld sei, weil sie sich um keine Entscheidungen der Familie gehandelt habe.	[]	[]	0	0	0	False	False	False	0.0002976557259239	SV-#	deu	PL	SG	SV	aux	+
Er bemerkte auch, dass „die Existenz eines solchen Dokuments Konsequenzen haben könnte, die wahrscheinlich, aber nicht akzeptabel“ seien.	haben				Existenz		{'Case': 'Nom', 'Gender': 'Fem', 'Number': 'Sing', 'lemma': 'Existenz'}	NOUN	könnte,				6	[]	"{'newdoc id': 'n03009', 'sent_id': 'n03009006', 'text': 'Er bemerkte auch, dass „die Existenz eines solchen Dokuments Konsequenzen haben könnte, die wahrscheinlich, aber nicht akzeptabel“ seien.', 'text_en': 'He also remarked that ""the existence of such a document could lead to consequences that are as likely as they are unacceptable"".', 'treebank': 'UD_German-PUD/de_pud-ud-test.conllu', 'multiblimp_extended': True, 'pair_id': 'deu_0083', 'extended_role': 'sg'}"	könnten,	SG -> PL	Er bemerkte auch, dass „die Existenz eines solchen Dokuments Konsequenzen haben	Er bemerkte auch, dass „die Existenz eines solchen Dokuments Konsequenzen haben könnten, die wahrscheinlich, aber nicht akzeptabel“ seien.	[]	[]	0	0	0	False	False	False	0.0034834526315528	SV-#	deu	SG	PL	SV	aux	+
Er bemerkte auch, dass „die Existenzen solcher Dokumente Konsequenzen haben könnten, die wahrscheinlich, aber nicht akzeptabel“ seien.	haben				Existenzen		{'lemma': 'Existenz', 'Number': 'Plur'}	NOUN	könnten,				6	[]	"{'newdoc id': 'n03009', 'sent_id': 'n03009006', 'text': 'Er bemerkte auch, dass „die Existenz eines solchen Dokuments Konsequenzen haben könnte, die wahrscheinlich, aber nicht akzeptabel“ seien.', 'text_en': 'He also remarked that ""the existence of such a document could lead to consequences that are as likely as they are unacceptable"".', 'treebank': 'UD_German-PUD/de_pud-ud-test.conllu', 'multiblimp_extended': True, 'pair_id': 'deu_0083', 'extended_role': 'pl'}"	könnte,	PL -> SG	Er bemerkte auch, dass „die Existenzen solcher Dokumente Konsequenzen haben	Er bemerkte auch, dass „die Existenzen solcher Dokumente Konsequenzen haben könnte, die wahrscheinlich, aber nicht akzeptabel“ seien.	[]	[]	0	0	0	False	False	False	0.0034834526315528	SV-#	deu	PL	SG	SV	aux	+
Wie bekanntgegeben wurde, hat die ECB die Entscheidungshoheit, und es wäre unangemessen, wenn die Bank für sich selbst sprechen würde, indem sie die Berücksichtigung anderer Alternativen ausschlösse.	sprechen				Bank		{'Case': 'Nom', 'Gender': 'Fem', 'Number': 'Sing', 'lemma': 'Bank'}	NOUN	würde,				5	[]	{'sent_id': 'n04007015', 'text': 'Wie bekanntgegeben wurde, hat die ECB die Entscheidungshoheit, und es wäre unangemessen, wenn die Bank für sich selbst sprechen würde, indem sie die Berücksichtigung anderer Alternativen ausschlösse.', 'text_en': 'As stated, the decision is the prerogative of the ECB and would appear inappropriate for the Bank to speak on its behalf by excluding the possibility of looking at other alternatives.', 'treebank': 'UD_German-PUD/de_pud-ud-test.conllu', 'multiblimp_extended': True, 'pair_id': 'deu_0084', 'extended_role': 'sg'}	würden,	SG -> PL	Wie bekanntgegeben wurde, hat die ECB die Entscheidungshoheit, und es wäre unangemessen, wenn die Bank für sich selbst sprechen	Wie bekanntgegeben wurde, hat die ECB die Entscheidungshoheit, und es wäre unangemessen, wenn die Bank für sich selbst sprechen würden, indem sie die Berücksichtigung anderer Alternativen ausschlösse.	[]	[]	0	0	0	False	False	False	0.0012927761129214	SV-#	deu	SG	PL	SV	aux	+
Wie bekanntgegeben wurde, hat die ECB die Entscheidungshoheit, und es wäre unangemessen, wenn die Banken für sich selbst sprechen würden, indem sie die Berücksichtigung anderer Alternativen ausschlösse.	sprechen				Banken		{'lemma': 'Bank', 'Number': 'Plur'}	NOUN	würden,				5	[]	{'sent_id': 'n04007015', 'text': 'Wie bekanntgegeben wurde, hat die ECB die Entscheidungshoheit, und es wäre unangemessen, wenn die Bank für sich selbst sprechen würde, indem sie die Berücksichtigung anderer Alternativen ausschlösse.', 'text_en': 'As stated, the decision is the prerogative of the ECB and would appear inappropriate for the Bank to speak on its behalf by excluding the possibility of looking at other alternatives.', 'treebank': 'UD_German-PUD/de_pud-ud-test.conllu', 'multiblimp_extended': True, 'pair_id': 'deu_0084', 'extended_role': 'pl'}	würde,	PL -> SG	Wie bekanntgegeben wurde, hat die ECB die Entscheidungshoheit, und es wäre unangemessen, wenn die Banken für sich selbst sprechen	Wie bekanntgegeben wurde, hat die ECB die Entscheidungshoheit, und es wäre unangemessen, wenn die Banken für sich selbst sprechen würde, indem sie die Berücksichtigung anderer Alternativen ausschlösse.	[]	[]	0	0	0	False	False	False	0.0012927761129214	SV-#	deu	PL	SG	SV	aux	+
Ich bin der Meinung, dass niemand in diesem Geschäft kaufen sollte!	kaufen				niemand		{'Case': 'Nom', 'Number': 'Sing', 'PronType': 'Neg', 'lemma': 'niemand'}	PRON	sollte!				5	[]	{'sent_id': 'dev-s71', 'text': 'Ich bin der Meinung, dass niemand in diesem Geschäft kaufen sollte!', 'treebank': 'UD_German-GSD/de_gsd-ud-dev.conllu', 'multiblimp_extended': True, 'pair_id': 'deu_0085', 'extended_role': 'sg'}	sollten!	SG -> PL	Ich bin der Meinung, dass niemand in diesem Geschäft kaufen	Ich bin der Meinung, dass niemand in diesem Geschäft kaufen sollten!	[]	[]	0	0	0	False	False	False	0.0009701371807892	SV-#	deu	SG	PL	SV	aux	+
Ich bin der Meinung, dass keine Leute in diesem Geschäft kaufen sollten!	kaufen				Leute		{'lemma': 'niemand', 'Number': 'Plur'}	NOUN	sollten!				5	[]	{'sent_id': 'dev-s71', 'text': 'Ich bin der Meinung, dass niemand in diesem Geschäft kaufen sollte!', 'treebank': 'UD_German-GSD/de_gsd-ud-dev.conllu', 'multiblimp_extended': True, 'pair_id': 'deu_0085', 'extended_role': 'pl'}	sollte!	PL -> SG	Ich bin der Meinung, dass keine Leute in diesem Geschäft kaufen	Ich bin der Meinung, dass keine Leute in diesem Geschäft kaufen sollte!	[]	[]	0	0	0	False	False	False	0.0009701371807892	SV-#	deu	PL	SG	SV	aux	+
Die Sauberkeit des Zimmers ist positiv zu vermerken.	vermerken				Sauberkeit		{'Case': 'Nom', 'Gender': 'Fem', 'Number': 'Sing', 'lemma': 'Sauberkeit'}	NOUN	ist				3	[]	{'sent_id': 'train-s672', 'text': 'Die Sauberkeit des Zimmers ist positiv zu vermerken.', 'treebank': 'UD_German-GSD/de_gsd-ud-train.conllu', 'multiblimp_extended': True, 'pair_id': 'deu_0086', 'extended_role': 'sg'}	sind	SG -> PL	Die Sauberkeit des Zimmers	Die Sauberkeit des Zimmers sind positiv zu vermerken.	[]	[]	0	0	0	False	False	False	0.0019902078929426	SV-#	deu	SG	PL	SV	aux	+
Die Sauberkeiten des Zimmers sind positiv zu vermerken.	vermerken				Sauberkeiten		{'lemma': 'Sauberkeit', 'Number': 'Plur'}	NOUN	sind				3	[]	{'sent_id': 'train-s672', 'text': 'Die Sauberkeit des Zimmers ist positiv zu vermerken.', 'treebank': 'UD_German-GSD/de_gsd-ud-train.conllu', 'multiblimp_extended': True, 'pair_id': 'deu_0086', 'extended_role': 'pl'}	ist	PL -> SG	Die Sauberkeiten des Zimmers	Die Sauberkeiten des Zimmers ist positiv zu vermerken.	[]	[]	0	0	0	False	False	False	0.0019902078929426	SV-#	deu	PL	SG	SV	aux	+
