sen	verb	verb_idx	cop	cop_idx	child	child_idx	child_features	child_upos	head	head_idx	head_features	head_upos	distance	attractors	metadata	swap_head	feature_vals	prefix	wrong_sen	congruent_attractors	incongruent_attractors	num_attractors	num_congruent_attractors	num_incongruent_attractors	has_attractors	only_has_congruent_attractors	only_has_incongruent_attractors	sample_weight	phenomenon	lang	grammatical_feature	ungrammatical_feature	wo	inflect_item	agreement_certainty
As it stands, while the services sector accounts for more than 70% of employment in South Korea, its productivity-growth rate remains much lower than that of the manufacturing sector.	accounts				sector		{'Number': 'Sing', 'lemma': 'sector'}	NOUN	accounts				1	[]	{'sent_id': 'en_partut-ud-1348', 'text': 'As it stands, while the services sector accounts for more than 70% of employment in South Korea, its productivity-growth rate remains much lower than that of the manufacturing sector.', 'treebank': 'UD_English-ParTUT/en_partut-ud-train.conllu', 'multiblimp_extended': True, 'pair_id': 'eng_0067', 'extended_role': 'sg'}	account	SG -> PL	As it stands, while the services sector	As it stands, while the services sector account for more than 70% of employment in South Korea, their productivity-growth rates remain much lower than that of the manufacturing sector.	[]	[]	0	0	0	False	False	False	2.2350611813763106e-06	SV-#	eng	SG	PL	SV	verb	+
As it stands, while the services sectors account for more than 70% of employment in South Korea, their productivity-growth rates remain much lower than that of the manufacturing sector.	accounts				sectors		{'lemma': 'sector', 'Number': 'Plur'}	NOUN	account				1	[]	{'sent_id': 'en_partut-ud-1348', 'text': 'As it stands, while the services sector accounts for more than 70% of employment in South Korea, its productivity-growth rate remains much lower than that of the manufacturing sector.', 'treebank': 'UD_English-ParTUT/en_partut-ud-train.conllu', 'multiblimp_extended': True, 'pair_id': 'eng_0067', 'extended_role': 'pl'}	accounts	PL -> SG	As it stands, while the services sectors	As it stands, while the services sectors accounts for more than 70% of employment in South Korea, its productivity-growth rate remains much lower than that of the manufacturing sector.	[]	[]	0	0	0	False	False	False	2.2350611813763106e-06	SV-#	eng	PL	SG	SV	verb	+
The historical city hall in Obermarsberg originates from the 13th century and was refurbished after the Thirty Years ' War.	originates				hall		{'Number': 'Sing', 'lemma': 'hall'}	NOUN	originates				3	[]	"{'sent_id': 'w02004021', 'text': ""The historical city hall in Obermarsberg originates from the 13th century and was refurbished after the Thirty Years' War."", 'treebank': 'UD_English-PUD/en_pud-ud-test.conllu', 'multiblimp_extended': True, 'pair_id': 'eng_0068', 'extended_role': 'sg'}"	originate	SG -> PL	The historical city hall in Obermarsberg	The historical city hall in Obermarsberg originate from the 13th century and were refurbished after the Thirty Years ' War.	[]	[]	0	0	0	False	False	False	9.807974360627812e-05	SV-#	eng	SG	PL	SV	verb	+
The historical city halls in Obermarsberg originate from the 13th century and were refurbished after the Thirty Years ' War.	originates				halls		{'lemma': 'hall', 'Number': 'Plur'}	NOUN	originate				3	[]	"{'sent_id': 'w02004021', 'text': ""The historical city hall in Obermarsberg originates from the 13th century and was refurbished after the Thirty Years' War."", 'treebank': 'UD_English-PUD/en_pud-ud-test.conllu', 'multiblimp_extended': True, 'pair_id': 'eng_0068', 'extended_role': 'pl'}"	originates	PL -> SG	The historical city halls in Obermarsberg	The historical city halls in Obermarsberg originates from the 13th century and was refurbished after the Thirty Years ' War.	[]	[]	0	0	0	False	False	False	9.807974360627812e-05	SV-#	eng	PL	SG	SV	verb	+
Perhaps that 's why a surge of tears clouds his pupils while the syllable of time unearths his crop and surrenders his mystery to the bound waters.	clouds				surge		{'Number': 'Sing', 'lemma': 'surge'}	NOUN	clouds				3	[]	"{'sent_id': 'n05007014', 'text': ""Perhaps that's why a surge of tears clouds his pupils while the syllable of time unearths his crop and surrenders his mystery to the bound waters."", 'treebank': 'UD_English-PUD/en_pud-ud-test.conllu', 'multiblimp_extended': True, 'pair_id': 'eng_0069', 'extended_role': 'sg'}"	cloud	SG -> PL	Perhaps that 's why a surge of tears	Perhaps that 's why a surge of tears cloud his pupils while the syllable of time unearths his crop and surrenders his mystery to the bound waters.	[]	[]	0	0	0	False	False	False	9.807974360627812e-05	SV-#	eng	SG	PL	SV	verb	+
Perhaps that 's why surges of tears cloud his pupils while the syllable of time unearths his crop and surrenders his mystery to the bound waters.	clouds				surges		{'lemma': 'surge', 'Number': 'Plur'}	NOUN	cloud				3	[]	"{'sent_id': 'n05007014', 'text': ""Perhaps that's why a surge of tears clouds his pupils while the syllable of time unearths his crop and surrenders his mystery to the bound waters."", 'treebank': 'UD_English-PUD/en_pud-ud-test.conllu', 'multiblimp_extended': True, 'pair_id': 'eng_0069', 'extended_role': 'pl'}"	clouds	PL -> SG	Perhaps that 's why surges of tears	Perhaps that 's why surges of tears clouds his pupils while the syllable of time unearths his crop and surrenders his mystery to the bound waters.	[]	[]	0	0	0	False	False	False	9.807974360627812e-05	SV-#	eng	PL	SG	SV	verb	+
I really like the MIUI, but a process crashes repeatedly about every 3 seconds.	crashes				process		{'Number': 'Sing', 'lemma': 'process'}	NOUN	crashes				1	[]	{'sent_id': 'answers-20111108084119AAhsBk8_ans-0003', 'newpar id': 'answers-20111108084119AAhsBk8_ans-p0002', 'text': 'I really like the MIUI, but a process crashes repeatedly about every 3 seconds.', 'treebank': 'UD_English-EWT/en_ewt-ud-train.conllu', 'multiblimp_extended': True, 'pair_id': 'eng_0070', 'extended_role': 'sg'}	crash	SG -> PL	I really like the MIUI, but a process	I really like the MIUI, but a process crash repeatedly about every 3 seconds.	[]	[]	0	0	0	False	False	False	4.470122362752621e-06	SV-#	eng	SG	PL	SV	verb	+
I really like the MIUI, but processes crash repeatedly about every 3 seconds.	crashes				processes		{'lemma': 'process', 'Number': 'Plur'}	NOUN	crash				1	[]	{'sent_id': 'answers-20111108084119AAhsBk8_ans-0003', 'newpar id': 'answers-20111108084119AAhsBk8_ans-p0002', 'text': 'I really like the MIUI, but a process crashes repeatedly about every 3 seconds.', 'treebank': 'UD_English-EWT/en_ewt-ud-train.conllu', 'multiblimp_extended': True, 'pair_id': 'eng_0070', 'extended_role': 'pl'}	crashes	PL -> SG	I really like the MIUI, but processes	I really like the MIUI, but processes crashes repeatedly about every 3 seconds.	[]	[]	0	0	0	False	False	False	4.470122362752621e-06	SV-#	eng	PL	SG	SV	verb	+
This strength of design ensures that a Shakespeare play can survive translation, cutting and wide interpretation without loss to its core drama.	ensures				strength		{'Number': 'Sing', 'lemma': 'strength'}	NOUN	ensures				3	[]	{'sent_id': 'en_partut-ud-2015', 'text': 'This strength of design ensures that a Shakespeare play can survive translation, cutting and wide interpretation without loss to its core drama.', 'treebank': 'UD_English-ParTUT/en_partut-ud-train.conllu', 'multiblimp_extended': True, 'pair_id': 'eng_0071', 'extended_role': 'sg'}	ensure	SG -> PL	This strength of design	This strength of design ensure that a Shakespeare play can survive translation, cutting and wide interpretation without loss to its core drama.	[]	[]	0	0	0	False	False	False	2.4519935901569527e-05	SV-#	eng	SG	PL	SV	verb	+
These strengths of design ensure that a Shakespeare play can survive translation, cutting and wide interpretation without loss to its core drama.	ensures				strengths		{'lemma': 'strength', 'Number': 'Plur'}	NOUN	ensure				3	[]	{'sent_id': 'en_partut-ud-2015', 'text': 'This strength of design ensures that a Shakespeare play can survive translation, cutting and wide interpretation without loss to its core drama.', 'treebank': 'UD_English-ParTUT/en_partut-ud-train.conllu', 'multiblimp_extended': True, 'pair_id': 'eng_0071', 'extended_role': 'pl'}	ensures	PL -> SG	These strengths of design	These strengths of design ensures that a Shakespeare play can survive translation, cutting and wide interpretation without loss to its core drama.	[]	[]	0	0	0	False	False	False	2.4519935901569527e-05	SV-#	eng	PL	SG	SV	verb	+
Meats are kept VERY cold, seafood smells fresh and the serving bar is VERY clean.	smells				seafood		{'Number': 'Sing', 'lemma': 'seafood'}	NOUN	smells				1	[]	{'sent_id': 'reviews-331662-0009', 'text': 'Meats are kept VERY cold, seafood smells fresh and the serving bar is VERY clean.', 'treebank': 'UD_English-EWT/en_ewt-ud-train.conllu', 'multiblimp_extended': True, 'pair_id': 'eng_0072', 'extended_role': 'sg'}	smell	SG -> PL	Meats are kept VERY cold, seafood	Meats are kept VERY cold, seafood smell fresh and the serving bar is VERY clean.	[]	[]	0	0	0	False	False	False	1.4900407875842068e-06	SV-#	eng	SG	PL	SV	verb	+
Meats are kept VERY cold, seafoods smell fresh and the serving bar is VERY clean.	smells				seafoods		{'lemma': 'seafood', 'Number': 'Plur'}	NOUN	smell				1	[]	{'sent_id': 'reviews-331662-0009', 'text': 'Meats are kept VERY cold, seafood smells fresh and the serving bar is VERY clean.', 'treebank': 'UD_English-EWT/en_ewt-ud-train.conllu', 'multiblimp_extended': True, 'pair_id': 'eng_0072', 'extended_role': 'pl'}	smells	PL -> SG	Meats are kept VERY cold, seafoods	Meats are kept VERY cold, seafoods smells fresh and the serving bar is VERY clean.	[]	[]	0	0	0	False	False	False	1.4900407875842068e-06	SV-#	eng	PL	SG	SV	verb	+
Someone observes that the Church is a worshiper of success and always follows the majorities.	observes				Someone		{'Number': 'Sing', 'PronType': 'Ind', 'lemma': 'someone'}	PRON	observes				1	[]	{'sent_id': 'en_lines-ud-dev-doc3-3495', 'text': 'Someone observes that the Church is a worshiper of success and always follows the majorities.', 'treebank': 'UD_English-LinES/en_lines-ud-dev.conllu', 'multiblimp_extended': True, 'pair_id': 'eng_0073', 'extended_role': 'sg'}	observe	SG -> PL	Someone	Someone observe that the Church is a worshiper of success and always follows the majorities.	[]	[]	0	0	0	False	False	False	4.470122362752621e-06	SV-#	eng	SG	PL	SV	verb	+
Some people observe that the Church is a worshiper of success and always follows the majorities.	observes				people		{'lemma': 'someone', 'Number': 'Plur'}	NOUN	observe				1	[]	{'sent_id': 'en_lines-ud-dev-doc3-3495', 'text': 'Someone observes that the Church is a worshiper of success and always follows the majorities.', 'treebank': 'UD_English-LinES/en_lines-ud-dev.conllu', 'multiblimp_extended': True, 'pair_id': 'eng_0073', 'extended_role': 'pl'}	observes	PL -> SG	Some people	Some people observes that the Church is a worshiper of success and always follows the majorities.	[]	[]	0	0	0	False	False	False	4.470122362752621e-06	SV-#	eng	PL	SG	SV	verb	+
Entitlement to free abortions equates with women having the right to manage their lives and make decisions about their own bodies.	equates				Entitlement		{'Number': 'Sing', 'lemma': 'entitlement'}	NOUN	equates				4	[]	{'sent_id': 'en_lines-ud-test-doc5-4813', 'text': 'Entitlement to free abortions equates with women having the right to manage their lives and make decisions about their own bodies.', 'treebank': 'UD_English-LinES/en_lines-ud-test.conllu', 'multiblimp_extended': True, 'pair_id': 'eng_0074', 'extended_role': 'sg'}	equate	SG -> PL	Entitlement to free abortions	Entitlement to free abortions equate with women having the right to manage their lives and make decisions about their own bodies.	[]	[]	0	0	0	False	False	False	0.0001282581262543	SV-#	eng	SG	PL	SV	verb	+
Entitlements to free abortions equate with women having the right to manage their lives and make decisions about their own bodies.	equates				Entitlements		{'lemma': 'entitlement', 'Number': 'Plur'}	NOUN	equate				4	[]	{'sent_id': 'en_lines-ud-test-doc5-4813', 'text': 'Entitlement to free abortions equates with women having the right to manage their lives and make decisions about their own bodies.', 'treebank': 'UD_English-LinES/en_lines-ud-test.conllu', 'multiblimp_extended': True, 'pair_id': 'eng_0074', 'extended_role': 'pl'}	equates	PL -> SG	Entitlements to free abortions	Entitlements to free abortions equates with women having the right to manage their lives and make decisions about their own bodies.	[]	[]	0	0	0	False	False	False	0.0001282581262543	SV-#	eng	PL	SG	SV	verb	+
As the American public gradually wearies of the Iraq crisis, some have begun worrying that the war could blow back on the US by creating the conditions for anti-American terrorism.	wearies				public		{'Number': 'Sing', 'lemma': 'public'}	NOUN	wearies				2	[]	{'sent_id': 'weblog-juancole.com_juancole_20040604210986_ENG_20040604_210986-0004', 'newpar id': 'weblog-juancole.com_juancole_20040604210986_ENG_20040604_210986-p0004', 'text': 'As the American public gradually wearies of the Iraq crisis, some have begun worrying that the war could blow back on the US by creating the conditions for anti-American terrorism.', 'treebank': 'UD_English-EWT/en_ewt-ud-train.conllu', 'multiblimp_extended': True, 'pair_id': 'eng_0075', 'extended_role': 'sg'}	weary	SG -> PL	As the American public gradually	As the American public gradually weary of the Iraq crisis, some have begun worrying that the war could blow back on the US by creating the conditions for anti-American terrorism.	[]	[]	0	0	0	False	False	False	4.16838910326682e-05	SV-#	eng	SG	PL	SV	verb	+
As the American publics gradually weary of the Iraq crisis, some have begun worrying that the war could blow back on the US by creating the conditions for anti-American terrorism.	wearies				publics		{'lemma': 'public', 'Number': 'Plur'}	NOUN	weary				2	[]	{'sent_id': 'weblog-juancole.com_juancole_20040604210986_ENG_20040604_210986-0004', 'newpar id': 'weblog-juancole.com_juancole_20040604210986_ENG_20040604_210986-p0004', 'text': 'As the American public gradually wearies of the Iraq crisis, some have begun worrying that the war could blow back on the US by creating the conditions for anti-American terrorism.', 'treebank': 'UD_English-EWT/en_ewt-ud-train.conllu', 'multiblimp_extended': True, 'pair_id': 'eng_0075', 'extended_role': 'pl'}	wearies	PL -> SG	As the American publics gradually	As the American publics gradually wearies of the Iraq crisis, some have begun worrying that the war could blow back on the US by creating the conditions for anti-American terrorism.	[]	[]	0	0	0	False	False	False	4.16838910326682e-05	SV-#	eng	PL	SG	SV	verb	+
If you move the line upward, the distance between the moving line and the nearest parallel line below remains constant, and the perpendicular line above the moving line contracts.	contracts				line		{'Number': 'Sing', 'lemma': 'line'}	NOUN	contracts.				5	[]	{'sent_id': 'en_lines-ud-train-doc1-239', 'text': 'If you move the line upward, the distance between the moving line and the nearest parallel line below remains constant, and the perpendicular line above the moving line contracts.', 'treebank': 'UD_English-LinES/en_lines-ud-train.conllu', 'multiblimp_extended': True, 'pair_id': 'eng_0076', 'extended_role': 'sg'}	contract.	SG -> PL	If you move the line upward, the distance between the moving line and the nearest parallel line below remains constant, and the perpendicular line above the moving line	If you move the line upward, the distance between the moving line and the nearest parallel line below remains constant, and the perpendicular line above the moving line contract.	[]	[]	0	0	0	False	False	False	5.557852137689093e-05	SV-#	eng	SG	PL	SV	verb	+
If you move the line upward, the distance between the moving line and the nearest parallel line below remains constant, and the perpendicular lines above the moving line contract.	contracts				lines		{'lemma': 'line', 'Number': 'Plur'}	NOUN	contract.				5	[]	{'sent_id': 'en_lines-ud-train-doc1-239', 'text': 'If you move the line upward, the distance between the moving line and the nearest parallel line below remains constant, and the perpendicular line above the moving line contracts.', 'treebank': 'UD_English-LinES/en_lines-ud-train.conllu', 'multiblimp_extended': True, 'pair_id': 'eng_0076', 'extended_role': 'pl'}	contracts.	PL -> SG	If you move the line upward, the distance between the moving line and the nearest parallel line below remains constant, and the perpendicular lines above the moving line	If you move the line upward, the distance between the moving line and the nearest parallel line below remains constant, and the perpendicular lines above the moving line contracts.	[]	[]	0	0	0	False	False	False	5.557852137689093e-05	SV-#	eng	PL	SG	SV	verb	+
He is pimply, his neck is thin, his blue eyes goggle, his underlip extrudes.	extrudes				underlip		{'Number': 'Sing', 'lemma': 'underlip'}	NOUN	extrudes.				1	[]	{'sent_id': 'en_lines-ud-train-doc3-852', 'text': 'He is pimply, his neck is thin, his blue eyes goggle, his underlip extrudes.', 'treebank': 'UD_English-LinES/en_lines-ud-train.conllu', 'multiblimp_extended': True, 'pair_id': 'eng_0077', 'extended_role': 'sg'}	extrude.	SG -> PL	He is pimply, his neck is thin, his blue eyes goggle, his underlip	He is pimply, his neck is thin, his blue eyes goggle, his underlip extrude.	[]	[]	0	0	0	False	False	False	4.470122362752621e-06	SV-#	eng	SG	PL	SV	verb	+
He is pimply, his neck is thin, his blue eyes goggle, his underlips extrude.	extrudes				underlips		{'lemma': 'underlip', 'Number': 'Plur'}	NOUN	extrude.				1	[]	{'sent_id': 'en_lines-ud-train-doc3-852', 'text': 'He is pimply, his neck is thin, his blue eyes goggle, his underlip extrudes.', 'treebank': 'UD_English-LinES/en_lines-ud-train.conllu', 'multiblimp_extended': True, 'pair_id': 'eng_0077', 'extended_role': 'pl'}	extrudes.	PL -> SG	He is pimply, his neck is thin, his blue eyes goggle, his underlips	He is pimply, his neck is thin, his blue eyes goggle, his underlips extrudes.	[]	[]	0	0	0	False	False	False	4.470122362752621e-06	SV-#	eng	PL	SG	SV	verb	+
Habitat destruction vastly increases an area 's vulnerability to natural disasters like flood and drought, crop failure, spread of disease, and water contamination.	increases				destruction		{'Number': 'Sing', 'lemma': 'destruction'}	NOUN	increases				2	[]	"{'newdoc id': 'w01035', 'sent_id': 'w01035079', 'text': ""Habitat destruction vastly increases an area's vulnerability to natural disasters like flood and drought, crop failure, spread of disease, and water contamination."", 'treebank': 'UD_English-PUD/en_pud-ud-test.conllu', 'multiblimp_extended': True, 'pair_id': 'eng_0078', 'extended_role': 'sg'}"	increase	SG -> PL	Habitat destruction vastly	Habitat destruction vastly increase an area 's vulnerability to natural disasters like flood and drought, crop failure, spread of disease, and water contamination.	[]	[]	0	0	0	False	False	False	1.0420972758167049e-05	SV-#	eng	SG	PL	SV	verb	+
Habitat destructions vastly increase an area 's vulnerability to natural disasters like flood and drought, crop failure, spread of disease, and water contamination.	increases				destructions		{'lemma': 'destruction', 'Number': 'Plur'}	NOUN	increase				2	[]	"{'newdoc id': 'w01035', 'sent_id': 'w01035079', 'text': ""Habitat destruction vastly increases an area's vulnerability to natural disasters like flood and drought, crop failure, spread of disease, and water contamination."", 'treebank': 'UD_English-PUD/en_pud-ud-test.conllu', 'multiblimp_extended': True, 'pair_id': 'eng_0078', 'extended_role': 'pl'}"	increases	PL -> SG	Habitat destructions vastly	Habitat destructions vastly increases an area 's vulnerability to natural disasters like flood and drought, crop failure, spread of disease, and water contamination.	[]	[]	0	0	0	False	False	False	1.0420972758167049e-05	SV-#	eng	PL	SG	SV	verb	+
These include two operas by Giuseppe Verdi, Otello and Falstaff, whose critical standing compares with that of the source plays.	compares				standing		{'Number': 'Sing', 'lemma': 'standing'}	NOUN	compares				1	[]	{'sent_id': 'en_partut-ud-2031', 'text': 'These include two operas by Giuseppe Verdi, Otello and Falstaff, whose critical standing compares with that of the source plays.', 'treebank': 'UD_English-ParTUT/en_partut-ud-dev.conllu', 'multiblimp_extended': True, 'pair_id': 'eng_0079', 'extended_role': 'sg'}	compare	SG -> PL	These include two operas by Giuseppe Verdi, Otello and Falstaff, whose critical standing	These include two operas by Giuseppe Verdi, Otello and Falstaff, whose critical standing compare with that of the source plays.	[]	[]	0	0	0	False	False	False	1.4900407875842068e-06	SV-#	eng	SG	PL	SV	verb	+
These include two operas by Giuseppe Verdi, Otello and Falstaff, whose critical standings compare with that of the source plays.	compares				standings		{'lemma': 'standing', 'Number': 'Plur'}	NOUN	compare				1	[]	{'sent_id': 'en_partut-ud-2031', 'text': 'These include two operas by Giuseppe Verdi, Otello and Falstaff, whose critical standing compares with that of the source plays.', 'treebank': 'UD_English-ParTUT/en_partut-ud-dev.conllu', 'multiblimp_extended': True, 'pair_id': 'eng_0079', 'extended_role': 'pl'}	compares	PL -> SG	These include two operas by Giuseppe Verdi, Otello and Falstaff, whose critical standings	These include two operas by Giuseppe Verdi, Otello and Falstaff, whose critical standings compares with that of the source plays.	[]	[]	0	0	0	False	False	False	1.4900407875842068e-06	SV-#	eng	PL	SG	SV	verb	+
Even if local Palestinian leaders remain strong enough to keep al-Qaida out, the festering Israeli-Palestinian struggle remains among the best recruiting posters for al-Qaida with young Muslim men.	remains				struggle		{'Number': 'Sing', 'lemma': 'struggle'}	NOUN	remains				1	[]	{'sent_id': 'weblog-juancole.com_juancole_20041120060600_ENG_20041120_060600-0008', 'text': 'Even if local Palestinian leaders remain strong enough to keep al-Qaida out, the festering Israeli-Palestinian struggle remains among the best recruiting posters for al-Qaida with young Muslim men.', 'treebank': 'UD_English-EWT/en_ewt-ud-dev.conllu', 'multiblimp_extended': True, 'pair_id': 'eng_0080', 'extended_role': 'sg'}	remain	SG -> PL	Even if local Palestinian leaders remain strong enough to keep al-Qaida out, the festering Israeli-Palestinian struggle	Even if local Palestinian leaders remain strong enough to keep al-Qaida out, the festering Israeli-Palestinian struggle remain among the best recruiting posters for al-Qaida with young Muslim men.	[]	[]	0	0	0	False	False	False	2.9800815751684144e-07	SV-#	eng	SG	PL	SV	verb	+
Even if local Palestinian leaders remain strong enough to keep al-Qaida out, the festering Israeli-Palestinian struggles remain among the best recruiting posters for al-Qaida with young Muslim men.	remains				struggles		{'lemma': 'struggle', 'Number': 'Plur'}	NOUN	remain				1	[]	{'sent_id': 'weblog-juancole.com_juancole_20041120060600_ENG_20041120_060600-0008', 'text': 'Even if local Palestinian leaders remain strong enough to keep al-Qaida out, the festering Israeli-Palestinian struggle remains among the best recruiting posters for al-Qaida with young Muslim men.', 'treebank': 'UD_English-EWT/en_ewt-ud-dev.conllu', 'multiblimp_extended': True, 'pair_id': 'eng_0080', 'extended_role': 'pl'}	remains	PL -> SG	Even if local Palestinian leaders remain strong enough to keep al-Qaida out, the festering Israeli-Palestinian struggles	Even if local Palestinian leaders remain strong enough to keep al-Qaida out, the festering Israeli-Palestinian struggles remains among the best recruiting posters for al-Qaida with young Muslim men.	[]	[]	0	0	0	False	False	False	2.9800815751684144e-07	SV-#	eng	PL	SG	SV	verb	+
What person(s) in London prepares credit for the English and Singapore financial transactions?	prepares				person		{'Number': 'Sing', 'lemma': 'person'}	NOUN	prepares				6	[]	{'sent_id': 'email-enronsent36_02-0059', 'text': 'What person(s) in London prepares credit for the English and Singapore financial transactions?', 'treebank': 'UD_English-EWT/en_ewt-ud-train.conllu', 'multiblimp_extended': True, 'pair_id': 'eng_0081', 'extended_role': 'sg'}	prepare	SG -> PL	What person(s) in London	What person(s) in London prepare credit for the English and Singapore financial transactions?	[]	[]	0	0	0	False	False	False	0.0001515777855733	SV-#	eng	SG	PL	SV	verb	+
What people in London prepare credit for the English and Singapore financial transactions?	prepares				people		{'lemma': 'person', 'Number': 'Plur'}	NOUN	prepare				6	[]	{'sent_id': 'email-enronsent36_02-0059', 'text': 'What person(s) in London prepares credit for the English and Singapore financial transactions?', 'treebank': 'UD_English-EWT/en_ewt-ud-train.conllu', 'multiblimp_extended': True, 'pair_id': 'eng_0081', 'extended_role': 'pl'}	prepares	PL -> SG	What people in London	What people in London prepares credit for the English and Singapore financial transactions?	[]	[]	0	0	0	False	False	False	0.0001515777855733	SV-#	eng	PL	SG	SV	verb	+
