sen	verb	verb_idx	cop	cop_idx	child	child_idx	child_features	child_upos	head	head_idx	head_features	head_upos	distance	attractors	metadata	swap_head	feature_vals	prefix	wrong_sen	congruent_attractors	incongruent_attractors	num_attractors	num_congruent_attractors	num_incongruent_attractors	has_attractors	only_has_congruent_attractors	only_has_incongruent_attractors	sample_weight	phenomenon	lang	grammatical_feature	ungrammatical_feature	wo	inflect_item	agreement_certainty
Some part of this same outer circle actually operates as a result of fear from, or blackmail by, the inner circles.	operate				part		{'lemma': 'part', 'Number': 'Sing'}	NOUN	operates				7	[]	{'sent_id': 'weblog-blogspot.com_alaindewitt_20060924104100_ENG_20060924_104100-0153', 'text': 'Some parts of this same outer circle actually operate as a result of fear from, or blackmail by, the inner circles.', 'treebank': 'UD_English-EWT/en_ewt-ud-train.conllu', 'multiblimp_extended': True, 'pair_id': 'eng_0199', 'extended_role': 'sg'}	operate	SG -> PL	Some part of this same outer circle actually	Some part of this same outer circle actually operate as a result of fear from, or blackmail by, the inner circles.	[]	[]	0	0	0	False	False	False	0.082725549752491	SV-#	eng	SG	PL	SV	verb	+
Some parts of this same outer circle actually operate as a result of fear from, or blackmail by, the inner circles.	operate				parts		{'Number': 'Plur', 'lemma': 'part'}	NOUN	operate				7	[]	{'sent_id': 'weblog-blogspot.com_alaindewitt_20060924104100_ENG_20060924_104100-0153', 'text': 'Some parts of this same outer circle actually operate as a result of fear from, or blackmail by, the inner circles.', 'treebank': 'UD_English-EWT/en_ewt-ud-train.conllu', 'multiblimp_extended': True, 'pair_id': 'eng_0199', 'extended_role': 'pl'}	operates	PL -> SG	Some parts of this same outer circle actually	Some parts of this same outer circle actually operates as a result of fear from, or blackmail by, the inner circles.	[]	[]	0	0	0	False	False	False	0.082725549752491	SV-#	eng	PL	SG	SV	verb	+
It, above – the Council in Europe, you know – means him to be.	mean				Council		{'lemma': 'they', 'Number': 'Sing'}	NOUN	means				12	[]	{'sent_id': 'en_lines-ud-test-doc4-4685', 'text': 'They, above – the Council in Europe, you know – mean him to be.', 'treebank': 'UD_English-LinES/en_lines-ud-test.conllu', 'multiblimp_extended': True, 'pair_id': 'eng_0200', 'extended_role': 'sg'}	mean	SG -> PL	It, above – the Council in Europe, you know –	It, above – the Council in Europe, you know – mean him to be.	[]	[]	0	0	0	False	False	False	0.0060955668238677	SV-#	eng	SG	PL	SV	verb	+
They, above – the Council in Europe, you know – mean him to be.	mean				They		{'Case': 'Nom', 'Number': 'Plur', 'Person': '3', 'PronType': 'Prs', 'lemma': 'they'}	PRON	mean				12	[]	{'sent_id': 'en_lines-ud-test-doc4-4685', 'text': 'They, above – the Council in Europe, you know – mean him to be.', 'treebank': 'UD_English-LinES/en_lines-ud-test.conllu', 'multiblimp_extended': True, 'pair_id': 'eng_0200', 'extended_role': 'pl'}	means	PL -> SG	They, above – the Council in Europe, you know –	They, above – the Council in Europe, you know – means him to be.	[]	[]	0	0	0	False	False	False	0.0060955668238677	SV-#	eng	PL	SG	SV	verb	+
a member of the traveler community bare knuckle boxes.	box				member		{'lemma': 'member', 'Number': 'Sing'}	NOUN	boxes.				7	[]	{'sent_id': 'answers-20111108033619AAb3VQ4_ans-0004', 'newpar id': 'answers-20111108033619AAb3VQ4_ans-p0004', 'text': 'some members of the traveler community bare knuckle box.', 'treebank': 'UD_English-EWT/en_ewt-ud-dev.conllu', 'multiblimp_extended': True, 'pair_id': 'eng_0201', 'extended_role': 'sg'}	box.	SG -> PL	a member of the traveler community bare knuckle	a member of the traveler community bare knuckle box.	[]	[]	0	0	0	False	False	False	0.0413627748762455	SV-#	eng	SG	PL	SV	verb	+
some members of the traveler community bare knuckle box.	box				members		{'Number': 'Plur', 'lemma': 'member'}	NOUN	box.				7	[]	{'sent_id': 'answers-20111108033619AAb3VQ4_ans-0004', 'newpar id': 'answers-20111108033619AAb3VQ4_ans-p0004', 'text': 'some members of the traveler community bare knuckle box.', 'treebank': 'UD_English-EWT/en_ewt-ud-dev.conllu', 'multiblimp_extended': True, 'pair_id': 'eng_0201', 'extended_role': 'pl'}	boxes.	PL -> SG	some members of the traveler community bare knuckle	some members of the traveler community bare knuckle boxes.	[]	[]	0	0	0	False	False	False	0.0413627748762455	SV-#	eng	PL	SG	SV	verb	+
PS: I took the liberty of buying the corporate phone directory and locating information on your outstanding disputed credit accounts from an internet dealer today, and can probably make you better known to your customers than the security measure you enact at your company indicates you would like.	indicate				measure		{'lemma': 'measure', 'Number': 'Sing'}	NOUN	indicates				6	[]	{'newpar': None, 'newpar_block': 'p (3 s)', 'sent_id': 'GENTLE_threat_white-5', 's_prominence': '2', 's_type': 'decl', 'transition': 'smooth-shift', 'text': 'PS: I took the liberty of buying the corporate phone directory and locating information on your outstanding disputed credit accounts from an internet dealer today, and can probably make you better known to your customers than the security measures you enact at your company indicate you would like.', 'treebank': 'UD_English-GENTLE/en_gentle-ud-test.conllu', 'multiblimp_extended': True, 'pair_id': 'eng_0202', 'extended_role': 'sg'}	indicate	SG -> PL	PS: I took the liberty of buying the corporate phone directory and locating information on your outstanding disputed credit accounts from an internet dealer today, and can probably make you better known to your customers than the security measure you enact at your company	PS: I took the liberty of buying the corporate phone directory and locating information on your outstanding disputed credit accounts from an internet dealer today, and can probably make you better known to your customers than the security measure you enact at your company indicate you would like.	[]	[]	0	0	0	False	False	False	0.0386052565511624	SV-#	eng	SG	PL	SV	verb	+
PS: I took the liberty of buying the corporate phone directory and locating information on your outstanding disputed credit accounts from an internet dealer today, and can probably make you better known to your customers than the security measures you enact at your company indicate you would like.	indicate				measures		{'Number': 'Plur', 'lemma': 'measure'}	NOUN	indicate				6	[]	{'newpar': None, 'newpar_block': 'p (3 s)', 'sent_id': 'GENTLE_threat_white-5', 's_prominence': '2', 's_type': 'decl', 'transition': 'smooth-shift', 'text': 'PS: I took the liberty of buying the corporate phone directory and locating information on your outstanding disputed credit accounts from an internet dealer today, and can probably make you better known to your customers than the security measures you enact at your company indicate you would like.', 'treebank': 'UD_English-GENTLE/en_gentle-ud-test.conllu', 'multiblimp_extended': True, 'pair_id': 'eng_0202', 'extended_role': 'pl'}	indicates	PL -> SG	PS: I took the liberty of buying the corporate phone directory and locating information on your outstanding disputed credit accounts from an internet dealer today, and can probably make you better known to your customers than the security measures you enact at your company	PS: I took the liberty of buying the corporate phone directory and locating information on your outstanding disputed credit accounts from an internet dealer today, and can probably make you better known to your customers than the security measures you enact at your company indicates you would like.	[]	[]	0	0	0	False	False	False	0.0386052565511624	SV-#	eng	PL	SG	SV	verb	+
The decision to sidestep the obvious to satisfy the need to avoid confrontation does not bring peace, but only delays the eventual conflict as the predator of Hamas and Hezbollah exploits the inherent weakness of the internationals and the media.	exploit				predator		{'lemma': 'predator', 'Number': 'Sing'}	NOUN	exploits				5	[]	{'sent_id': 'weblog-blogspot.com_floppingaces_20050313182621_ENG_20050313_182621-0010', 'newpar id': 'weblog-blogspot.com_floppingaces_20050313182621_ENG_20050313_182621-p0002', 'text': 'The decision to sidestep the obvious to satisfy the need to avoid confrontation does not bring peace, but only delays the eventual conflict as the predators of Hamas and Hezbollah exploit the inherent weakness of the internationals and the media.', 'treebank': 'UD_English-EWT/en_ewt-ud-test.conllu', 'multiblimp_extended': True, 'pair_id': 'eng_0203', 'extended_role': 'sg'}	exploit	SG -> PL	The decision to sidestep the obvious to satisfy the need to avoid confrontation does not bring peace, but only delays the eventual conflict as the predator of Hamas and Hezbollah	The decision to sidestep the obvious to satisfy the need to avoid confrontation does not bring peace, but only delays the eventual conflict as the predator of Hamas and Hezbollah exploit the inherent weakness of the internationals and the media.	[]	[]	0	0	0	False	False	False	0.082725549752491	SV-#	eng	SG	PL	SV	verb	+
The decision to sidestep the obvious to satisfy the need to avoid confrontation does not bring peace, but only delays the eventual conflict as the predators of Hamas and Hezbollah exploit the inherent weakness of the internationals and the media.	exploit				predators		{'Number': 'Plur', 'lemma': 'predator'}	NOUN	exploit				5	[]	{'sent_id': 'weblog-blogspot.com_floppingaces_20050313182621_ENG_20050313_182621-0010', 'newpar id': 'weblog-blogspot.com_floppingaces_20050313182621_ENG_20050313_182621-p0002', 'text': 'The decision to sidestep the obvious to satisfy the need to avoid confrontation does not bring peace, but only delays the eventual conflict as the predators of Hamas and Hezbollah exploit the inherent weakness of the internationals and the media.', 'treebank': 'UD_English-EWT/en_ewt-ud-test.conllu', 'multiblimp_extended': True, 'pair_id': 'eng_0203', 'extended_role': 'pl'}	exploits	PL -> SG	The decision to sidestep the obvious to satisfy the need to avoid confrontation does not bring peace, but only delays the eventual conflict as the predators of Hamas and Hezbollah	The decision to sidestep the obvious to satisfy the need to avoid confrontation does not bring peace, but only delays the eventual conflict as the predators of Hamas and Hezbollah exploits the inherent weakness of the internationals and the media.	[]	[]	0	0	0	False	False	False	0.082725549752491	SV-#	eng	PL	SG	SV	verb	+
The paper found at headquarters of the Mukhabarat, Iraq 's secret police, shows that an entourage from Al Qaeda group was sent to the Iraqi capital in March 1998 from Sudan.	show				paper		{'lemma': 'paper', 'Number': 'Sing'}	NOUN	shows				13	[]	"{'sent_id': 'weblog-blogspot.com_dakbangla_20050311135387_ENG_20050311_135387-0145', 'text': ""The papers found at headquarters of the Mukhabarat, Iraq's secret police, show that an entourage from Al Qaeda group was sent to the Iraqi capital in March 1998 from Sudan."", 'treebank': 'UD_English-EWT/en_ewt-ud-train.conllu', 'multiblimp_extended': True, 'pair_id': 'eng_0204', 'extended_role': 'sg'}"	show	SG -> PL	The paper found at headquarters of the Mukhabarat, Iraq 's secret police,	The paper found at headquarters of the Mukhabarat, Iraq 's secret police, show that an entourage from Al Qaeda group was sent to the Iraqi capital in March 1998 from Sudan.	[]	[]	0	0	0	False	False	False	0.0723848560334296	SV-#	eng	SG	PL	SV	verb	+
The papers found at headquarters of the Mukhabarat, Iraq 's secret police, show that an entourage from Al Qaeda group was sent to the Iraqi capital in March 1998 from Sudan.	show				papers		{'Number': 'Plur', 'lemma': 'paper'}	NOUN	show				13	[]	"{'sent_id': 'weblog-blogspot.com_dakbangla_20050311135387_ENG_20050311_135387-0145', 'text': ""The papers found at headquarters of the Mukhabarat, Iraq's secret police, show that an entourage from Al Qaeda group was sent to the Iraqi capital in March 1998 from Sudan."", 'treebank': 'UD_English-EWT/en_ewt-ud-train.conllu', 'multiblimp_extended': True, 'pair_id': 'eng_0204', 'extended_role': 'pl'}"	shows	PL -> SG	The papers found at headquarters of the Mukhabarat, Iraq 's secret police,	The papers found at headquarters of the Mukhabarat, Iraq 's secret police, shows that an entourage from Al Qaeda group was sent to the Iraqi capital in March 1998 from Sudan.	[]	[]	0	0	0	False	False	False	0.0723848560334296	SV-#	eng	PL	SG	SV	verb	+
"The danger implicit in any attack upon that nation, however, seems to significantly offset whatever gains could be made in the so-called ""War on Terror."""	seem				danger		{'lemma': 'danger', 'Number': 'Sing'}	NOUN	seems				11	[]	"{'sent_id': 'newsgroup-groups.google.com_misc.consumers_a534e32067078b08_ENG_20060116_030800-0120', 'text': 'The dangers implicit in any attack upon that nation, however, seem to significantly offset whatever gains could be made in the so-called ""War on Terror.""', 'treebank': 'UD_English-EWT/en_ewt-ud-train.conllu', 'multiblimp_extended': True, 'pair_id': 'eng_0205', 'extended_role': 'sg'}"	seem	SG -> PL	The danger implicit in any attack upon that nation, however,	"The danger implicit in any attack upon that nation, however, seem to significantly offset whatever gains could be made in the so-called ""War on Terror."""	[]	[]	0	0	0	False	False	False	0.048256570688953	SV-#	eng	SG	PL	SV	verb	+
"The dangers implicit in any attack upon that nation, however, seem to significantly offset whatever gains could be made in the so-called ""War on Terror."""	seem				dangers		{'Number': 'Plur', 'lemma': 'danger'}	NOUN	seem				11	[]	"{'sent_id': 'newsgroup-groups.google.com_misc.consumers_a534e32067078b08_ENG_20060116_030800-0120', 'text': 'The dangers implicit in any attack upon that nation, however, seem to significantly offset whatever gains could be made in the so-called ""War on Terror.""', 'treebank': 'UD_English-EWT/en_ewt-ud-train.conllu', 'multiblimp_extended': True, 'pair_id': 'eng_0205', 'extended_role': 'pl'}"	seems	PL -> SG	The dangers implicit in any attack upon that nation, however,	"The dangers implicit in any attack upon that nation, however, seems to significantly offset whatever gains could be made in the so-called ""War on Terror."""	[]	[]	0	0	0	False	False	False	0.048256570688953	SV-#	eng	PL	SG	SV	verb	+
An Indoor cat that is well cared for typically lives 11-15 years.	live				cat		{'lemma': 'cat', 'Number': 'Sing'}	NOUN	lives				7	[]	{'sent_id': 'answers-20111108105919AAHXkZF_ans-0010', 'text': 'Indoor cats that are well cared for typically live 11-15 years.', 'treebank': 'UD_English-EWT/en_ewt-ud-train.conllu', 'multiblimp_extended': True, 'pair_id': 'eng_0206', 'extended_role': 'sg'}	live	SG -> PL	An Indoor cat that is well cared for typically	An Indoor cat that is well cared for typically live 11-15 years.	[]	[]	0	0	0	False	False	False	0.0121143721926127	SV-#	eng	SG	PL	SV	verb	+
Indoor cats that are well cared for typically live 11-15 years.	live				cats		{'Number': 'Plur', 'lemma': 'cat'}	NOUN	live				7	[]	{'sent_id': 'answers-20111108105919AAHXkZF_ans-0010', 'text': 'Indoor cats that are well cared for typically live 11-15 years.', 'treebank': 'UD_English-EWT/en_ewt-ud-train.conllu', 'multiblimp_extended': True, 'pair_id': 'eng_0206', 'extended_role': 'pl'}	lives	PL -> SG	Indoor cats that are well cared for typically	Indoor cats that are well cared for typically lives 11-15 years.	[]	[]	0	0	0	False	False	False	0.0121143721926127	SV-#	eng	PL	SG	SV	verb	+
The police force in the Indian capital Delhi says they have arrested the suspected co-ordinator and financier of last month 's deadly bomb blasts in the city.	say				police force		{'lemma': 'police', 'Number': 'Sing'}	NOUN	says				6	[]	"{'sent_id': 'newsgroup-groups.google.com_IndiaNewsWindow_8945cbef01f41435_ENG_20051113_092500-0002', 'newpar id': 'newsgroup-groups.google.com_IndiaNewsWindow_8945cbef01f41435_ENG_20051113_092500-p0002', 'text': ""Police in the Indian capital Delhi say they have arrested the suspected co-ordinator and financier of last month's deadly bomb blasts in the city."", 'treebank': 'UD_English-EWT/en_ewt-ud-test.conllu', 'multiblimp_extended': True, 'pair_id': 'eng_0207', 'extended_role': 'sg'}"	say	SG -> PL	The police force in the Indian capital Delhi	The police force in the Indian capital Delhi say they have arrested the suspected co-ordinator and financier of last month 's deadly bomb blasts in the city.	[]	[]	0	0	0	False	False	False	0.0072384856033429	SV-#	eng	SG	PL	SV	verb	+
Police in the Indian capital Delhi say they have arrested the suspected co-ordinator and financier of last month 's deadly bomb blasts in the city.	say				Police		{'Number': 'Plur', 'lemma': 'police'}	NOUN	say				6	[]	"{'sent_id': 'newsgroup-groups.google.com_IndiaNewsWindow_8945cbef01f41435_ENG_20051113_092500-0002', 'newpar id': 'newsgroup-groups.google.com_IndiaNewsWindow_8945cbef01f41435_ENG_20051113_092500-p0002', 'text': ""Police in the Indian capital Delhi say they have arrested the suspected co-ordinator and financier of last month's deadly bomb blasts in the city."", 'treebank': 'UD_English-EWT/en_ewt-ud-test.conllu', 'multiblimp_extended': True, 'pair_id': 'eng_0207', 'extended_role': 'pl'}"	says	PL -> SG	Police in the Indian capital Delhi	Police in the Indian capital Delhi says they have arrested the suspected co-ordinator and financier of last month 's deadly bomb blasts in the city.	[]	[]	0	0	0	False	False	False	0.0072384856033429	SV-#	eng	PL	SG	SV	verb	+
+ As the implication of the Andaman Islands situation sinks in, Indian intelligence has inevitably come under scrutiny.	sink				implication		{'lemma': 'implication', 'Number': 'Sing'}	NOUN	sinks				6	[]	{'newdoc id': 'weblog-blogspot.com_dakbangla_20050210141134_ENG_20050210_141134', 'sent_id': 'weblog-blogspot.com_dakbangla_20050210141134_ENG_20050210_141134-0001', 'newpar id': 'weblog-blogspot.com_dakbangla_20050210141134_ENG_20050210_141134-p0001', 'text': '+ As the implications of the Andaman Islands situation sink in, Indian intelligence has inevitably come under scrutiny.', 'treebank': 'UD_English-EWT/en_ewt-ud-train.conllu', 'multiblimp_extended': True, 'pair_id': 'eng_0208', 'extended_role': 'sg'}	sink	SG -> PL	+ As the implication of the Andaman Islands situation	+ As the implication of the Andaman Islands situation sink in, Indian intelligence has inevitably come under scrutiny.	[]	[]	0	0	0	False	False	False	0.0008715233502352	SV-#	eng	SG	PL	SV	verb	+
+ As the implications of the Andaman Islands situation sink in, Indian intelligence has inevitably come under scrutiny.	sink				implications		{'Number': 'Plur', 'lemma': 'implication'}	NOUN	sink				6	[]	{'newdoc id': 'weblog-blogspot.com_dakbangla_20050210141134_ENG_20050210_141134', 'sent_id': 'weblog-blogspot.com_dakbangla_20050210141134_ENG_20050210_141134-0001', 'newpar id': 'weblog-blogspot.com_dakbangla_20050210141134_ENG_20050210_141134-p0001', 'text': '+ As the implications of the Andaman Islands situation sink in, Indian intelligence has inevitably come under scrutiny.', 'treebank': 'UD_English-EWT/en_ewt-ud-train.conllu', 'multiblimp_extended': True, 'pair_id': 'eng_0208', 'extended_role': 'pl'}	sinks	PL -> SG	+ As the implications of the Andaman Islands situation	+ As the implications of the Andaman Islands situation sinks in, Indian intelligence has inevitably come under scrutiny.	[]	[]	0	0	0	False	False	False	0.0008715233502352	SV-#	eng	PL	SG	SV	verb	+
X-ray taken including AP and lateral of the right knee demonstrates a healed medial tibial plateau fracture status post percutaneous screw fixation.	demonstrate				X-ray		{'lemma': 'ray', 'Number': 'Sing'}	NOUN	demonstrates				10	[]	{'newpar': None, 'newpar_block': 'p (4 s)', 'sent_id': 'GENTLE_medical_screw-20', 's_prominence': '2', 's_type': 'decl', 'transition': 'zero', 'text': 'X-rays taken including AP and lateral of the right knee demonstrate a healed medial tibial plateau fracture status post percutaneous screw fixation.', 'treebank': 'UD_English-GENTLE/en_gentle-ud-test.conllu', 'multiblimp_extended': True, 'pair_id': 'eng_0209', 'extended_role': 'sg'}	demonstrate	SG -> PL	X-ray taken including AP and lateral of the right knee	X-ray taken including AP and lateral of the right knee demonstrate a healed medial tibial plateau fracture status post percutaneous screw fixation.	[]	[]	0	0	0	False	False	False	0.048256570688953	SV-#	eng	SG	PL	SV	verb	+
X-rays taken including AP and lateral of the right knee demonstrate a healed medial tibial plateau fracture status post percutaneous screw fixation.	demonstrate				rays		{'Number': 'Plur', 'lemma': 'ray'}	NOUN	demonstrate				10	[]	{'newpar': None, 'newpar_block': 'p (4 s)', 'sent_id': 'GENTLE_medical_screw-20', 's_prominence': '2', 's_type': 'decl', 'transition': 'zero', 'text': 'X-rays taken including AP and lateral of the right knee demonstrate a healed medial tibial plateau fracture status post percutaneous screw fixation.', 'treebank': 'UD_English-GENTLE/en_gentle-ud-test.conllu', 'multiblimp_extended': True, 'pair_id': 'eng_0209', 'extended_role': 'pl'}	demonstrates	PL -> SG	X-rays taken including AP and lateral of the right knee	X-rays taken including AP and lateral of the right knee demonstrates a healed medial tibial plateau fracture status post percutaneous screw fixation.	[]	[]	0	0	0	False	False	False	0.048256570688953	SV-#	eng	PL	SG	SV	verb	+
While the ominous possibility of heightened Iraqi chaos, missiles in the Gulf, and Syrian involvement looms large if the US attacks Iran, all pale in comparison to the involvement of China in any US/Iran engagement.	loom				possibility		{'lemma': 'possibility', 'Number': 'Sing'}	NOUN	looms				14	[]	{'sent_id': 'newsgroup-groups.google.com_misc.consumers_a534e32067078b08_ENG_20060116_030800-0073', 'newpar id': 'newsgroup-groups.google.com_misc.consumers_a534e32067078b08_ENG_20060116_030800-p0008', 'text': 'While the ominous possibilities of heightened Iraqi chaos, missiles in the Gulf, and Syrian involvement loom large if the US attacks Iran, all pale in comparison to the involvement of China in any US/Iran engagement.', 'treebank': 'UD_English-EWT/en_ewt-ud-train.conllu', 'multiblimp_extended': True, 'pair_id': 'eng_0210', 'extended_role': 'sg'}	loom	SG -> PL	While the ominous possibility of heightened Iraqi chaos, missiles in the Gulf, and Syrian involvement	While the ominous possibility of heightened Iraqi chaos, missiles in the Gulf, and Syrian involvement loom large if the US attacks Iran, all pale in comparison to the involvement of China in any US/Iran engagement.	[]	[]	0	0	0	False	False	False	0.0174304670047054	SV-#	eng	SG	PL	SV	verb	+
While the ominous possibilities of heightened Iraqi chaos, missiles in the Gulf, and Syrian involvement loom large if the US attacks Iran, all pale in comparison to the involvement of China in any US/Iran engagement.	loom				possibilities		{'Number': 'Plur', 'lemma': 'possibility'}	NOUN	loom				14	[]	{'sent_id': 'newsgroup-groups.google.com_misc.consumers_a534e32067078b08_ENG_20060116_030800-0073', 'newpar id': 'newsgroup-groups.google.com_misc.consumers_a534e32067078b08_ENG_20060116_030800-p0008', 'text': 'While the ominous possibilities of heightened Iraqi chaos, missiles in the Gulf, and Syrian involvement loom large if the US attacks Iran, all pale in comparison to the involvement of China in any US/Iran engagement.', 'treebank': 'UD_English-EWT/en_ewt-ud-train.conllu', 'multiblimp_extended': True, 'pair_id': 'eng_0210', 'extended_role': 'pl'}	looms	PL -> SG	While the ominous possibilities of heightened Iraqi chaos, missiles in the Gulf, and Syrian involvement	While the ominous possibilities of heightened Iraqi chaos, missiles in the Gulf, and Syrian involvement looms large if the US attacks Iran, all pale in comparison to the involvement of China in any US/Iran engagement.	[]	[]	0	0	0	False	False	False	0.0174304670047054	SV-#	eng	PL	SG	SV	verb	+
The civilian in the Department of Defense only knows how to blow things up.	know				civilian		{'lemma': 'civilian', 'Number': 'Sing'}	NOUN	knows				7	[]	{'sent_id': 'weblog-juancole.com_juancole_20040404101100_ENG_20040404_101100-0007', 'text': 'The civilians in the Department of Defense only know how to blow things up.', 'treebank': 'UD_English-EWT/en_ewt-ud-dev.conllu', 'multiblimp_extended': True, 'pair_id': 'eng_0211', 'extended_role': 'sg'}	know	SG -> PL	The civilian in the Department of Defense only	The civilian in the Department of Defense only know how to blow things up.	[]	[]	0	0	0	False	False	False	0.00486620880897	SV-#	eng	SG	PL	SV	verb	+
The civilians in the Department of Defense only know how to blow things up.	know				civilians		{'Number': 'Plur', 'lemma': 'civilian'}	NOUN	know				7	[]	{'sent_id': 'weblog-juancole.com_juancole_20040404101100_ENG_20040404_101100-0007', 'text': 'The civilians in the Department of Defense only know how to blow things up.', 'treebank': 'UD_English-EWT/en_ewt-ud-dev.conllu', 'multiblimp_extended': True, 'pair_id': 'eng_0211', 'extended_role': 'pl'}	knows	PL -> SG	The civilians in the Department of Defense only	The civilians in the Department of Defense only knows how to blow things up.	[]	[]	0	0	0	False	False	False	0.00486620880897	SV-#	eng	PL	SG	SV	verb	+
