sen	verb	verb_idx	cop	cop_idx	child	child_idx	child_features	child_upos	head	head_idx	head_features	head_upos	distance	attractors	metadata	swap_head	feature_vals	prefix	wrong_sen	congruent_attractors	incongruent_attractors	num_attractors	num_congruent_attractors	num_incongruent_attractors	has_attractors	only_has_congruent_attractors	only_has_incongruent_attractors	sample_weight	phenomenon	lang	grammatical_feature	ungrammatical_feature	wo	inflect_item	agreement_certainty
Bumrungrad Hospital does some good work but all hospitals do have their problems from time to time.	have				hospitals		{'Number': 'Plur', 'lemma': 'hospital'}	NOUN	do				1	[]	{'sent_id': 'answers-20111108105400AASqPIh_ans-0012', 'text': 'Bumrungrad Hospital does some good work but all hospitals do have their problems from time to time.', 'treebank': 'UD_English-EWT/en_ewt-ud-train.conllu', 'multiblimp_extended': True, 'pair_id': 'eng_0138', 'extended_role': 'pl'}	does	PL -> SG	Bumrungrad Hospital does some good work but all hospitals	Bumrungrad Hospital does some good work but all hospitals does have its problems from time to time.	[]	[]	0	0	0	False	False	False	2.1621882535999465e-06	SV-#	eng	PL	SG	SV	aux	+
And an international donor has given only half of the relief aid that Darfur needs, according to the local UN officials.	given				donor		{'lemma': 'donor', 'Number': 'Sing'}	NOUN	has				1	[]	{'sent_id': 'weblog-blogspot.com_tacitusproject_20040715092419_ENG_20040715_092419-0009', 'text': 'And international donors have given only half of the relief aid that Darfur needs, according to the local UN officials.', 'treebank': 'UD_English-EWT/en_ewt-ud-test.conllu', 'multiblimp_extended': True, 'pair_id': 'eng_0139', 'extended_role': 'sg'}	have	SG -> PL	And an international donor	And an international donor have given only half of the relief aid that Darfur needs, according to the local UN officials.	[]	[]	0	0	0	False	False	False	1.932168226621229e-06	SV-#	eng	SG	PL	SV	aux	+
And international donors have given only half of the relief aid that Darfur needs, according to the local UN officials.	given				donors		{'Number': 'Plur', 'lemma': 'donor'}	NOUN	have				1	[]	{'sent_id': 'weblog-blogspot.com_tacitusproject_20040715092419_ENG_20040715_092419-0009', 'text': 'And international donors have given only half of the relief aid that Darfur needs, according to the local UN officials.', 'treebank': 'UD_English-EWT/en_ewt-ud-test.conllu', 'multiblimp_extended': True, 'pair_id': 'eng_0139', 'extended_role': 'pl'}	has	PL -> SG	And international donors	And international donors has given only half of the relief aid that Darfur needs, according to the local UN officials.	[]	[]	0	0	0	False	False	False	1.932168226621229e-06	SV-#	eng	PL	SG	SV	aux	+
if the computer is completely shut off, the USB port is n't getting power, so it wo n't charge your phone	getting				port		{'lemma': 'port', 'Number': 'Sing'}	NOUN	is				1	[]	"{'sent_id': 'answers-20111108084036AAh8Ws9_ans-0005', 'text': ""if the computer is completely shut off, the USB ports aren't getting power, so they won't charge your phone"", 'treebank': 'UD_English-EWT/en_ewt-ud-test.conllu', 'multiblimp_extended': True, 'pair_id': 'eng_0140', 'extended_role': 'sg'}"	are	SG -> PL	if the computer is completely shut off, the USB port	if the computer is completely shut off, the USB port are n't getting power, so they wo n't charge your phone	[]	[]	0	0	0	False	False	False	1.9118296137094267e-06	SV-#	eng	SG	PL	SV	aux	+
if the computer is completely shut off, the USB ports are n't getting power, so they wo n't charge your phone	getting				ports		{'Number': 'Plur', 'lemma': 'port'}	NOUN	are				1	[]	"{'sent_id': 'answers-20111108084036AAh8Ws9_ans-0005', 'text': ""if the computer is completely shut off, the USB ports aren't getting power, so they won't charge your phone"", 'treebank': 'UD_English-EWT/en_ewt-ud-test.conllu', 'multiblimp_extended': True, 'pair_id': 'eng_0140', 'extended_role': 'pl'}"	is	PL -> SG	if the computer is completely shut off, the USB ports	if the computer is completely shut off, the USB ports is n't getting power, so it wo n't charge your phone	[]	[]	0	0	0	False	False	False	1.9118296137094267e-06	SV-#	eng	PL	SG	SV	aux	+
Increasingly, analysts are saying that China 's effort has gone beyond what is safe or even in its own interests.	gone				effort		{'lemma': 'effort', 'Number': 'Sing'}	NOUN	has				1	[]	"{'sent_id': 'newsgroup-groups.google.com_IdeaStockExchange_c6ea783ac3f043ba_ENG_20041120_243700-0027', 'text': ""Increasingly, analysts are saying that China's efforts have gone beyond what is safe or even in its own interests."", 'treebank': 'UD_English-EWT/en_ewt-ud-train.conllu', 'multiblimp_extended': True, 'pair_id': 'eng_0141', 'extended_role': 'sg'}"	have	SG -> PL	Increasingly, analysts are saying that China 's effort	Increasingly, analysts are saying that China 's effort have gone beyond what is safe or even in its own interests.	[]	[]	0	0	0	False	False	False	9.660841133106144e-07	SV-#	eng	SG	PL	SV	aux	+
Increasingly, analysts are saying that China 's efforts have gone beyond what is safe or even in its own interests.	gone				efforts		{'Number': 'Plur', 'lemma': 'effort'}	NOUN	have				1	[]	"{'sent_id': 'newsgroup-groups.google.com_IdeaStockExchange_c6ea783ac3f043ba_ENG_20041120_243700-0027', 'text': ""Increasingly, analysts are saying that China's efforts have gone beyond what is safe or even in its own interests."", 'treebank': 'UD_English-EWT/en_ewt-ud-train.conllu', 'multiblimp_extended': True, 'pair_id': 'eng_0141', 'extended_role': 'pl'}"	has	PL -> SG	Increasingly, analysts are saying that China 's efforts	Increasingly, analysts are saying that China 's efforts has gone beyond what is safe or even in its own interests.	[]	[]	0	0	0	False	False	False	9.660841133106144e-07	SV-#	eng	PL	SG	SV	aux	+
Watch out the pole is coming.....my little butterfly	coming				pole		{'lemma': 'pole', 'Number': 'Sing'}	NOUN	is				1	[]	{'sent_id': 'answers-20111106155648AAvG7DN_ans-0004', 'newpar id': 'answers-20111106155648AAvG7DN_ans-p0003', 'text': 'Watch out the poles are coming.....my little butterfly', 'treebank': 'UD_English-EWT/en_ewt-ud-train.conllu', 'multiblimp_extended': True, 'pair_id': 'eng_0142', 'extended_role': 'sg'}	are	SG -> PL	Watch out the pole	Watch out the pole are coming.....my little butterfly	[]	[]	0	0	0	False	False	False	1.9118296137094267e-06	SV-#	eng	SG	PL	SV	aux	+
Watch out the poles are coming.....my little butterfly	coming				poles		{'Number': 'Plur', 'lemma': 'pole'}	NOUN	are				1	[]	{'sent_id': 'answers-20111106155648AAvG7DN_ans-0004', 'newpar id': 'answers-20111106155648AAvG7DN_ans-p0003', 'text': 'Watch out the poles are coming.....my little butterfly', 'treebank': 'UD_English-EWT/en_ewt-ud-train.conllu', 'multiblimp_extended': True, 'pair_id': 'eng_0142', 'extended_role': 'pl'}	is	PL -> SG	Watch out the poles	Watch out the poles is coming.....my little butterfly	[]	[]	0	0	0	False	False	False	1.9118296137094267e-06	SV-#	eng	PL	SG	SV	aux	+
For example, students must trust that teacher has made appropriate decisions about the structure and content of the courses they teach, and teachers must trust that the assignments that students turn in are their own.	made				teacher		{'lemma': 'teacher', 'Number': 'Sing'}	NOUN	has				1	[]	{'sent_id': 'GENTLE_syllabus_opensource-117', 's_prominence': '3', 's_type': 'sub', 'transition': 'establishment', 'text': 'For example, students must trust that teachers have made appropriate decisions about the structure and content of the courses they teach, and teachers must trust that the assignments that students turn in are their own.', 'treebank': 'UD_English-GENTLE/en_gentle-ud-test.conllu', 'multiblimp_extended': True, 'pair_id': 'eng_0143', 'extended_role': 'sg'}	have	SG -> PL	For example, students must trust that teacher	For example, students must trust that teacher have made appropriate decisions about the structure and content of the courses they teach, and teachers must trust that the assignments that students turn in are their own.	[]	[]	0	0	0	False	False	False	1.932168226621229e-06	SV-#	eng	SG	PL	SV	aux	+
For example, students must trust that teachers have made appropriate decisions about the structure and content of the courses they teach, and teachers must trust that the assignments that students turn in are their own.	made				teachers		{'Number': 'Plur', 'lemma': 'teacher'}	NOUN	have				1	[]	{'sent_id': 'GENTLE_syllabus_opensource-117', 's_prominence': '3', 's_type': 'sub', 'transition': 'establishment', 'text': 'For example, students must trust that teachers have made appropriate decisions about the structure and content of the courses they teach, and teachers must trust that the assignments that students turn in are their own.', 'treebank': 'UD_English-GENTLE/en_gentle-ud-test.conllu', 'multiblimp_extended': True, 'pair_id': 'eng_0143', 'extended_role': 'pl'}	has	PL -> SG	For example, students must trust that teachers	For example, students must trust that teachers has made appropriate decisions about the structure and content of the courses they teach, and teachers must trust that the assignments that students turn in are their own.	[]	[]	0	0	0	False	False	False	1.932168226621229e-06	SV-#	eng	PL	SG	SV	aux	+
As a result, north of the Andaman Islands, Bangladeshi coastal area has become a nest of terrorists involved in the shipment of drugs and arms.	become				area		{'lemma': 'area', 'Number': 'Sing'}	NOUN	has				1	[]	{'sent_id': 'weblog-blogspot.com_dakbangla_20050210141134_ENG_20050210_141134-0064', 'text': 'As a result, north of the Andaman Islands, Bangladeshi coastal areas have become a nest of terrorists involved in the shipment of drugs and arms.', 'treebank': 'UD_English-EWT/en_ewt-ud-train.conllu', 'multiblimp_extended': True, 'pair_id': 'eng_0144', 'extended_role': 'sg'}	have	SG -> PL	As a result, north of the Andaman Islands, Bangladeshi coastal area	As a result, north of the Andaman Islands, Bangladeshi coastal area have become a nest of terrorists involved in the shipment of drugs and arms.	[]	[]	0	0	0	False	False	False	1.932168226621229e-06	SV-#	eng	SG	PL	SV	aux	+
As a result, north of the Andaman Islands, Bangladeshi coastal areas have become a nest of terrorists involved in the shipment of drugs and arms.	become				areas		{'Number': 'Plur', 'lemma': 'area'}	NOUN	have				1	[]	{'sent_id': 'weblog-blogspot.com_dakbangla_20050210141134_ENG_20050210_141134-0064', 'text': 'As a result, north of the Andaman Islands, Bangladeshi coastal areas have become a nest of terrorists involved in the shipment of drugs and arms.', 'treebank': 'UD_English-EWT/en_ewt-ud-train.conllu', 'multiblimp_extended': True, 'pair_id': 'eng_0144', 'extended_role': 'pl'}	has	PL -> SG	As a result, north of the Andaman Islands, Bangladeshi coastal areas	As a result, north of the Andaman Islands, Bangladeshi coastal areas has become a nest of terrorists involved in the shipment of drugs and arms.	[]	[]	0	0	0	False	False	False	1.932168226621229e-06	SV-#	eng	PL	SG	SV	aux	+
Although the apartment is facing Stokes Street and close to the Bascom Light Rail, the location is surprisingly quiet.	facing				apartment		{'lemma': 'apartment', 'Number': 'Sing'}	NOUN	is				1	[]	{'sent_id': 'reviews-315763-0005', 'text': 'Although the apartments are facing Stokes Street and close to the Bascom Light Rail, the location is surprisingly quiet.', 'treebank': 'UD_English-EWT/en_ewt-ud-train.conllu', 'multiblimp_extended': True, 'pair_id': 'eng_0145', 'extended_role': 'sg'}	are	SG -> PL	Although the apartment	Although the apartment are facing Stokes Street and close to the Bascom Light Rail, the location is surprisingly quiet.	[]	[]	0	0	0	False	False	False	1.9118296137094267e-06	SV-#	eng	SG	PL	SV	aux	+
Although the apartments are facing Stokes Street and close to the Bascom Light Rail, the location is surprisingly quiet.	facing				apartments		{'Number': 'Plur', 'lemma': 'apartment'}	NOUN	are				1	[]	{'sent_id': 'reviews-315763-0005', 'text': 'Although the apartments are facing Stokes Street and close to the Bascom Light Rail, the location is surprisingly quiet.', 'treebank': 'UD_English-EWT/en_ewt-ud-train.conllu', 'multiblimp_extended': True, 'pair_id': 'eng_0145', 'extended_role': 'pl'}	is	PL -> SG	Although the apartments	Although the apartments is facing Stokes Street and close to the Bascom Light Rail, the location is surprisingly quiet.	[]	[]	0	0	0	False	False	False	1.9118296137094267e-06	SV-#	eng	PL	SG	SV	aux	+
If you were of integrity, the program will continue and the money that some other person has received will come your way.	received				person		{'lemma': 'other', 'Number': 'Sing'}	NOUN	has				1	[]	{'sent_id': 'newsgroup-groups.google.com_alt.animals.bears_1125853b1f13cff6_ENG_20040126_171100-0063', 'text': 'If you were of integrity, the program will continue and the money that so many others have received will come your way.', 'treebank': 'UD_English-EWT/en_ewt-ud-train.conllu', 'multiblimp_extended': True, 'pair_id': 'eng_0146', 'extended_role': 'sg'}	have	SG -> PL	If you were of integrity, the program will continue and the money that some other person	If you were of integrity, the program will continue and the money that some other person have received will come your way.	[]	[]	0	0	0	False	False	False	4.830420566553072e-07	SV-#	eng	SG	PL	SV	aux	+
If you were of integrity, the program will continue and the money that so many others have received will come your way.	received				others		{'Number': 'Plur', 'lemma': 'other'}	NOUN	have				1	[]	{'sent_id': 'newsgroup-groups.google.com_alt.animals.bears_1125853b1f13cff6_ENG_20040126_171100-0063', 'text': 'If you were of integrity, the program will continue and the money that so many others have received will come your way.', 'treebank': 'UD_English-EWT/en_ewt-ud-train.conllu', 'multiblimp_extended': True, 'pair_id': 'eng_0146', 'extended_role': 'pl'}	has	PL -> SG	If you were of integrity, the program will continue and the money that so many others	If you were of integrity, the program will continue and the money that so many others has received will come your way.	[]	[]	0	0	0	False	False	False	4.830420566553072e-07	SV-#	eng	PL	SG	SV	aux	+
While it is extremely accurate, laser sight does not operate well when drunk or high because the beam often does not show up on the target.	operate				sight		{'lemma': 'sight', 'Number': 'Sing'}	NOUN	does				1	[]	{'sent_id': 'answers-20111108090913AAf83Jh_ans-0009', 'text': 'While they are extremely accurate, laser sights do not operate well when drunk or high because the beam often does not show up on the target.', 'treebank': 'UD_English-EWT/en_ewt-ud-train.conllu', 'multiblimp_extended': True, 'pair_id': 'eng_0147', 'extended_role': 'sg'}	do	SG -> PL	While it is extremely accurate, laser sight	While it is extremely accurate, laser sight do not operate well when drunk or high because the beam often does not show up on the target.	[]	[]	0	0	0	False	False	False	2.1621882535999465e-06	SV-#	eng	SG	PL	SV	aux	+
While they are extremely accurate, laser sights do not operate well when drunk or high because the beam often does not show up on the target.	operate				sights		{'Number': 'Plur', 'lemma': 'sight'}	NOUN	do				1	[]	{'sent_id': 'answers-20111108090913AAf83Jh_ans-0009', 'text': 'While they are extremely accurate, laser sights do not operate well when drunk or high because the beam often does not show up on the target.', 'treebank': 'UD_English-EWT/en_ewt-ud-train.conllu', 'multiblimp_extended': True, 'pair_id': 'eng_0147', 'extended_role': 'pl'}	does	PL -> SG	While they are extremely accurate, laser sights	While they are extremely accurate, laser sights does not operate well when drunk or high because the beam often does not show up on the target.	[]	[]	0	0	0	False	False	False	2.1621882535999465e-06	SV-#	eng	PL	SG	SV	aux	+
Mosques are calling for donating blood, food, and medicine for Fallujah, and a convoy has already headed out for Fallujah, though it returned later.	headed				convoy		{'lemma': 'convoy', 'Number': 'Sing'}	NOUN	has				1	[]	{'sent_id': 'weblog-blogspot.com_healingiraq_20040409053012_ENG_20040409_053012-0013', 'text': 'Mosques are calling for donating blood, food, and medicine for Fallujah, and several convoys have already headed out for Fallujah, most of them returned later though.', 'treebank': 'UD_English-EWT/en_ewt-ud-train.conllu', 'multiblimp_extended': True, 'pair_id': 'eng_0148', 'extended_role': 'sg'}	have	SG -> PL	Mosques are calling for donating blood, food, and medicine for Fallujah, and a convoy	Mosques are calling for donating blood, food, and medicine for Fallujah, and a convoy have already headed out for Fallujah, most of them returned later though.	[]	[]	0	0	0	False	False	False	9.660841133106144e-07	SV-#	eng	SG	PL	SV	aux	+
Mosques are calling for donating blood, food, and medicine for Fallujah, and several convoys have already headed out for Fallujah, most of them returned later though.	headed				convoys		{'Number': 'Plur', 'lemma': 'convoy'}	NOUN	have				1	[]	{'sent_id': 'weblog-blogspot.com_healingiraq_20040409053012_ENG_20040409_053012-0013', 'text': 'Mosques are calling for donating blood, food, and medicine for Fallujah, and several convoys have already headed out for Fallujah, most of them returned later though.', 'treebank': 'UD_English-EWT/en_ewt-ud-train.conllu', 'multiblimp_extended': True, 'pair_id': 'eng_0148', 'extended_role': 'pl'}	has	PL -> SG	Mosques are calling for donating blood, food, and medicine for Fallujah, and several convoys	Mosques are calling for donating blood, food, and medicine for Fallujah, and several convoys has already headed out for Fallujah, though it returned later.	[]	[]	0	0	0	False	False	False	9.660841133106144e-07	SV-#	eng	PL	SG	SV	aux	+
4) If the player is not going up by now you just got ta keep trying and keep trying.	going				player		{'lemma': 'they', 'Number': 'Sing'}	NOUN	is				1	[]	{'sent_id': 'answers-20111108092643AAXe4lD_ans-0064', 'text': '4) If they are not going up by now you just gotta keep trying and keep trying.', 'treebank': 'UD_English-EWT/en_ewt-ud-train.conllu', 'multiblimp_extended': True, 'pair_id': 'eng_0149', 'extended_role': 'sg'}	are	SG -> PL	4) If the player	4) If the player are not going up by now you just got ta keep trying and keep trying.	[]	[]	0	0	0	False	False	False	1.6481289773357125e-08	SV-#	eng	SG	PL	SV	aux	+
4) If they are not going up by now you just got ta keep trying and keep trying.	going				they		{'Case': 'Nom', 'Number': 'Plur', 'Person': '3', 'PronType': 'Prs', 'lemma': 'they'}	PRON	are				1	[]	{'sent_id': 'answers-20111108092643AAXe4lD_ans-0064', 'text': '4) If they are not going up by now you just gotta keep trying and keep trying.', 'treebank': 'UD_English-EWT/en_ewt-ud-train.conllu', 'multiblimp_extended': True, 'pair_id': 'eng_0149', 'extended_role': 'pl'}	is	PL -> SG	4) If they	4) If they is not going up by now you just got ta keep trying and keep trying.	[]	[]	0	0	0	False	False	False	1.6481289773357125e-08	SV-#	eng	PL	SG	SV	aux	+
Shortage is already leading to power cuts in the big cities.	leading				Shortage		{'lemma': 'shortage', 'Number': 'Sing'}	NOUN	is				1	[]	{'sent_id': 'newsgroup-groups.google.com_IdeaStockExchange_c6ea783ac3f043ba_ENG_20041120_243700-0020', 'text': 'Shortages are already leading to power cuts in the big cities.', 'treebank': 'UD_English-EWT/en_ewt-ud-train.conllu', 'multiblimp_extended': True, 'pair_id': 'eng_0150', 'extended_role': 'sg'}	are	SG -> PL	Shortage	Shortage are already leading to power cuts in the big cities.	[]	[]	0	0	0	False	False	False	1.9118296137094267e-06	SV-#	eng	SG	PL	SV	aux	+
Shortages are already leading to power cuts in the big cities.	leading				Shortages		{'Number': 'Plur', 'lemma': 'shortage'}	NOUN	are				1	[]	{'sent_id': 'newsgroup-groups.google.com_IdeaStockExchange_c6ea783ac3f043ba_ENG_20041120_243700-0020', 'text': 'Shortages are already leading to power cuts in the big cities.', 'treebank': 'UD_English-EWT/en_ewt-ud-train.conllu', 'multiblimp_extended': True, 'pair_id': 'eng_0150', 'extended_role': 'pl'}	is	PL -> SG	Shortages	Shortages is already leading to power cuts in the big cities.	[]	[]	0	0	0	False	False	False	1.9118296137094267e-06	SV-#	eng	PL	SG	SV	aux	+
The wire has been humming since before the New Year with reports that the Bush administration is planning an attack on Iran.	humming				wire		{'lemma': 'wire', 'Number': 'Sing'}	NOUN	has				1	[]	{'sent_id': 'newsgroup-groups.google.com_misc.consumers_a534e32067078b08_ENG_20060116_030800-0007', 'newpar id': 'newsgroup-groups.google.com_misc.consumers_a534e32067078b08_ENG_20060116_030800-p0004', 'text': 'The wires have been humming since before the New Year with reports that the Bush administration is planning an attack on Iran.', 'treebank': 'UD_English-EWT/en_ewt-ud-train.conllu', 'multiblimp_extended': True, 'pair_id': 'eng_0151', 'extended_role': 'sg'}	have	SG -> PL	The wire	The wire have been humming since before the New Year with reports that the Bush administration is planning an attack on Iran.	[]	[]	0	0	0	False	False	False	1.932168226621229e-06	SV-#	eng	SG	PL	SV	aux	+
The wires have been humming since before the New Year with reports that the Bush administration is planning an attack on Iran.	humming				wires		{'Number': 'Plur', 'lemma': 'wire'}	NOUN	have				1	[]	{'sent_id': 'newsgroup-groups.google.com_misc.consumers_a534e32067078b08_ENG_20060116_030800-0007', 'newpar id': 'newsgroup-groups.google.com_misc.consumers_a534e32067078b08_ENG_20060116_030800-p0004', 'text': 'The wires have been humming since before the New Year with reports that the Bush administration is planning an attack on Iran.', 'treebank': 'UD_English-EWT/en_ewt-ud-train.conllu', 'multiblimp_extended': True, 'pair_id': 'eng_0151', 'extended_role': 'pl'}	has	PL -> SG	The wires	The wires has been humming since before the New Year with reports that the Bush administration is planning an attack on Iran.	[]	[]	0	0	0	False	False	False	1.932168226621229e-06	SV-#	eng	PL	SG	SV	aux	+
As a parent, I can well imagine how painful it must be for those families whose child is succumbing to radiation poisoning.	succumbing				child		{'lemma': 'child', 'Number': 'Sing'}	NOUN	is				1	[]	{'sent_id': 'weblog-typepad.com_ripples_20040407125600_ENG_20040407_125600-0019', 'text': 'As a parent, I can well imagine how painful it must be for those families whose children are succumbing to radiation poisoning.', 'treebank': 'UD_English-EWT/en_ewt-ud-train.conllu', 'multiblimp_extended': True, 'pair_id': 'eng_0152', 'extended_role': 'sg'}	are	SG -> PL	As a parent, I can well imagine how painful it must be for those families whose child	As a parent, I can well imagine how painful it must be for those families whose child are succumbing to radiation poisoning.	[]	[]	0	0	0	False	False	False	9.559148068547134e-07	SV-#	eng	SG	PL	SV	aux	+
As a parent, I can well imagine how painful it must be for those families whose children are succumbing to radiation poisoning.	succumbing				children		{'Number': 'Plur', 'lemma': 'child'}	NOUN	are				1	[]	{'sent_id': 'weblog-typepad.com_ripples_20040407125600_ENG_20040407_125600-0019', 'text': 'As a parent, I can well imagine how painful it must be for those families whose children are succumbing to radiation poisoning.', 'treebank': 'UD_English-EWT/en_ewt-ud-train.conllu', 'multiblimp_extended': True, 'pair_id': 'eng_0152', 'extended_role': 'pl'}	is	PL -> SG	As a parent, I can well imagine how painful it must be for those families whose children	As a parent, I can well imagine how painful it must be for those families whose children is succumbing to radiation poisoning.	[]	[]	0	0	0	False	False	False	9.559148068547134e-07	SV-#	eng	PL	SG	SV	aux	+
Small polygamous group has existed in the southwestern US under the watchful yet fairly benign eye of authorities ever since a sect known as the Fundamentalist Latter Day Saints (FLDS) separated itself from mainstream Mormonism in 1890.	existed				group		{'lemma': 'group', 'Number': 'Sing'}	NOUN	has				1	[]	{'sent_id': 'weblog-blogspot.com_rigorousintuition_20060511134300_ENG_20060511_134300-0057', 'newpar id': 'weblog-blogspot.com_rigorousintuition_20060511134300_ENG_20060511_134300-p0014', 'text': 'Small polygamous groups have existed in the southwestern US under the watchful yet fairly benign eye of authorities ever since a sect known as the Fundamentalist Latter Day Saints (FLDS) separated itself from mainstream Mormonism in 1890.', 'treebank': 'UD_English-EWT/en_ewt-ud-train.conllu', 'multiblimp_extended': True, 'pair_id': 'eng_0153', 'extended_role': 'sg'}	have	SG -> PL	Small polygamous group	Small polygamous group have existed in the southwestern US under the watchful yet fairly benign eye of authorities ever since a sect known as the Fundamentalist Latter Day Saints (FLDS) separated itself from mainstream Mormonism in 1890.	[]	[]	0	0	0	False	False	False	1.932168226621229e-06	SV-#	eng	SG	PL	SV	aux	+
