pair_id	language	target_number	continuation	good_prefix_type	good_prefix	bad_prefix_type	bad_prefix	good_sentence	bad_sentence	source_idx	has_attractor	distance	subject_lemma
eng_0178	eng	PL	are saying that China's efforts have gone beyond what is safe or even in its own interests.	PL	Increasingly, analysts	SG	Increasingly, an analyst	Increasingly, analysts are saying that China's efforts have gone beyond what is safe or even in its own interests.	Increasingly, an analyst are saying that China's efforts have gone beyond what is safe or even in its own interests.	186	0	1	analyst
eng_0180	eng	SG	is trying to help hundreds of thousands of displaced people while authorities have vowed to restore security in New Orleans following a breakdown of law and order.	SG	A relief agency	PL	Relief agencies	A relief agency is trying to help hundreds of thousands of displaced people while authorities have vowed to restore security in New Orleans following a breakdown of law and order.	Relief agencies is trying to help hundreds of thousands of displaced people while authorities have vowed to restore security in New Orleans following a breakdown of law and order.	188	0	1	agency
eng_0180	eng	PL	are trying to help hundreds of thousands of displaced people while authorities have vowed to restore security in New Orleans following a breakdown of law and order.	PL	Relief agencies	SG	A relief agency	Relief agencies are trying to help hundreds of thousands of displaced people while authorities have vowed to restore security in New Orleans following a breakdown of law and order.	A relief agency are trying to help hundreds of thousands of displaced people while authorities have vowed to restore security in New Orleans following a breakdown of law and order.	188	0	1	agency
eng_0183	eng	SG	is also planning to picket the Lake Worth, Florida project as well.	SG	We understand that the pipe fitter	PL	We understand that the pipe fitters	We understand that the pipe fitter is also planning to picket the Lake Worth, Florida project as well.	We understand that the pipe fitters is also planning to picket the Lake Worth, Florida project as well.	191	0	1	fitter
eng_0183	eng	PL	are also planning to picket the Lake Worth, Florida project as well.	PL	We understand that the pipe fitters	SG	We understand that the pipe fitter	We understand that the pipe fitters are also planning to picket the Lake Worth, Florida project as well.	We understand that the pipe fitter are also planning to picket the Lake Worth, Florida project as well.	191	0	1	fitter
eng_0184	eng	PL	have flown before.	PL	On the morrow he will leave me, as my Hopes	SG	On the morrow he will leave me, as my Hope	On the morrow he will leave me, as my Hopes have flown before.	On the morrow he will leave me, as my Hope have flown before.	192	0	1	hope
eng_0184	eng	SG	has flown before.	SG	On the morrow he will leave me, as my Hope	PL	On the morrow he will leave me, as my Hopes	On the morrow he will leave me, as my Hope has flown before.	On the morrow he will leave me, as my Hopes has flown before.	192	0	1	hope
eng_0185	eng	SG	has said the plot, thwarted by Britain, to blow up several aircraft over the Atlantic bore many of the hallmarks of al Qaeda.	SG	A U.S. official	PL	U.S. officials	A U.S. official has said the plot, thwarted by Britain, to blow up several aircraft over the Atlantic bore many of the hallmarks of al Qaeda.	U.S. officials has said the plot, thwarted by Britain, to blow up several aircraft over the Atlantic bore many of the hallmarks of al Qaeda.	193	0	1	official
eng_0185	eng	PL	have said the plot, thwarted by Britain, to blow up several aircraft over the Atlantic bore many of the hallmarks of al Qaeda.	PL	U.S. officials	SG	A U.S. official	U.S. officials have said the plot, thwarted by Britain, to blow up several aircraft over the Atlantic bore many of the hallmarks of al Qaeda.	A U.S. official have said the plot, thwarted by Britain, to blow up several aircraft over the Atlantic bore many of the hallmarks of al Qaeda.	193	0	1	official
eng_0186	eng	SG	does not have that kind of problem, and is much more reliable.	SG	Today's weapon	PL	Today's weapons	Today's weapon does not have that kind of problem, and is much more reliable.	Today's weapons does not have that kind of problem, and is much more reliable.	194	0	1	weapon
eng_0186	eng	PL	do not have that kind of problem, and are much more reliable.	PL	Today's weapons	SG	Today's weapon	Today's weapons do not have that kind of problem, and are much more reliable.	Today's weapon do not have that kind of problem, and are much more reliable.	194	0	1	weapon
eng_0188	eng	SG	is taking its toll.	SG	The multiple planetary affliction	PL	The multiple planetary afflictions	The multiple planetary affliction is taking its toll.	The multiple planetary afflictions is taking its toll.	196	0	1	affliction
eng_0188	eng	PL	are taking their toll.	PL	The multiple planetary afflictions	SG	The multiple planetary affliction	The multiple planetary afflictions are taking their toll.	The multiple planetary affliction are taking their toll.	196	0	1	affliction
eng_0189	eng	SG	has been circling over our heads non-stop.	SG	My neighbourhood has been surrounded by American troops for three days now; a helicopter	PL	My neighbourhood has been surrounded by American troops for three days now; helicopters	My neighbourhood has been surrounded by American troops for three days now; a helicopter has been circling over our heads non-stop.	My neighbourhood has been surrounded by American troops for three days now; helicopters has been circling over our heads non-stop.	197	0	1	helicopter
eng_0189	eng	PL	have been circling over our heads non-stop.	PL	My neighbourhood has been surrounded by American troops for three days now; helicopters	SG	My neighbourhood has been surrounded by American troops for three days now; a helicopter	My neighbourhood has been surrounded by American troops for three days now; helicopters have been circling over our heads non-stop.	My neighbourhood has been surrounded by American troops for three days now; a helicopter have been circling over our heads non-stop.	197	0	1	helicopter
eng_0191	eng	SG	is occurring across all species, Parmesan told UPI.	SG	This change	PL	These changes	This change is occurring across all species, Parmesan told UPI.	These changes is occurring across all species, Parmesan told UPI.	199	0	1	change
eng_0191	eng	PL	are occurring across all species, Parmesan told UPI.	PL	These changes	SG	This change	These changes are occurring across all species, Parmesan told UPI.	This change are occurring across all species, Parmesan told UPI.	199	0	1	change
eng_0192	eng	PL	indicate that Ayman was a close student of the USAMRIID anthrax program.	PL	Emails from Zawahiri to Atef in the Spring of 1999	SG	Email from Zawahiri to Atef in the Spring of 1999	Emails from Zawahiri to Atef in the Spring of 1999 indicate that Ayman was a close student of the USAMRIID anthrax program.	Email from Zawahiri to Atef in the Spring of 1999 indicate that Ayman was a close student of the USAMRIID anthrax program.	200	1	10	email
eng_0192	eng	SG	indicates that Ayman was a close student of the USAMRIID anthrax program.	SG	Email from Zawahiri to Atef in the Spring of 1999	PL	Emails from Zawahiri to Atef in the Spring of 1999	Email from Zawahiri to Atef in the Spring of 1999 indicates that Ayman was a close student of the USAMRIID anthrax program.	Emails from Zawahiri to Atef in the Spring of 1999 indicates that Ayman was a close student of the USAMRIID anthrax program.	200	1	10	email
eng_0193	eng	SG	runs into one unavoidable truth.	SG	The argument that the Bush administration would be insane to attack Iran and risk a global conflagration for the sake of political cover	PL	The arguments that the Bush administration would be insane to attack Iran and risk a global conflagration for the sake of political cover	The argument that the Bush administration would be insane to attack Iran and risk a global conflagration for the sake of political cover runs into one unavoidable truth.	The arguments that the Bush administration would be insane to attack Iran and risk a global conflagration for the sake of political cover runs into one unavoidable truth.	201	1	22	argument
eng_0193	eng	PL	run into one unavoidable truth.	PL	The arguments that the Bush administration would be insane to attack Iran and risk a global conflagration for the sake of political cover	SG	The argument that the Bush administration would be insane to attack Iran and risk a global conflagration for the sake of political cover	The arguments that the Bush administration would be insane to attack Iran and risk a global conflagration for the sake of political cover run into one unavoidable truth.	The argument that the Bush administration would be insane to attack Iran and risk a global conflagration for the sake of political cover run into one unavoidable truth.	201	1	22	argument
eng_0195	eng	SG	understands the only feasible solution for Kashmir is the acceptance of the status quo.	SG	A realist, and this even includes members of the U.S. Democratic foreign policy establishment such as Strobe Talbott, who have long sought to divest India of its defensive capability against another nuclear power in Asia,	PL	Realists, and this even includes members of the U.S. Democratic foreign policy establishment such as Strobe Talbott, who have long sought to divest India of its defensive capability against another nuclear power in Asia,	A realist, and this even includes members of the U.S. Democratic foreign policy establishment such as Strobe Talbott, who have long sought to divest India of its defensive capability against another nuclear power in Asia, understands the only feasible solution for Kashmir is the acceptance of the status quo.	Realists, and this even includes members of the U.S. Democratic foreign policy establishment such as Strobe Talbott, who have long sought to divest India of its defensive capability against another nuclear power in Asia, understands the only feasible solution for Kashmir is the acceptance of the status quo.	203	1	37	realist
eng_0195	eng	PL	understand the only feasible solution for Kashmir is the acceptance of the status quo.	PL	Realists, and this even includes members of the U.S. Democratic foreign policy establishment such as Strobe Talbott, who have long sought to divest India of its defensive capability against another nuclear power in Asia,	SG	A realist, and this even includes members of the U.S. Democratic foreign policy establishment such as Strobe Talbott, who have long sought to divest India of its defensive capability against another nuclear power in Asia,	Realists, and this even includes members of the U.S. Democratic foreign policy establishment such as Strobe Talbott, who have long sought to divest India of its defensive capability against another nuclear power in Asia, understand the only feasible solution for Kashmir is the acceptance of the status quo.	A realist, and this even includes members of the U.S. Democratic foreign policy establishment such as Strobe Talbott, who have long sought to divest India of its defensive capability against another nuclear power in Asia, understand the only feasible solution for Kashmir is the acceptance of the status quo.	203	1	37	realist
eng_0196	eng	SG	engages in this activity, but overall no not really.	SG	A certain element of the travelling community	PL	Certain elements of the travelling community	A certain element of the travelling community engages in this activity, but overall no not really.	Certain elements of the travelling community engages in this activity, but overall no not really.	204	1	5	element
eng_0196	eng	PL	engage in this activity, but overall no not really.	PL	Certain elements of the travelling community	SG	A certain element of the travelling community	Certain elements of the travelling community engage in this activity, but overall no not really.	A certain element of the travelling community engage in this activity, but overall no not really.	204	1	5	element
eng_0197	eng	SG	looks at the interaction objectively, and it's good to see they are able and willing to say no if they feel there would be a problem.	SG	A worker who does these introductions	PL	Workers who do these introductions	A worker who does these introductions looks at the interaction objectively, and it's good to see they are able and willing to say no if they feel there would be a problem.	Workers who do these introductions looks at the interaction objectively, and it's good to see they are able and willing to say no if they feel there would be a problem.	205	1	5	worker
eng_0197	eng	PL	look at the interaction objectively, and it's good to see they are able and willing to say no if they feel there would be a problem.	PL	Workers who do these introductions	SG	A worker who does these introductions	Workers who do these introductions look at the interaction objectively, and it's good to see they are able and willing to say no if they feel there would be a problem.	A worker who does these introductions look at the interaction objectively, and it's good to see they are able and willing to say no if they feel there would be a problem.	205	1	5	worker
eng_0199	eng	SG	operates as a result of fear from, or blackmail by, the inner circles.	SG	Some part of this same outer circle actually	PL	Some parts of this same outer circle actually	Some part of this same outer circle actually operates as a result of fear from, or blackmail by, the inner circles.	Some parts of this same outer circle actually operates as a result of fear from, or blackmail by, the inner circles.	207	1	7	part
eng_0199	eng	PL	operate as a result of fear from, or blackmail by, the inner circles.	PL	Some parts of this same outer circle actually	SG	Some part of this same outer circle actually	Some parts of this same outer circle actually operate as a result of fear from, or blackmail by, the inner circles.	Some part of this same outer circle actually operate as a result of fear from, or blackmail by, the inner circles.	207	1	7	part
eng_0201	eng	SG	boxes.	SG	A member of the traveler community bare-knuckle	PL	Members of the traveler community bare-knuckle	A member of the traveler community bare-knuckle boxes.	Members of the traveler community bare-knuckle boxes.	209	1	7	member
eng_0201	eng	PL	box.	PL	Members of the traveler community bare-knuckle	SG	A member of the traveler community bare-knuckle	Members of the traveler community bare-knuckle box.	A member of the traveler community bare-knuckle box.	209	1	7	member
eng_0202	eng	PL	indicate you would like.	PL	PS: I took the liberty of buying the corporate phone directory and locating information on your outstanding disputed credit accounts from an internet dealer today, and can probably make you better known to your customers than the security measures you enact at your company	SG	PS: I took the liberty of buying the corporate phone directory and locating information on your outstanding disputed credit accounts from an internet dealer today, and can probably make you better known to your customers than the security measure you enact at your company	PS: I took the liberty of buying the corporate phone directory and locating information on your outstanding disputed credit accounts from an internet dealer today, and can probably make you better known to your customers than the security measures you enact at your company indicate you would like.	PS: I took the liberty of buying the corporate phone directory and locating information on your outstanding disputed credit accounts from an internet dealer today, and can probably make you better known to your customers than the security measure you enact at your company indicate you would like.	210	1	6	measure
eng_0202	eng	SG	indicates you would like.	SG	PS: I took the liberty of buying the corporate phone directory and locating information on your outstanding disputed credit accounts from an internet dealer today, and can probably make you better known to your customers than the security measure you enact at your company	PL	PS: I took the liberty of buying the corporate phone directory and locating information on your outstanding disputed credit accounts from an internet dealer today, and can probably make you better known to your customers than the security measures you enact at your company	PS: I took the liberty of buying the corporate phone directory and locating information on your outstanding disputed credit accounts from an internet dealer today, and can probably make you better known to your customers than the security measure you enact at your company indicates you would like.	PS: I took the liberty of buying the corporate phone directory and locating information on your outstanding disputed credit accounts from an internet dealer today, and can probably make you better known to your customers than the security measures you enact at your company indicates you would like.	210	1	6	measure
eng_0204	eng	SG	shows that an entourage from Al Qaeda group was sent to the Iraqi capital in March 1998 from Sudan.	SG	The paper found at headquarters of the Mukhabarat, Iraq's secret police,	PL	The papers found at headquarters of the Mukhabarat, Iraq's secret police,	The paper found at headquarters of the Mukhabarat, Iraq's secret police, shows that an entourage from Al Qaeda group was sent to the Iraqi capital in March 1998 from Sudan.	The papers found at headquarters of the Mukhabarat, Iraq's secret police, shows that an entourage from Al Qaeda group was sent to the Iraqi capital in March 1998 from Sudan.	213	1	13	paper
eng_0204	eng	PL	show that an entourage from Al Qaeda group was sent to the Iraqi capital in March 1998 from Sudan.	PL	The papers found at headquarters of the Mukhabarat, Iraq's secret police,	SG	The paper found at headquarters of the Mukhabarat, Iraq's secret police,	The papers found at headquarters of the Mukhabarat, Iraq's secret police, show that an entourage from Al Qaeda group was sent to the Iraqi capital in March 1998 from Sudan.	The paper found at headquarters of the Mukhabarat, Iraq's secret police, show that an entourage from Al Qaeda group was sent to the Iraqi capital in March 1998 from Sudan.	213	1	13	paper
eng_0205	eng	SG	"seems to significantly offset whatever gains could be made in the so-called ""War on Terror."""	SG	The danger implicit in any attack upon that nation, however,	PL	The dangers implicit in any attack upon that nation, however,	"The danger implicit in any attack upon that nation, however, seems to significantly offset whatever gains could be made in the so-called ""War on Terror."""	"The dangers implicit in any attack upon that nation, however, seems to significantly offset whatever gains could be made in the so-called ""War on Terror."""	214	1	11	danger
eng_0205	eng	PL	"seem to significantly offset whatever gains could be made in the so-called ""War on Terror."""	PL	The dangers implicit in any attack upon that nation, however,	SG	The danger implicit in any attack upon that nation, however,	"The dangers implicit in any attack upon that nation, however, seem to significantly offset whatever gains could be made in the so-called ""War on Terror."""	"The danger implicit in any attack upon that nation, however, seem to significantly offset whatever gains could be made in the so-called ""War on Terror."""	214	1	11	danger
eng_0206	eng	SG	lives 11-15 years.	SG	An indoor cat that is well cared for typically	PL	Indoor cats that are well cared for typically	An indoor cat that is well cared for typically lives 11-15 years.	Indoor cats that are well cared for typically lives 11-15 years.	215	1	7	cat
eng_0206	eng	PL	live 11-15 years.	PL	Indoor cats that are well cared for typically	SG	An indoor cat that is well cared for typically	Indoor cats that are well cared for typically live 11-15 years.	An indoor cat that is well cared for typically live 11-15 years.	215	1	7	cat
eng_0208	eng	SG	sinks in, Indian intelligence has inevitably come under scrutiny.	SG	As the implication of the Andaman Islands situation	PL	As the implications of the Andaman Islands situation	As the implication of the Andaman Islands situation sinks in, Indian intelligence has inevitably come under scrutiny.	As the implications of the Andaman Islands situation sinks in, Indian intelligence has inevitably come under scrutiny.	217	1	6	implication
eng_0208	eng	PL	sink in, Indian intelligence has inevitably come under scrutiny.	PL	As the implications of the Andaman Islands situation	SG	As the implication of the Andaman Islands situation	As the implications of the Andaman Islands situation sink in, Indian intelligence has inevitably come under scrutiny.	As the implication of the Andaman Islands situation sink in, Indian intelligence has inevitably come under scrutiny.	217	1	6	implication
eng_0209	eng	SG	demonstrates a healed medial tibial plateau fracture status post percutaneous screw fixation.	SG	X-ray taken including AP and lateral of the right knee	PL	X-rays taken including AP and lateral of the right knee	X-ray taken including AP and lateral of the right knee demonstrates a healed medial tibial plateau fracture status post percutaneous screw fixation.	X-rays taken including AP and lateral of the right knee demonstrates a healed medial tibial plateau fracture status post percutaneous screw fixation.	218	1	10	ray
eng_0209	eng	PL	demonstrate a healed medial tibial plateau fracture status post percutaneous screw fixation.	PL	X-rays taken including AP and lateral of the right knee	SG	X-ray taken including AP and lateral of the right knee	X-rays taken including AP and lateral of the right knee demonstrate a healed medial tibial plateau fracture status post percutaneous screw fixation.	X-ray taken including AP and lateral of the right knee demonstrate a healed medial tibial plateau fracture status post percutaneous screw fixation.	218	1	10	ray
eng_0210	eng	PL	loom large if the US attacks Iran, all pale in comparison to the involvement of China in any US/Iran engagement.	PL	While the ominous possibilities of heightened Iraqi chaos, missiles in the Gulf, and Syrian involvement	SG	While the ominous possibility of heightened Iraqi chaos, missiles in the Gulf, and Syrian involvement	While the ominous possibilities of heightened Iraqi chaos, missiles in the Gulf, and Syrian involvement loom large if the US attacks Iran, all pale in comparison to the involvement of China in any US/Iran engagement.	While the ominous possibility of heightened Iraqi chaos, missiles in the Gulf, and Syrian involvement loom large if the US attacks Iran, all pale in comparison to the involvement of China in any US/Iran engagement.	219	1	14	possibility
eng_0210	eng	SG	looms large if the US attacks Iran, all pale in comparison to the involvement of China in any US/Iran engagement.	SG	While the ominous possibility of heightened Iraqi chaos, missiles in the Gulf, and Syrian involvement	PL	While the ominous possibilities of heightened Iraqi chaos, missiles in the Gulf, and Syrian involvement	While the ominous possibility of heightened Iraqi chaos, missiles in the Gulf, and Syrian involvement looms large if the US attacks Iran, all pale in comparison to the involvement of China in any US/Iran engagement.	While the ominous possibilities of heightened Iraqi chaos, missiles in the Gulf, and Syrian involvement looms large if the US attacks Iran, all pale in comparison to the involvement of China in any US/Iran engagement.	219	1	14	possibility
eng_0211	eng	SG	knows how to blow things up.	SG	The civilian in the Department of Defense only	PL	The civilians in the Department of Defense only	The civilian in the Department of Defense only knows how to blow things up.	The civilians in the Department of Defense only knows how to blow things up.	220	1	7	civilian
eng_0211	eng	PL	know how to blow things up.	PL	The civilians in the Department of Defense only	SG	The civilian in the Department of Defense only	The civilians in the Department of Defense only know how to blow things up.	The civilian in the Department of Defense only know how to blow things up.	220	1	7	civilian
eng_0212	eng	SG	seems to outnumber the ones who oppose him.	SG	But other people do like the way they think he will vote, and the one who favors him	PL	But other people do like the way they think he will vote, and the ones who favor him	But other people do like the way they think he will vote, and the one who favors him seems to outnumber the ones who oppose him.	But other people do like the way they think he will vote, and the ones who favor him seems to outnumber the ones who oppose him.	221	1	4	one
eng_0212	eng	PL	seem to outnumber the ones who oppose him.	PL	But other people do like the way they think he will vote, and the ones who favor him	SG	But other people do like the way they think he will vote, and the one who favors him	But other people do like the way they think he will vote, and the ones who favor him seem to outnumber the ones who oppose him.	But other people do like the way they think he will vote, and the one who favors him seem to outnumber the ones who oppose him.	221	1	4	one
eng_0216	eng	SG	undermines the educational process.	SG	An act that violates this trust	PL	Acts that violate this trust	An act that violates this trust undermines the educational process.	Acts that violate this trust undermines the educational process.	225	1	5	act
eng_0216	eng	PL	undermine the educational process.	PL	Acts that violate this trust	SG	An act that violates this trust	Acts that violate this trust undermine the educational process.	An act that violates this trust undermine the educational process.	225	1	5	act
eng_0217	eng	SG	has MUCH NICER and more TRANSPARENT owners.	SG	Another shop around this city	PL	Other shops around this city	Another shop around this city has MUCH NICER and more TRANSPARENT owners.	Other shops around this city has MUCH NICER and more TRANSPARENT owners.	226	1	4	shop
