pair_id	language	target_number	continuation	good_prefix_type	good_prefix	bad_prefix_type	bad_prefix	good_sentence	bad_sentence	source_idx	has_attractor	distance	subject_lemma
eng_0069	eng	SG	clouds his pupils while the syllable of time unearths his crop and surrenders his mystery to the bound waters.	SG	Perhaps that's why a surge of tears	PL	Perhaps that's why surges of tears	Perhaps that's why a surge of tears clouds his pupils while the syllable of time unearths his crop and surrenders his mystery to the bound waters.	Perhaps that's why surges of tears clouds his pupils while the syllable of time unearths his crop and surrenders his mystery to the bound waters.	72	0	3	surge
eng_0070	eng	SG	crashes repeatedly about every 3 seconds.	SG	I really like the MIUI, but a process	PL	I really like the MIUI, but processes	I really like the MIUI, but a process crashes repeatedly about every 3 seconds.	I really like the MIUI, but processes crashes repeatedly about every 3 seconds.	73	0	1	process
eng_0070	eng	PL	crash repeatedly about every 3 seconds.	PL	I really like the MIUI, but processes	SG	I really like the MIUI, but a process	I really like the MIUI, but processes crash repeatedly about every 3 seconds.	I really like the MIUI, but a process crash repeatedly about every 3 seconds.	73	0	1	process
eng_0071	eng	PL	ensure that a Shakespeare play can survive translation, cutting and wide interpretation without loss to its core drama.	PL	These strengths of design	SG	This strength of design	These strengths of design ensure that a Shakespeare play can survive translation, cutting and wide interpretation without loss to its core drama.	This strength of design ensure that a Shakespeare play can survive translation, cutting and wide interpretation without loss to its core drama.	74	0	3	strength
eng_0071	eng	SG	ensures that a Shakespeare play can survive translation, cutting and wide interpretation without loss to its core drama.	SG	This strength of design	PL	These strengths of design	This strength of design ensures that a Shakespeare play can survive translation, cutting and wide interpretation without loss to its core drama.	These strengths of design ensures that a Shakespeare play can survive translation, cutting and wide interpretation without loss to its core drama.	74	0	3	strength
eng_0074	eng	PL	equate with women having the right to manage their lives and make decisions about their own bodies.	PL	Entitlements to free abortions	SG	Entitlement to free abortions	Entitlements to free abortions equate with women having the right to manage their lives and make decisions about their own bodies.	Entitlement to free abortions equate with women having the right to manage their lives and make decisions about their own bodies.	77	0	4	entitlement
eng_0074	eng	SG	equates with women having the right to manage their lives and make decisions about their own bodies.	SG	Entitlement to free abortions	PL	Entitlements to free abortions	Entitlement to free abortions equates with women having the right to manage their lives and make decisions about their own bodies.	Entitlements to free abortions equates with women having the right to manage their lives and make decisions about their own bodies.	77	0	4	entitlement
eng_0080	eng	PL	remain among the best recruiting posters for al-Qaida with young Muslim men.	PL	Even if local Palestinian leaders remain strong enough to keep al-Qaida out, the festering Israeli-Palestinian struggles	SG	Even if local Palestinian leaders remain strong enough to keep al-Qaida out, the festering Israeli-Palestinian struggle	Even if local Palestinian leaders remain strong enough to keep al-Qaida out, the festering Israeli-Palestinian struggles remain among the best recruiting posters for al-Qaida with young Muslim men.	Even if local Palestinian leaders remain strong enough to keep al-Qaida out, the festering Israeli-Palestinian struggle remain among the best recruiting posters for al-Qaida with young Muslim men.	84	0	1	struggle
eng_0080	eng	SG	remains among the best recruiting posters for al-Qaida with young Muslim men.	SG	Even if local Palestinian leaders remain strong enough to keep al-Qaida out, the festering Israeli-Palestinian struggle	PL	Even if local Palestinian leaders remain strong enough to keep al-Qaida out, the festering Israeli-Palestinian struggles	Even if local Palestinian leaders remain strong enough to keep al-Qaida out, the festering Israeli-Palestinian struggle remains among the best recruiting posters for al-Qaida with young Muslim men.	Even if local Palestinian leaders remain strong enough to keep al-Qaida out, the festering Israeli-Palestinian struggles remains among the best recruiting posters for al-Qaida with young Muslim men.	84	0	1	struggle
eng_0081	eng	PL	prepare credit for the English and Singapore financial transactions?	PL	Which people in London	SG	Which person in London	Which people in London prepare credit for the English and Singapore financial transactions?	Which person in London prepare credit for the English and Singapore financial transactions?	85	0	6	person
eng_0081	eng	SG	prepares credit for the English and Singapore financial transactions?	SG	Which person in London	PL	Which people in London	Which person in London prepares credit for the English and Singapore financial transactions?	Which people in London prepares credit for the English and Singapore financial transactions?	85	0	6	person
eng_0083	eng	SG	"undermines the argument of both the ""bomb Iraq"" crowd and the liberals focused on Dr. Steve Hatfill who object to US biodefense research because they view it as being useful for offensive purposes."	SG	The reported finding at Dugway	PL	The reported findings at Dugway	"The reported finding at Dugway undermines the argument of both the ""bomb Iraq"" crowd and the liberals focused on Dr. Steve Hatfill who object to US biodefense research because they view it as being useful for offensive purposes."	"The reported findings at Dugway undermines the argument of both the ""bomb Iraq"" crowd and the liberals focused on Dr. Steve Hatfill who object to US biodefense research because they view it as being useful for offensive purposes."	88	0	3	finding
eng_0083	eng	PL	"undermine the argument of both the ""bomb Iraq"" crowd and the liberals focused on Dr. Steve Hatfill who object to US biodefense research because they view it as being useful for offensive purposes."	PL	The reported findings at Dugway	SG	The reported finding at Dugway	"The reported findings at Dugway undermine the argument of both the ""bomb Iraq"" crowd and the liberals focused on Dr. Steve Hatfill who object to US biodefense research because they view it as being useful for offensive purposes."	"The reported finding at Dugway undermine the argument of both the ""bomb Iraq"" crowd and the liberals focused on Dr. Steve Hatfill who object to US biodefense research because they view it as being useful for offensive purposes."	88	0	3	finding
eng_0084	eng	SG	debates how you prevent an anti-democratic force from winning a democratic election and abolishing democracy.	SG	Every student of political science	PL	All students of political science	Every student of political science debates how you prevent an anti-democratic force from winning a democratic election and abolishing democracy.	All students of political science debates how you prevent an anti-democratic force from winning a democratic election and abolishing democracy.	89	0	4	student
eng_0084	eng	PL	debate how you prevent an anti-democratic force from winning a democratic election and abolishing democracy.	PL	All students of political science	SG	Every student of political science	All students of political science debate how you prevent an anti-democratic force from winning a democratic election and abolishing democracy.	Every student of political science debate how you prevent an anti-democratic force from winning a democratic election and abolishing democracy.	89	0	4	student
eng_0086	eng	PL	"return the pretty ones we send them!"""	PL	"""Look how the academies"	SG	"""Look how the academy"	"""Look how the academies return the pretty ones we send them!"""	"""Look how the academy return the pretty ones we send them!"""	91	0	1	academy
eng_0086	eng	SG	"returns the pretty ones we send them!"""	SG	"""Look how the academy"	PL	"""Look how the academies"	"""Look how the academy returns the pretty ones we send them!"""	"""Look how the academies returns the pretty ones we send them!"""	91	0	1	academy
eng_0088	eng	PL	cater to the yuppie crowd.	PL	Food is awful and the places	SG	Food is awful and the place	Food is awful and the places cater to the yuppie crowd.	Food is awful and the place cater to the yuppie crowd.	93	0	1	place
eng_0088	eng	SG	caters to the yuppie crowd.	SG	Food is awful and the place	PL	Food is awful and the places	Food is awful and the place caters to the yuppie crowd.	Food is awful and the places caters to the yuppie crowd.	93	0	1	place
eng_0089	eng	PL	"list Shakespeare as one of ""the Principal Actors in all these Plays"", some of which were first staged after Volpone, although we can not know for certain which roles he played."	PL	The First Folios of 1623, however,	SG	The First Folio of 1623, however,	"The First Folios of 1623, however, list Shakespeare as one of ""the Principal Actors in all these Plays"", some of which were first staged after Volpone, although we can not know for certain which roles he played."	"The First Folio of 1623, however, list Shakespeare as one of ""the Principal Actors in all these Plays"", some of which were first staged after Volpone, although we can not know for certain which roles he played."	94	0	6	Folio
eng_0089	eng	SG	"lists Shakespeare as one of ""the Principal Actors in all these Plays"", some of which were first staged after Volpone, although we can not know for certain which roles he played."	SG	The First Folio of 1623, however,	PL	The First Folios of 1623, however,	"The First Folio of 1623, however, lists Shakespeare as one of ""the Principal Actors in all these Plays"", some of which were first staged after Volpone, although we can not know for certain which roles he played."	"The First Folios of 1623, however, lists Shakespeare as one of ""the Principal Actors in all these Plays"", some of which were first staged after Volpone, although we can not know for certain which roles he played."	94	0	6	Folio
eng_0090	eng	PL	narrate only a part of the war.	PL	All poems	SG	Each poem	All poems narrate only a part of the war.	Each poem narrate only a part of the war.	96	0	1	poem
eng_0090	eng	SG	narrates only a part of the war.	SG	Each poem	PL	All poems	Each poem narrates only a part of the war.	All poems narrates only a part of the war.	96	0	1	poem
eng_0091	eng	PL	safeguard the interests of rightholders and protect intellectual property.	PL	They are directives which	SG	It is a directive which	They are directives which safeguard the interests of rightholders and protect intellectual property.	It is a directive which safeguard the interests of rightholders and protect intellectual property.	98	0	1	which
eng_0091	eng	SG	safeguards the interests of rightholders and protects intellectual property.	SG	It is a directive which	PL	They are directives which	It is a directive which safeguards the interests of rightholders and protects intellectual property.	They are directives which safeguards the interests of rightholders and protects intellectual property.	98	0	1	which
eng_0092	eng	SG	marks the end of an unbelievable year.	SG	For Kerber, the season finale nevertheless	PL	For Kerber, the season finales nevertheless	For Kerber, the season finale nevertheless marks the end of an unbelievable year.	For Kerber, the season finales nevertheless marks the end of an unbelievable year.	99	0	2	finale
eng_0092	eng	PL	mark the end of an unbelievable year.	PL	For Kerber, the season finales nevertheless	SG	For Kerber, the season finale nevertheless	For Kerber, the season finales nevertheless mark the end of an unbelievable year.	For Kerber, the season finale nevertheless mark the end of an unbelievable year.	99	0	2	finale
eng_0093	eng	PL	"have ""caused apprehension among Tamils that preparations are under way for another war in the island""."	PL	She added that recent visits to the island by India's top military brass including army chief General Nirmal Chander Vij	SG	She added that a recent visit to the island by India's top military brass including army chief General Nirmal Chander Vij	"She added that recent visits to the island by India's top military brass including army chief General Nirmal Chander Vij have ""caused apprehension among Tamils that preparations are under way for another war in the island""."	"She added that a recent visit to the island by India's top military brass including army chief General Nirmal Chander Vij have ""caused apprehension among Tamils that preparations are under way for another war in the island""."	100	1	17	visit
eng_0093	eng	SG	"has ""caused apprehension among Tamils that preparations are under way for another war in the island""."	SG	She added that a recent visit to the island by India's top military brass including army chief General Nirmal Chander Vij	PL	She added that recent visits to the island by India's top military brass including army chief General Nirmal Chander Vij	"She added that a recent visit to the island by India's top military brass including army chief General Nirmal Chander Vij has ""caused apprehension among Tamils that preparations are under way for another war in the island""."	"She added that recent visits to the island by India's top military brass including army chief General Nirmal Chander Vij has ""caused apprehension among Tamils that preparations are under way for another war in the island""."	100	1	17	visit
eng_0095	eng	PL	have failed to account for our dependence on a healthy resource base, according to an assessment released today by the Worldwatch Institute.	PL	The overwhelming human and financial impacts of Hurricane Katrina are powerful evidence that political and economic decisions made in the United States and other countries	SG	The overwhelming human and financial impacts of Hurricane Katrina are powerful evidence that a political and economic decision made in the United States and other countries	The overwhelming human and financial impacts of Hurricane Katrina are powerful evidence that political and economic decisions made in the United States and other countries have failed to account for our dependence on a healthy resource base, according to an assessment released today by the Worldwatch Institute.	The overwhelming human and financial impacts of Hurricane Katrina are powerful evidence that a political and economic decision made in the United States and other countries have failed to account for our dependence on a healthy resource base, according to an assessment released today by the Worldwatch Institute.	102	1	9	decision
eng_0095	eng	SG	has failed to account for our dependence on a healthy resource base, according to an assessment released today by the Worldwatch Institute.	SG	The overwhelming human and financial impacts of Hurricane Katrina are powerful evidence that a political and economic decision made in the United States and other countries	PL	The overwhelming human and financial impacts of Hurricane Katrina are powerful evidence that political and economic decisions made in the United States and other countries	The overwhelming human and financial impacts of Hurricane Katrina are powerful evidence that a political and economic decision made in the United States and other countries has failed to account for our dependence on a healthy resource base, according to an assessment released today by the Worldwatch Institute.	The overwhelming human and financial impacts of Hurricane Katrina are powerful evidence that political and economic decisions made in the United States and other countries has failed to account for our dependence on a healthy resource base, according to an assessment released today by the Worldwatch Institute.	102	1	9	decision
eng_0096	eng	PL	are refusing to re-enlist.	PL	Soldiers with vital training and know-how	SG	A soldier with vital training and know-how	Soldiers with vital training and know-how are refusing to re-enlist.	A soldier with vital training and know-how are refusing to re-enlist.	103	1	8	soldier
eng_0096	eng	SG	is refusing to re-enlist.	SG	A soldier with vital training and know-how	PL	Soldiers with vital training and know-how	A soldier with vital training and know-how is refusing to re-enlist.	Soldiers with vital training and know-how is refusing to re-enlist.	103	1	8	soldier
eng_0098	eng	PL	have retired - the nation enjoys substantial military strength nonetheless.	PL	While Iran's conventional army is not what it was during the heyday of the Iran-Iraq war - their armaments have deteriorated and the veterans of that last war	SG	While Iran's conventional army is not what it was during the heyday of the Iran-Iraq war - their armaments have deteriorated and the veteran of that last war	While Iran's conventional army is not what it was during the heyday of the Iran-Iraq war - their armaments have deteriorated and the veterans of that last war have retired - the nation enjoys substantial military strength nonetheless.	While Iran's conventional army is not what it was during the heyday of the Iran-Iraq war - their armaments have deteriorated and the veteran of that last war have retired - the nation enjoys substantial military strength nonetheless.	106	1	5	veteran
eng_0098	eng	SG	has retired - the nation enjoys substantial military strength nonetheless.	SG	While Iran's conventional army is not what it was during the heyday of the Iran-Iraq war - their armaments have deteriorated and the veteran of that last war	PL	While Iran's conventional army is not what it was during the heyday of the Iran-Iraq war - their armaments have deteriorated and the veterans of that last war	While Iran's conventional army is not what it was during the heyday of the Iran-Iraq war - their armaments have deteriorated and the veteran of that last war has retired - the nation enjoys substantial military strength nonetheless.	While Iran's conventional army is not what it was during the heyday of the Iran-Iraq war - their armaments have deteriorated and the veterans of that last war has retired - the nation enjoys substantial military strength nonetheless.	106	1	5	veteran
eng_0100	eng	PL	have gobbled up credit for outcomes that they had little to do with, few have been as brazen as Colin Powell.	PL	While most U.S. secretaries of state -- save perhaps Dean Rusk --	SG	While the U.S. secretary of state -- save perhaps Dean Rusk --	While most U.S. secretaries of state -- save perhaps Dean Rusk -- have gobbled up credit for outcomes that they had little to do with, few have been as brazen as Colin Powell.	While the U.S. secretary of state -- save perhaps Dean Rusk -- have gobbled up credit for outcomes that they had little to do with, few have been as brazen as Colin Powell.	108	1	9	secretary
eng_0100	eng	SG	has gobbled up credit for outcomes that he had little to do with, few have been as brazen as Colin Powell.	SG	While the U.S. secretary of state -- save perhaps Dean Rusk --	PL	While most U.S. secretaries of state -- save perhaps Dean Rusk --	While the U.S. secretary of state -- save perhaps Dean Rusk -- has gobbled up credit for outcomes that he had little to do with, few have been as brazen as Colin Powell.	While most U.S. secretaries of state -- save perhaps Dean Rusk -- has gobbled up credit for outcomes that he had little to do with, few have been as brazen as Colin Powell.	108	1	9	secretary
eng_0101	eng	SG	doesn't know what they are, doesn't care, or knows perfectly well.	SG	One has to wonder whether the bright fellow in our government and military who set up the deals with these people	PL	One has to wonder whether the bright fellows in our government and military who set up the deals with these people	One has to wonder whether the bright fellow in our government and military who set up the deals with these people doesn't know what they are, doesn't care, or knows perfectly well.	One has to wonder whether the bright fellows in our government and military who set up the deals with these people doesn't know what they are, doesn't care, or knows perfectly well.	109	1	14	fellow
eng_0101	eng	PL	don't know what they are, don't care, or know perfectly well.	PL	One has to wonder whether the bright fellows in our government and military who set up the deals with these people	SG	One has to wonder whether the bright fellow in our government and military who set up the deals with these people	One has to wonder whether the bright fellows in our government and military who set up the deals with these people don't know what they are, don't care, or know perfectly well.	One has to wonder whether the bright fellow in our government and military who set up the deals with these people don't know what they are, don't care, or know perfectly well.	109	1	14	fellow
eng_0102	eng	PL	have had to cancel their participation.	PL	Due to business reasons, previously scheduled interviewers from the Penn team	SG	Due to business reasons, a previously scheduled interviewer from the Penn team	Due to business reasons, previously scheduled interviewers from the Penn team have had to cancel their participation.	Due to business reasons, a previously scheduled interviewer from the Penn team have had to cancel their participation.	110	1	5	interviewer
eng_0102	eng	SG	has had to cancel his or her participation.	SG	Due to business reasons, a previously scheduled interviewer from the Penn team	PL	Due to business reasons, previously scheduled interviewers from the Penn team	Due to business reasons, a previously scheduled interviewer from the Penn team has had to cancel his or her participation.	Due to business reasons, previously scheduled interviewers from the Penn team has had to cancel his or her participation.	110	1	5	interviewer
eng_0103	eng	PL	have proliferated.	PL	Armed militias, often staffed by former Iraqi military men with substantial training and experience,	SG	An armed militia, often staffed by former Iraqi military men with substantial training and experience,	Armed militias, often staffed by former Iraqi military men with substantial training and experience, have proliferated.	An armed militia, often staffed by former Iraqi military men with substantial training and experience, have proliferated.	111	1	15	militia
eng_0103	eng	SG	has proliferated.	SG	An armed militia, often staffed by former Iraqi military men with substantial training and experience,	PL	Armed militias, often staffed by former Iraqi military men with substantial training and experience,	An armed militia, often staffed by former Iraqi military men with substantial training and experience, has proliferated.	Armed militias, often staffed by former Iraqi military men with substantial training and experience, has proliferated.	111	1	15	militia
eng_0104	eng	PL	do not leave a person untouched.	PL	Again, decades of this sort of behavior	SG	Again, a decade of this sort of behavior	Again, decades of this sort of behavior do not leave a person untouched.	Again, a decade of this sort of behavior do not leave a person untouched.	112	1	6	decade
eng_0104	eng	SG	does not leave a person untouched.	SG	Again, a decade of this sort of behavior	PL	Again, decades of this sort of behavior	Again, a decade of this sort of behavior does not leave a person untouched.	Again, decades of this sort of behavior does not leave a person untouched.	112	1	6	decade
eng_0108	eng	PL	have actually uncovered the truth about George Bush's service in the Texas Air National Guard.	PL	Some reporters (you know, the ones with journalistic ethics)	SG	Some reporter (you know, the one with journalistic ethics)	Some reporters (you know, the ones with journalistic ethics) have actually uncovered the truth about George Bush's service in the Texas Air National Guard.	Some reporter (you know, the one with journalistic ethics) have actually uncovered the truth about George Bush's service in the Texas Air National Guard.	116	1	11	reporter
eng_0108	eng	SG	has actually uncovered the truth about George Bush's service in the Texas Air National Guard.	SG	Some reporter (you know, the one with journalistic ethics)	PL	Some reporters (you know, the ones with journalistic ethics)	Some reporter (you know, the one with journalistic ethics) has actually uncovered the truth about George Bush's service in the Texas Air National Guard.	Some reporters (you know, the ones with journalistic ethics) has actually uncovered the truth about George Bush's service in the Texas Air National Guard.	116	1	11	reporter
eng_0109	eng	PL	don't have what you want, contact your nearest comp.sources.unix archive, or the moderator.	PL	If the sites next to you	SG	If the site next to you	If the sites next to you don't have what you want, contact your nearest comp.sources.unix archive, or the moderator.	If the site next to you don't have what you want, contact your nearest comp.sources.unix archive, or the moderator.	117	0	4	site
eng_0109	eng	SG	doesn't have what you want, contact your nearest comp.sources.unix archive, or the moderator.	SG	If the site next to you	PL	If the sites next to you	If the site next to you doesn't have what you want, contact your nearest comp.sources.unix archive, or the moderator.	If the sites next to you doesn't have what you want, contact your nearest comp.sources.unix archive, or the moderator.	117	0	4	site
eng_0110	eng	SG	is calculating the reserve on the PSE swap.	SG	Further to my voicemail, our colleague in credit	PL	Further to my voicemail, our colleagues in credit	Further to my voicemail, our colleague in credit is calculating the reserve on the PSE swap.	Further to my voicemail, our colleagues in credit is calculating the reserve on the PSE swap.	118	0	3	colleague
