pair_id	language	target_number	continuation	good_prefix_type	good_prefix	bad_prefix_type	bad_prefix	good_sentence	bad_sentence	source_idx	has_attractor	distance	subject_lemma
eng_0000	eng	PL	verify this - it's the same for Canada, too.....	PL	The below sites from the US government	SG	The below site from the US government	The below sites from the US government verify this - it's the same for Canada, too.....	The below site from the US government verify this - it's the same for Canada, too.....	0	1	5	site
eng_0000	eng	SG	verifies this - it's the same for Canada, too.....	SG	The below site from the US government	PL	The below sites from the US government	The below site from the US government verifies this - it's the same for Canada, too.....	The below sites from the US government verifies this - it's the same for Canada, too.....	0	1	5	site
eng_0001	eng	PL	interpret or transform the XML data into a presentation format that can be recognized by another application, such as Service Advertising Protocol (SAP) or a custom purchase order format.	PL	Typically, a developer creates XSL transformation files that, when applied to an XML document during export,	SG	Typically, a developer creates an XSL transformation file that, when applied to an XML document during export,	Typically, a developer creates XSL transformation files that, when applied to an XML document during export, interpret or transform the XML data into a presentation format that can be recognized by another application, such as Service Advertising Protocol (SAP) or a custom purchase order format.	Typically, a developer creates an XSL transformation file that, when applied to an XML document during export, interpret or transform the XML data into a presentation format that can be recognized by another application, such as Service Advertising Protocol (SAP) or a custom purchase order format.	1	1	11	file
eng_0001	eng	SG	interprets or transforms the XML data into a presentation format that can be recognized by another application, such as Service Advertising Protocol (SAP) or a custom purchase order format.	SG	Typically, a developer creates an XSL transformation file that, when applied to an XML document during export,	PL	Typically, a developer creates XSL transformation files that, when applied to an XML document during export,	Typically, a developer creates an XSL transformation file that, when applied to an XML document during export, interprets or transforms the XML data into a presentation format that can be recognized by another application, such as Service Advertising Protocol (SAP) or a custom purchase order format.	Typically, a developer creates XSL transformation files that, when applied to an XML document during export, interprets or transforms the XML data into a presentation format that can be recognized by another application, such as Service Advertising Protocol (SAP) or a custom purchase order format.	1	1	11	file
eng_0003	eng	PL	point toward a grim and painful future?	PL	Can you accept that the roads we are travelling	SG	Can you accept that the road we are travelling	Can you accept that the roads we are travelling point toward a grim and painful future?	Can you accept that the road we are travelling point toward a grim and painful future?	3	1	4	road
eng_0003	eng	SG	points toward a grim and painful future?	SG	Can you accept that the road we are travelling	PL	Can you accept that the roads we are travelling	Can you accept that the road we are travelling points toward a grim and painful future?	Can you accept that the roads we are travelling points toward a grim and painful future?	3	1	4	road
eng_0004	eng	PL	proceed progressively from more to less contained conditions – from the laboratory to confined trials to limited field trials.	PL	Scientific research projects to develop products like irradiated sterile insects or the Oxitec mosquitoes	SG	A scientific research project to develop products like irradiated sterile insects or the Oxitec mosquitoes	Scientific research projects to develop products like irradiated sterile insects or the Oxitec mosquitoes proceed progressively from more to less contained conditions – from the laboratory to confined trials to limited field trials.	A scientific research project to develop products like irradiated sterile insects or the Oxitec mosquitoes proceed progressively from more to less contained conditions – from the laboratory to confined trials to limited field trials.	4	1	12	research
eng_0004	eng	SG	proceeds progressively from more to less contained conditions – from the laboratory to confined trials to limited field trials.	SG	A scientific research project to develop products like irradiated sterile insects or the Oxitec mosquitoes	PL	Scientific research projects to develop products like irradiated sterile insects or the Oxitec mosquitoes	A scientific research project to develop products like irradiated sterile insects or the Oxitec mosquitoes proceeds progressively from more to less contained conditions – from the laboratory to confined trials to limited field trials.	Scientific research projects to develop products like irradiated sterile insects or the Oxitec mosquitoes proceeds progressively from more to less contained conditions – from the laboratory to confined trials to limited field trials.	4	1	12	research
eng_0005	eng	PL	strengthen the realist representation.	PL	Balzac's uses of repeating characters, moving in and out of the Comédie's books,	SG	Balzac's use of repeating characters, moving in and out of the Comédie's books,	Balzac's uses of repeating characters, moving in and out of the Comédie's books, strengthen the realist representation.	Balzac's use of repeating characters, moving in and out of the Comédie's books, strengthen the realist representation.	5	1	15	use
eng_0005	eng	SG	strengthens the realist representation.	SG	Balzac's use of repeating characters, moving in and out of the Comédie's books,	PL	Balzac's uses of repeating characters, moving in and out of the Comédie's books,	Balzac's use of repeating characters, moving in and out of the Comédie's books, strengthens the realist representation.	Balzac's uses of repeating characters, moving in and out of the Comédie's books, strengthens the realist representation.	5	1	15	use
eng_0006	eng	SG	troubles modern critics and directors.	SG	Like The Two Gentlemen of Verona, in which two friends appear to approve of rape, the Shrew's story of the taming of a woman's independent spirit by a man sometimes	PL	Like The Two Gentlemen of Verona, in which two friends appear to approve of rape, the Shrew's stories of the taming of a woman's independent spirit by a man sometimes	Like The Two Gentlemen of Verona, in which two friends appear to approve of rape, the Shrew's story of the taming of a woman's independent spirit by a man sometimes troubles modern critics and directors.	Like The Two Gentlemen of Verona, in which two friends appear to approve of rape, the Shrew's stories of the taming of a woman's independent spirit by a man sometimes troubles modern critics and directors.	6	1	14	story
eng_0006	eng	PL	trouble modern critics and directors.	PL	Like The Two Gentlemen of Verona, in which two friends appear to approve of rape, the Shrew's stories of the taming of a woman's independent spirit by a man sometimes	SG	Like The Two Gentlemen of Verona, in which two friends appear to approve of rape, the Shrew's story of the taming of a woman's independent spirit by a man sometimes	Like The Two Gentlemen of Verona, in which two friends appear to approve of rape, the Shrew's stories of the taming of a woman's independent spirit by a man sometimes trouble modern critics and directors.	Like The Two Gentlemen of Verona, in which two friends appear to approve of rape, the Shrew's story of the taming of a woman's independent spirit by a man sometimes trouble modern critics and directors.	6	1	14	story
eng_0007	eng	PL	prevent you from seeing things in any perspective whatsoever.	PL	The feelings of being swept along and of uncertainty as regards the future	SG	The feeling of being swept along and of uncertainty as regards the future	The feelings of being swept along and of uncertainty as regards the future prevent you from seeing things in any perspective whatsoever.	The feeling of being swept along and of uncertainty as regards the future prevent you from seeing things in any perspective whatsoever.	7	1	12	feeling
eng_0007	eng	SG	prevents you from seeing things in any perspective whatsoever.	SG	The feeling of being swept along and of uncertainty as regards the future	PL	The feelings of being swept along and of uncertainty as regards the future	The feeling of being swept along and of uncertainty as regards the future prevents you from seeing things in any perspective whatsoever.	The feelings of being swept along and of uncertainty as regards the future prevents you from seeing things in any perspective whatsoever.	7	1	12	feeling
eng_0009	eng	PL	fade into the background.	PL	Your love life is full, and any dissatisfactions with career and money matters	SG	Your love life is full, and any dissatisfaction with career and money matters	Your love life is full, and any dissatisfactions with career and money matters fade into the background.	Your love life is full, and any dissatisfaction with career and money matters fade into the background.	9	1	6	dissatisfaction
eng_0009	eng	SG	fades into the background.	SG	Your love life is full, and any dissatisfaction with career and money matters	PL	Your love life is full, and any dissatisfactions with career and money matters	Your love life is full, and any dissatisfaction with career and money matters fades into the background.	Your love life is full, and any dissatisfactions with career and money matters fades into the background.	9	1	6	dissatisfaction
eng_0012	eng	PL	persist, so that a 25% deceleration, to a 7-8% annual rate, is perceived as somehow heralding the end of the modern world's greatest development story.	PL	Yet superficial fixations on China's headline GDP growth	SG	Yet a superficial fixation on China's headline GDP growth	Yet superficial fixations on China's headline GDP growth persist, so that a 25% deceleration, to a 7-8% annual rate, is perceived as somehow heralding the end of the modern world's greatest development story.	Yet a superficial fixation on China's headline GDP growth persist, so that a 25% deceleration, to a 7-8% annual rate, is perceived as somehow heralding the end of the modern world's greatest development story.	12	1	7	fixation
eng_0012	eng	SG	persists, so that a 25% deceleration, to a 7-8% annual rate, is perceived as somehow heralding the end of the modern world's greatest development story.	SG	Yet a superficial fixation on China's headline GDP growth	PL	Yet superficial fixations on China's headline GDP growth	Yet a superficial fixation on China's headline GDP growth persists, so that a 25% deceleration, to a 7-8% annual rate, is perceived as somehow heralding the end of the modern world's greatest development story.	Yet superficial fixations on China's headline GDP growth persists, so that a 25% deceleration, to a 7-8% annual rate, is perceived as somehow heralding the end of the modern world's greatest development story.	12	1	7	fixation
eng_0013	eng	PL	precede x, as x is in T.	PL	Then all elements of S strictly	SG	Then every element of S strictly	Then all elements of S strictly precede x, as x is in T.	Then every element of S strictly precede x, as x is in T.	13	1	4	element
eng_0013	eng	SG	precedes x, as x is in T.	SG	Then every element of S strictly	PL	Then all elements of S strictly	Then every element of S strictly precedes x, as x is in T.	Then all elements of S strictly precedes x, as x is in T.	13	1	4	element
eng_0016	eng	PL	determine the design of the data access page.	PL	The default views – the views in which the object is open when you carry out the Save As command –	SG	The default view – the view in which the object is open when you carry out the Save As command –	The default views – the views in which the object is open when you carry out the Save As command – determine the design of the data access page.	The default view – the view in which the object is open when you carry out the Save As command – determine the design of the data access page.	16	1	19	view
eng_0016	eng	SG	determines the design of the data access page.	SG	The default view – the view in which the object is open when you carry out the Save As command –	PL	The default views – the views in which the object is open when you carry out the Save As command –	The default view – the view in which the object is open when you carry out the Save As command – determines the design of the data access page.	The default views – the views in which the object is open when you carry out the Save As command – determines the design of the data access page.	16	1	19	view
eng_0017	eng	PL	signal a beginning of hibernation.	PL	If the snake is not pregnant or shedding, and its enclosure is properly equipped, losses of appetite probably	SG	If the snake is not pregnant or shedding, and its enclosure is properly equipped, a loss of appetite probably	If the snake is not pregnant or shedding, and its enclosure is properly equipped, losses of appetite probably signal a beginning of hibernation.	If the snake is not pregnant or shedding, and its enclosure is properly equipped, a loss of appetite probably signal a beginning of hibernation.	17	1	4	loss
eng_0017	eng	SG	signals a beginning of hibernation.	SG	If the snake is not pregnant or shedding, and its enclosure is properly equipped, a loss of appetite probably	PL	If the snake is not pregnant or shedding, and its enclosure is properly equipped, losses of appetite probably	If the snake is not pregnant or shedding, and its enclosure is properly equipped, a loss of appetite probably signals a beginning of hibernation.	If the snake is not pregnant or shedding, and its enclosure is properly equipped, losses of appetite probably signals a beginning of hibernation.	17	1	4	loss
eng_0018	eng	SG	precedes x, as x is in T.	SG	Also, every element of S strictly	PL	Also, all elements of S strictly	Also, every element of S strictly precedes x, as x is in T.	Also, all elements of S strictly precedes x, as x is in T.	18	1	4	element
eng_0018	eng	PL	precede x, as x is in T.	PL	Also, all elements of S strictly	SG	Also, every element of S strictly	Also, all elements of S strictly precede x, as x is in T.	Also, every element of S strictly precede x, as x is in T.	18	1	4	element
eng_0019	eng	PL	hoist him by his own petard.	PL	The problem with this argument is that Bush lacked the experience necessary to be president when he ran in 2000, so these sorts of cheap shots just	SG	The problem with this argument is that Bush lacked the experience necessary to be president when he ran in 2000, so this sort of cheap shot just	The problem with this argument is that Bush lacked the experience necessary to be president when he ran in 2000, so these sorts of cheap shots just hoist him by his own petard.	The problem with this argument is that Bush lacked the experience necessary to be president when he ran in 2000, so this sort of cheap shot just hoist him by his own petard.	19	1	5	sort
eng_0019	eng	SG	hoists him by his own petard.	SG	The problem with this argument is that Bush lacked the experience necessary to be president when he ran in 2000, so this sort of cheap shot just	PL	The problem with this argument is that Bush lacked the experience necessary to be president when he ran in 2000, so these sorts of cheap shots just	The problem with this argument is that Bush lacked the experience necessary to be president when he ran in 2000, so this sort of cheap shot just hoists him by his own petard.	The problem with this argument is that Bush lacked the experience necessary to be president when he ran in 2000, so these sorts of cheap shots just hoists him by his own petard.	19	1	5	sort
eng_0020	eng	PL	envisage the convergence of living conditions towards the highest common denominator.	PL	Our projects for a Europe that aims to satisfy social needs	SG	Our project for a Europe that aims to satisfy social needs	Our projects for a Europe that aims to satisfy social needs envisage the convergence of living conditions towards the highest common denominator.	Our project for a Europe that aims to satisfy social needs envisage the convergence of living conditions towards the highest common denominator.	20	1	10	project
eng_0020	eng	SG	envisages the convergence of living conditions towards the highest common denominator.	SG	Our project for a Europe that aims to satisfy social needs	PL	Our projects for a Europe that aims to satisfy social needs	Our project for a Europe that aims to satisfy social needs envisages the convergence of living conditions towards the highest common denominator.	Our projects for a Europe that aims to satisfy social needs envisages the convergence of living conditions towards the highest common denominator.	20	1	10	project
eng_0022	eng	PL	commit just about every sin an online marketer could commit, and make up a few new ones besides.	PL	Let me join the chorus of annoyance over Google's new toolbars, which, as noted in the linked article,	SG	Let me join the chorus of annoyance over Google's new toolbar, which, as noted in the linked article,	Let me join the chorus of annoyance over Google's new toolbars, which, as noted in the linked article, commit just about every sin an online marketer could commit, and make up a few new ones besides.	Let me join the chorus of annoyance over Google's new toolbar, which, as noted in the linked article, commit just about every sin an online marketer could commit, and make up a few new ones besides.	22	1	9	toolbar
eng_0022	eng	SG	commits just about every sin an online marketer could commit, and makes up a few new ones besides.	SG	Let me join the chorus of annoyance over Google's new toolbar, which, as noted in the linked article,	PL	Let me join the chorus of annoyance over Google's new toolbars, which, as noted in the linked article,	Let me join the chorus of annoyance over Google's new toolbar, which, as noted in the linked article, commits just about every sin an online marketer could commit, and makes up a few new ones besides.	Let me join the chorus of annoyance over Google's new toolbars, which, as noted in the linked article, commits just about every sin an online marketer could commit, and makes up a few new ones besides.	22	1	9	toolbar
eng_0023	eng	PL	crystallize the issues, and we will try to talk to as many of you as possible before the meeting to go through them.	PL	In the next week or so, we'll be sending around discussion papers which we hope	SG	In the next week or so, we'll be sending around a discussion paper which we hope	In the next week or so, we'll be sending around discussion papers which we hope crystallize the issues, and we will try to talk to as many of you as possible before the meeting to go through them.	In the next week or so, we'll be sending around a discussion paper which we hope crystallize the issues, and we will try to talk to as many of you as possible before the meeting to go through them.	23	1	3	which
eng_0023	eng	SG	crystallizes the issues, and we will try to talk to as many of you as possible before the meeting to go through it.	SG	In the next week or so, we'll be sending around a discussion paper which we hope	PL	In the next week or so, we'll be sending around discussion papers which we hope	In the next week or so, we'll be sending around a discussion paper which we hope crystallizes the issues, and we will try to talk to as many of you as possible before the meeting to go through it.	In the next week or so, we'll be sending around discussion papers which we hope crystallizes the issues, and we will try to talk to as many of you as possible before the meeting to go through it.	23	1	3	which
eng_0024	eng	PL	aim to raise the female employment rate to 62% by 2017, through the provision of affordable, high-quality childcare facilities and expanded paid parental leave, among other measures.	PL	Indeed, its three-year plans for economic innovation, announced in February,	SG	Indeed, its three-year plan for economic innovation, announced in February,	Indeed, its three-year plans for economic innovation, announced in February, aim to raise the female employment rate to 62% by 2017, through the provision of affordable, high-quality childcare facilities and expanded paid parental leave, among other measures.	Indeed, its three-year plan for economic innovation, announced in February, aim to raise the female employment rate to 62% by 2017, through the provision of affordable, high-quality childcare facilities and expanded paid parental leave, among other measures.	24	1	9	plan
eng_0024	eng	SG	aims to raise the female employment rate to 62% by 2017, through the provision of affordable, high-quality childcare facilities and expanded paid parental leave, among other measures.	SG	Indeed, its three-year plan for economic innovation, announced in February,	PL	Indeed, its three-year plans for economic innovation, announced in February,	Indeed, its three-year plan for economic innovation, announced in February, aims to raise the female employment rate to 62% by 2017, through the provision of affordable, high-quality childcare facilities and expanded paid parental leave, among other measures.	Indeed, its three-year plans for economic innovation, announced in February, aims to raise the female employment rate to 62% by 2017, through the provision of affordable, high-quality childcare facilities and expanded paid parental leave, among other measures.	24	1	9	plan
eng_0027	eng	SG	produces a mushroom - it bursts through with such ferocity that it can break asphalt.	SG	The mycelium, in the right conditions,	PL	The mycelia, in the right conditions,	The mycelium, in the right conditions, produces a mushroom - it bursts through with such ferocity that it can break asphalt.	The mycelia, in the right conditions, produces a mushroom - it bursts through with such ferocity that it can break asphalt.	27	1	7	mycelium
eng_0027	eng	PL	produce mushrooms - they burst through with such ferocity that they can break asphalt.	PL	The mycelia, in the right conditions,	SG	The mycelium, in the right conditions,	The mycelia, in the right conditions, produce mushrooms - they burst through with such ferocity that they can break asphalt.	The mycelium, in the right conditions, produce mushrooms - they burst through with such ferocity that they can break asphalt.	27	1	7	mycelium
eng_0028	eng	PL	reveal that the play had been acted by three different troupes.	PL	The title pages of the 1594 edition of Titus Andronicus	SG	The title page of the 1594 edition of Titus Andronicus	The title pages of the 1594 edition of Titus Andronicus reveal that the play had been acted by three different troupes.	The title page of the 1594 edition of Titus Andronicus reveal that the play had been acted by three different troupes.	28	1	8	page
eng_0028	eng	SG	reveals that the play had been acted by three different troupes.	SG	The title page of the 1594 edition of Titus Andronicus	PL	The title pages of the 1594 edition of Titus Andronicus	The title page of the 1594 edition of Titus Andronicus reveals that the play had been acted by three different troupes.	The title pages of the 1594 edition of Titus Andronicus reveals that the play had been acted by three different troupes.	28	1	8	page
eng_0029	eng	PL	clash with everything else in the shot.	PL	In the photo on the couch, the pillows she is resting on	SG	In the photo on the couch, the pillow she is resting on	In the photo on the couch, the pillows she is resting on clash with everything else in the shot.	In the photo on the couch, the pillow she is resting on clash with everything else in the shot.	29	1	5	pillow
eng_0029	eng	SG	clashes with everything else in the shot.	SG	In the photo on the couch, the pillow she is resting on	PL	In the photo on the couch, the pillows she is resting on	In the photo on the couch, the pillow she is resting on clashes with everything else in the shot.	In the photo on the couch, the pillows she is resting on clashes with everything else in the shot.	29	1	5	pillow
eng_0031	eng	PL	aim to reduce the environmental impacts of products across the whole of their life cycle.	PL	(11) The approaches set out in the Green Paper on Integrated Product Policy, which are major innovative elements of the Sixth Community Environment Action Programme,	SG	(11) The approach set out in the Green Paper on Integrated Product Policy, which is a major innovative element of the Sixth Community Environment Action Programme,	(11) The approaches set out in the Green Paper on Integrated Product Policy, which are major innovative elements of the Sixth Community Environment Action Programme, aim to reduce the environmental impacts of products across the whole of their life cycle.	(11) The approach set out in the Green Paper on Integrated Product Policy, which is a major innovative element of the Sixth Community Environment Action Programme, aim to reduce the environmental impacts of products across the whole of their life cycle.	31	1	26	approach
