pair_id	language	target_number	continuation	good_prefix_type	good_prefix	bad_prefix_type	bad_prefix	good_sentence	bad_sentence	source_idx	has_attractor	distance	subject_lemma
eng_0143	eng	SG	has made appropriate decisions about the structure and content of the courses they teach, and teachers must trust that the assignments that students turn in are their own.	SG	For example, students must trust that the teacher	PL	For example, students must trust that teachers	For example, students must trust that the teacher has made appropriate decisions about the structure and content of the courses they teach, and teachers must trust that the assignments that students turn in are their own.	For example, students must trust that teachers has made appropriate decisions about the structure and content of the courses they teach, and teachers must trust that the assignments that students turn in are their own.	151	0	1	teacher
eng_0144	eng	SG	has become a nest of terrorists involved in the shipment of drugs and arms.	SG	As a result, north of the Andaman Islands, a Bangladeshi coastal area	PL	As a result, north of the Andaman Islands, Bangladeshi coastal areas	As a result, north of the Andaman Islands, a Bangladeshi coastal area has become a nest of terrorists involved in the shipment of drugs and arms.	As a result, north of the Andaman Islands, Bangladeshi coastal areas has become a nest of terrorists involved in the shipment of drugs and arms.	152	0	1	area
eng_0144	eng	PL	have become nests of terrorists involved in the shipment of drugs and arms.	PL	As a result, north of the Andaman Islands, Bangladeshi coastal areas	SG	As a result, north of the Andaman Islands, a Bangladeshi coastal area	As a result, north of the Andaman Islands, Bangladeshi coastal areas have become nests of terrorists involved in the shipment of drugs and arms.	As a result, north of the Andaman Islands, a Bangladeshi coastal area have become nests of terrorists involved in the shipment of drugs and arms.	152	0	1	area
eng_0145	eng	SG	is facing Stokes Street and close to the Bascom Light Rail, the location is surprisingly quiet.	SG	Although the apartment	PL	Although the apartments	Although the apartment is facing Stokes Street and close to the Bascom Light Rail, the location is surprisingly quiet.	Although the apartments is facing Stokes Street and close to the Bascom Light Rail, the location is surprisingly quiet.	153	0	1	apartment
eng_0145	eng	PL	are facing Stokes Street and close to the Bascom Light Rail, the location is surprisingly quiet.	PL	Although the apartments	SG	Although the apartment	Although the apartments are facing Stokes Street and close to the Bascom Light Rail, the location is surprisingly quiet.	Although the apartment are facing Stokes Street and close to the Bascom Light Rail, the location is surprisingly quiet.	153	0	1	apartment
eng_0147	eng	SG	does not operate well when drunk or high because the beam often does not show up on the target.	SG	While it is extremely accurate, laser sight	PL	While they are extremely accurate, laser sights	While it is extremely accurate, laser sight does not operate well when drunk or high because the beam often does not show up on the target.	While they are extremely accurate, laser sights does not operate well when drunk or high because the beam often does not show up on the target.	155	0	1	sight
eng_0147	eng	PL	do not operate well when drunk or high because the beam often does not show up on the target.	PL	While they are extremely accurate, laser sights	SG	While it is extremely accurate, laser sight	While they are extremely accurate, laser sights do not operate well when drunk or high because the beam often does not show up on the target.	While it is extremely accurate, laser sight do not operate well when drunk or high because the beam often does not show up on the target.	155	0	1	sight
eng_0148	eng	SG	has already headed out for Fallujah, though it returned later.	SG	Mosques are calling for donating blood, food, and medicine for Fallujah, and a convoy	PL	Mosques are calling for donating blood, food, and medicine for Fallujah, and convoys	Mosques are calling for donating blood, food, and medicine for Fallujah, and a convoy has already headed out for Fallujah, though it returned later.	Mosques are calling for donating blood, food, and medicine for Fallujah, and convoys has already headed out for Fallujah, though it returned later.	156	0	1	convoy
eng_0148	eng	PL	have already headed out for Fallujah, though they returned later.	PL	Mosques are calling for donating blood, food, and medicine for Fallujah, and convoys	SG	Mosques are calling for donating blood, food, and medicine for Fallujah, and a convoy	Mosques are calling for donating blood, food, and medicine for Fallujah, and convoys have already headed out for Fallujah, though they returned later.	Mosques are calling for donating blood, food, and medicine for Fallujah, and a convoy have already headed out for Fallujah, though they returned later.	156	0	1	convoy
eng_0150	eng	SG	is already leading to power cuts in the big cities.	SG	A shortage	PL	Shortages	A shortage is already leading to power cuts in the big cities.	Shortages is already leading to power cuts in the big cities.	158	0	1	shortage
eng_0150	eng	PL	are already leading to power cuts in the big cities.	PL	Shortages	SG	A shortage	Shortages are already leading to power cuts in the big cities.	A shortage are already leading to power cuts in the big cities.	158	0	1	shortage
eng_0151	eng	PL	have been humming since before the New Year with reports that the Bush administration is planning an attack on Iran.	PL	The wires	SG	The wire	The wires have been humming since before the New Year with reports that the Bush administration is planning an attack on Iran.	The wire have been humming since before the New Year with reports that the Bush administration is planning an attack on Iran.	159	0	1	wire
eng_0151	eng	SG	has been humming since before the New Year with reports that the Bush administration is planning an attack on Iran.	SG	The wire	PL	The wires	The wire has been humming since before the New Year with reports that the Bush administration is planning an attack on Iran.	The wires has been humming since before the New Year with reports that the Bush administration is planning an attack on Iran.	159	0	1	wire
eng_0152	eng	SG	is succumbing to radiation poisoning.	SG	As a parent, I can well imagine how painful it must be for those families whose child	PL	As a parent, I can well imagine how painful it must be for those families whose children	As a parent, I can well imagine how painful it must be for those families whose child is succumbing to radiation poisoning.	As a parent, I can well imagine how painful it must be for those families whose children is succumbing to radiation poisoning.	160	0	1	child
eng_0152	eng	PL	are succumbing to radiation poisoning.	PL	As a parent, I can well imagine how painful it must be for those families whose children	SG	As a parent, I can well imagine how painful it must be for those families whose child	As a parent, I can well imagine how painful it must be for those families whose children are succumbing to radiation poisoning.	As a parent, I can well imagine how painful it must be for those families whose child are succumbing to radiation poisoning.	160	0	1	child
eng_0153	eng	SG	has existed in the southwestern US under the watchful yet fairly benign eye of authorities ever since a sect known as the Fundamentalist Latter Day Saints (FLDS) separated itself from mainstream Mormonism in 1890.	SG	A small polygamous group	PL	Small polygamous groups	A small polygamous group has existed in the southwestern US under the watchful yet fairly benign eye of authorities ever since a sect known as the Fundamentalist Latter Day Saints (FLDS) separated itself from mainstream Mormonism in 1890.	Small polygamous groups has existed in the southwestern US under the watchful yet fairly benign eye of authorities ever since a sect known as the Fundamentalist Latter Day Saints (FLDS) separated itself from mainstream Mormonism in 1890.	161	0	1	group
eng_0153	eng	PL	have existed in the southwestern US under the watchful yet fairly benign eye of authorities ever since a sect known as the Fundamentalist Latter Day Saints (FLDS) separated itself from mainstream Mormonism in 1890.	PL	Small polygamous groups	SG	A small polygamous group	Small polygamous groups have existed in the southwestern US under the watchful yet fairly benign eye of authorities ever since a sect known as the Fundamentalist Latter Day Saints (FLDS) separated itself from mainstream Mormonism in 1890.	A small polygamous group have existed in the southwestern US under the watchful yet fairly benign eye of authorities ever since a sect known as the Fundamentalist Latter Day Saints (FLDS) separated itself from mainstream Mormonism in 1890.	161	0	1	group
eng_0154	eng	SG	is dying, somewhere in this troubled world a slow, agonizing death.	SG	Right now, while we're sitting at our computers enjoying the internet, that innocent, beautiful, loving cat	PL	Right now, while we're sitting at our computers enjoying the internet, those innocent, beautiful, loving cats	Right now, while we're sitting at our computers enjoying the internet, that innocent, beautiful, loving cat is dying, somewhere in this troubled world a slow, agonizing death.	Right now, while we're sitting at our computers enjoying the internet, those innocent, beautiful, loving cats is dying, somewhere in this troubled world a slow, agonizing death.	162	0	2	cat
eng_0154	eng	PL	are dying, somewhere in this troubled world a slow, agonizing death.	PL	Right now, while we're sitting at our computers enjoying the internet, those innocent, beautiful, loving cats	SG	Right now, while we're sitting at our computers enjoying the internet, that innocent, beautiful, loving cat	Right now, while we're sitting at our computers enjoying the internet, those innocent, beautiful, loving cats are dying, somewhere in this troubled world a slow, agonizing death.	Right now, while we're sitting at our computers enjoying the internet, that innocent, beautiful, loving cat are dying, somewhere in this troubled world a slow, agonizing death.	162	0	2	cat
eng_0155	eng	SG	doesn't intend to use Gmail, and Google isn't even as popular as Yahoo! and AOL.	SG	As the survey cited in the above-linked article shows, the average Google user	PL	As the survey cited in the above-linked article shows, most Google users	As the survey cited in the above-linked article shows, the average Google user doesn't intend to use Gmail, and Google isn't even as popular as Yahoo! and AOL.	As the survey cited in the above-linked article shows, most Google users doesn't intend to use Gmail, and Google isn't even as popular as Yahoo! and AOL.	163	0	1	user
eng_0155	eng	PL	don't intend to use Gmail, and Google isn't even as popular as Yahoo! and AOL.	PL	As the survey cited in the above-linked article shows, most Google users	SG	As the survey cited in the above-linked article shows, the average Google user	As the survey cited in the above-linked article shows, most Google users don't intend to use Gmail, and Google isn't even as popular as Yahoo! and AOL.	As the survey cited in the above-linked article shows, the average Google user don't intend to use Gmail, and Google isn't even as popular as Yahoo! and AOL.	163	0	1	user
eng_0156	eng	SG	is pointing a few good things out:	SG	But a supporter	PL	But supporters	But a supporter is pointing a few good things out:	But supporters is pointing a few good things out:	164	0	1	supporter
eng_0156	eng	PL	are pointing a few good things out:	PL	But supporters	SG	But a supporter	But supporters are pointing a few good things out:	But a supporter are pointing a few good things out:	164	0	1	supporter
eng_0158	eng	PL	are asking what Edison intends for QFs and generators--asking about haircuts in particular--and Edison is side-stepping the questions.	PL	Investors	SG	An investor	Investors are asking what Edison intends for QFs and generators--asking about haircuts in particular--and Edison is side-stepping the questions.	An investor are asking what Edison intends for QFs and generators--asking about haircuts in particular--and Edison is side-stepping the questions.	166	0	1	investor
eng_0158	eng	SG	is asking what Edison intends for QFs and generators--asking about haircuts in particular--and Edison is side-stepping the questions.	SG	An investor	PL	Investors	An investor is asking what Edison intends for QFs and generators--asking about haircuts in particular--and Edison is side-stepping the questions.	Investors is asking what Edison intends for QFs and generators--asking about haircuts in particular--and Edison is side-stepping the questions.	166	0	1	investor
eng_0159	eng	SG	doesn't usually like cages.	SG	The bird must know that when you open the cage door it means that you will put him in the cage, and the bird	PL	The bird must know that when you open the cage door it means that you will put him in the cage, and birds	The bird must know that when you open the cage door it means that you will put him in the cage, and the bird doesn't usually like cages.	The bird must know that when you open the cage door it means that you will put him in the cage, and birds doesn't usually like cages.	167	0	1	bird
eng_0159	eng	PL	don't usually like cages.	PL	The bird must know that when you open the cage door it means that you will put him in the cage, and birds	SG	The bird must know that when you open the cage door it means that you will put him in the cage, and the bird	The bird must know that when you open the cage door it means that you will put him in the cage, and birds don't usually like cages.	The bird must know that when you open the cage door it means that you will put him in the cage, and the bird don't usually like cages.	167	0	1	bird
eng_0160	eng	SG	does not go to Ireland on holiday for the weather; it is unpredictable.	SG	A person	PL	People	A person does not go to Ireland on holiday for the weather; it is unpredictable.	People does not go to Ireland on holiday for the weather; it is unpredictable.	168	0	1	people
eng_0160	eng	PL	do not go to Ireland on holiday for the weather; it is unpredictable.	PL	People	SG	A person	People do not go to Ireland on holiday for the weather; it is unpredictable.	A person do not go to Ireland on holiday for the weather; it is unpredictable.	168	0	1	people
eng_0161	eng	SG	does NOT work on board but it gives you a 'walkie-talkie' kind of phone in your room that WILL work on board.	SG	A cell phone	PL	Cell phones	A cell phone does NOT work on board but it gives you a 'walkie-talkie' kind of phone in your room that WILL work on board.	Cell phones does NOT work on board but it gives you a 'walkie-talkie' kind of phone in your room that WILL work on board.	169	0	1	phone
eng_0161	eng	PL	do NOT work on board but they give you a 'walkie-talkie' kind of phone in your room that WILL work on board.	PL	Cell phones	SG	A cell phone	Cell phones do NOT work on board but they give you a 'walkie-talkie' kind of phone in your room that WILL work on board.	A cell phone do NOT work on board but they give you a 'walkie-talkie' kind of phone in your room that WILL work on board.	169	0	1	phone
eng_0162	eng	SG	does not have such burdensome requirements.	SG	These are short-term transactions, and requiring this documentation will cause us to lose business because a competitive alternative	PL	These are short-term transactions, and requiring this documentation will cause us to lose business because competitive alternatives	These are short-term transactions, and requiring this documentation will cause us to lose business because a competitive alternative does not have such burdensome requirements.	These are short-term transactions, and requiring this documentation will cause us to lose business because competitive alternatives does not have such burdensome requirements.	170	0	1	alternative
eng_0162	eng	PL	do not have such burdensome requirements.	PL	These are short-term transactions, and requiring this documentation will cause us to lose business because competitive alternatives	SG	These are short-term transactions, and requiring this documentation will cause us to lose business because a competitive alternative	These are short-term transactions, and requiring this documentation will cause us to lose business because competitive alternatives do not have such burdensome requirements.	These are short-term transactions, and requiring this documentation will cause us to lose business because a competitive alternative do not have such burdensome requirements.	170	0	1	alternative
eng_0163	eng	SG	is stealing non-essential goods, others are simply trying to find food and water.	SG	While a looter	PL	While looters	While a looter is stealing non-essential goods, others are simply trying to find food and water.	While looters is stealing non-essential goods, others are simply trying to find food and water.	171	0	1	looter
eng_0163	eng	PL	are stealing non-essential goods, others are simply trying to find food and water.	PL	While looters	SG	While a looter	While looters are stealing non-essential goods, others are simply trying to find food and water.	While a looter are stealing non-essential goods, others are simply trying to find food and water.	171	0	1	looter
eng_0164	eng	PL	are currently assuming that there is no correlation and may consequently be double dipping the credit reserve on this basis too.	PL	The credit guys	SG	The credit guy	The credit guys are currently assuming that there is no correlation and may consequently be double dipping the credit reserve on this basis too.	The credit guy are currently assuming that there is no correlation and may consequently be double dipping the credit reserve on this basis too.	172	0	1	guy
eng_0164	eng	SG	is currently assuming that there is no correlation and may consequently be double dipping the credit reserve on this basis too.	SG	The credit guy	PL	The credit guys	The credit guy is currently assuming that there is no correlation and may consequently be double dipping the credit reserve on this basis too.	The credit guys is currently assuming that there is no correlation and may consequently be double dipping the credit reserve on this basis too.	172	0	1	guy
eng_0165	eng	SG	"has set the mark of May on Wisconsin pastures, it is time to listen for the final proof of spring,"" wrote Aldo Leopold in ""A Sand County Almanac."""	SG	"""When dandelion"	PL	"""When dandelions"	"""When dandelion has set the mark of May on Wisconsin pastures, it is time to listen for the final proof of spring,"" wrote Aldo Leopold in ""A Sand County Almanac."""	"""When dandelions has set the mark of May on Wisconsin pastures, it is time to listen for the final proof of spring,"" wrote Aldo Leopold in ""A Sand County Almanac."""	173	0	1	dandelion
eng_0165	eng	PL	"have set the mark of May on Wisconsin pastures, it is time to listen for the final proof of spring,"" wrote Aldo Leopold in ""A Sand County Almanac."""	PL	"""When dandelions"	SG	"""When dandelion"	"""When dandelions have set the mark of May on Wisconsin pastures, it is time to listen for the final proof of spring,"" wrote Aldo Leopold in ""A Sand County Almanac."""	"""When dandelion have set the mark of May on Wisconsin pastures, it is time to listen for the final proof of spring,"" wrote Aldo Leopold in ""A Sand County Almanac."""	173	0	1	dandelion
eng_0166	eng	SG	has greatly benefited from the previous classes taught by Dr. William Schroeder and Dr. Luis Ibanez at RPI.	SG	Our Lecture Slide	PL	Our Lecture Slides	Our Lecture Slide has greatly benefited from the previous classes taught by Dr. William Schroeder and Dr. Luis Ibanez at RPI.	Our Lecture Slides has greatly benefited from the previous classes taught by Dr. William Schroeder and Dr. Luis Ibanez at RPI.	174	0	1	slide
eng_0166	eng	PL	have greatly benefited from the previous classes taught by Dr. William Schroeder and Dr. Luis Ibanez at RPI.	PL	Our Lecture Slides	SG	Our Lecture Slide	Our Lecture Slides have greatly benefited from the previous classes taught by Dr. William Schroeder and Dr. Luis Ibanez at RPI.	Our Lecture Slide have greatly benefited from the previous classes taught by Dr. William Schroeder and Dr. Luis Ibanez at RPI.	174	0	1	slide
eng_0168	eng	SG	has deteriorated and the veterans of that last war have retired - the nation enjoys substantial military strength nonetheless.	SG	While Iran's conventional army is not what it was during the heyday of the Iran-Iraq war - its armament	PL	While Iran's conventional army is not what it was during the heyday of the Iran-Iraq war - its armaments	While Iran's conventional army is not what it was during the heyday of the Iran-Iraq war - its armament has deteriorated and the veterans of that last war have retired - the nation enjoys substantial military strength nonetheless.	While Iran's conventional army is not what it was during the heyday of the Iran-Iraq war - its armaments has deteriorated and the veterans of that last war have retired - the nation enjoys substantial military strength nonetheless.	176	0	1	armament
eng_0168	eng	PL	have deteriorated and the veterans of that last war have retired - the nation enjoys substantial military strength nonetheless.	PL	While Iran's conventional army is not what it was during the heyday of the Iran-Iraq war - its armaments	SG	While Iran's conventional army is not what it was during the heyday of the Iran-Iraq war - its armament	While Iran's conventional army is not what it was during the heyday of the Iran-Iraq war - its armaments have deteriorated and the veterans of that last war have retired - the nation enjoys substantial military strength nonetheless.	While Iran's conventional army is not what it was during the heyday of the Iran-Iraq war - its armament have deteriorated and the veterans of that last war have retired - the nation enjoys substantial military strength nonetheless.	176	0	1	armament
eng_0169	eng	SG	is invoicing for this and I don't have an invoice for it.	SG	The company	PL	The companies	The company is invoicing for this and I don't have an invoice for it.	The companies is invoicing for this and I don't have an invoice for it.	177	0	1	company
eng_0169	eng	PL	are invoicing for this and I don't have an invoice for it.	PL	The companies	SG	The company	The companies are invoicing for this and I don't have an invoice for it.	The company are invoicing for this and I don't have an invoice for it.	177	0	1	company
eng_0170	eng	SG	doesn't show it on RTE Player	SG	The viewer	PL	The viewers	The viewer doesn't show it on RTE Player	The viewers doesn't show it on RTE Player	178	0	1	viewer
eng_0170	eng	PL	don't show it on RTE Player	PL	The viewers	SG	The viewer	The viewers don't show it on RTE Player	The viewer don't show it on RTE Player	178	0	1	viewer
eng_0172	eng	PL	are nesting nine days earlier.	PL	Tree swallows	SG	A tree swallow	Tree swallows are nesting nine days earlier.	A tree swallow are nesting nine days earlier.	180	0	1	swallow
eng_0172	eng	SG	is nesting nine days earlier.	SG	A tree swallow	PL	Tree swallows	A tree swallow is nesting nine days earlier.	Tree swallows is nesting nine days earlier.	180	0	1	swallow
eng_0174	eng	SG	is only hedging.	SG	In our case, the team	PL	In our case, the teams	In our case, the team is only hedging.	In our case, the teams is only hedging.	182	0	1	team
eng_0174	eng	PL	are only hedging.	PL	In our case, the teams	SG	In our case, the team	In our case, the teams are only hedging.	In our case, the team are only hedging.	182	0	1	team
eng_0175	eng	SG	has known that by denying the right of oppressed peoples to form and nurture families, he or she can kill the spirit of those peoples.	SG	Throughout history, a tyrant	PL	Throughout history, tyrants	Throughout history, a tyrant has known that by denying the right of oppressed peoples to form and nurture families, he or she can kill the spirit of those peoples.	Throughout history, tyrants has known that by denying the right of oppressed peoples to form and nurture families, he or she can kill the spirit of those peoples.	183	0	1	tyrant
eng_0175	eng	PL	have known that by denying the right of oppressed peoples to form and nurture families, they can kill the spirit of those peoples.	PL	Throughout history, tyrants	SG	Throughout history, a tyrant	Throughout history, tyrants have known that by denying the right of oppressed peoples to form and nurture families, they can kill the spirit of those peoples.	Throughout history, a tyrant have known that by denying the right of oppressed peoples to form and nurture families, they can kill the spirit of those peoples.	183	0	1	tyrant
eng_0177	eng	SG	doesn't really seem to enjoy what he or she is doing and it shows.	SG	The employee	PL	The employees	The employee doesn't really seem to enjoy what he or she is doing and it shows.	The employees doesn't really seem to enjoy what he or she is doing and it shows.	185	0	1	employee
eng_0177	eng	PL	don't really seem to enjoy what they are doing and it shows.	PL	The employees	SG	The employee	The employees don't really seem to enjoy what they are doing and it shows.	The employee don't really seem to enjoy what they are doing and it shows.	185	0	1	employee
eng_0178	eng	SG	is saying that China's efforts have gone beyond what is safe or even in its own interests.	SG	Increasingly, an analyst	PL	Increasingly, analysts	Increasingly, an analyst is saying that China's efforts have gone beyond what is safe or even in its own interests.	Increasingly, analysts is saying that China's efforts have gone beyond what is safe or even in its own interests.	186	0	1	analyst
